code,name,district_code,facility_type,source_uuid
01336,CSU-DM PUBLIC DE KPOUEBO,603,PB,SSSSSSSSSSSSSSSSSSSSSSSSSSSSSSSS1336
07140,CSUS-PMI PUBLIC DE TOUMODI,603,PB,SSSSSSSSSSSSSSSSSSSSSSSSSSSSSSSS7140
01908,CSUS-SSSU PUBLIC DE TOUMODI,603,PB,SSSSSSSSSSSSSSSSSSSSSSSSSSSSSSSS1908
01333,HG PUBLIC DE DJEKANOU,603,PB,SSSSSSSSSSSSSSSSSSSSSSSSSSSSSSSS1333
01338,HG PUBLIC DE TOUMODI,603,PB,SSSSSSSSSSSSSSSSSSSSSSSSSSSSSSSS1338
02009,INF-LC PUBLIC COLLÈGE MODERNE DE TOUMODI,603,PB,SSSSSSSSSSSSSSSSSSSSSSSSSSSSSSSS2009
01138,INF-LC PUBLIC LYCÉE MODERNE BAD DE TOUMODI,603,PB,SSSSSSSSSSSSSSSSSSSSSSSSSSSSSSSS1138
01615,INF-P PUBLIC PRISON CIVIL MAC DE TOUMODI,603,PB,SSSSSSSSSSSSSSSSSSSSSSSSSSSSSSSS1615
02622,INF-PV PRIVE BOUABRÉ DE TOUMODI,603,PV,SSSSSSSSSSSSSSSSSSSSSSSSSSSSSSSS2622
00864,INF-PV PRIVE DE NIAMKEKONANKRO,603,PV,SSSSSSSSSSSSSSSSSSSSSSSSSSSSSSSS0864
01913,INF-PV PRIVE LE BON BERGER DE TOUMODI,603,PV,SSSSSSSSSSSSSSSSSSSSSSSSSSSSSSSS1913
02621,INF-PV PRIVE SANITAS DE TOUMODI,603,PV,SSSSSSSSSSSSSSSSSSSSSSSSSSSSSSSS2621
02620,INF-PV PRIVE TIACOH DE TOUMODI,603,PV,SSSSSSSSSSSSSSSSSSSSSSSSSSSSSSSS2620
03107,CABINET D’OPTICIEN-LUNETIER MAJ OPTICIEN,604,PV,SSSSSSSSSSSSSSSSSSSSSSSSSSSSSSSS3107
09818,CABINET DE SOINS PRE-POST NATAL CT DE YAMOUSSOUKRO,604,PV,SSSSSSSSSSSSSSSSSSSSSSSSSSSSSSSS9818
03063,CS INFIRMIERS ESPÉRANCE DIVINE DE YAKRO,604,PV,SSSSSSSSSSSSSSSSSSSSSSSSSSSSSSSS3063
02800,CENTRE DE SOINS INFIRMIERS LA SAINTE TRINITE,604,PV,SSSSSSSSSSSSSSSSSSSSSSSSSSSSSSSS2800
03049,CENTRE DE SOINS INFIRMIERS NOTRE DAME DE LOURDES,604,PV,SSSSSSSSSSSSSSSSSSSSSSSSSSSSSSSS3049
02805,CENTRE DE SOINS INFIRMIERS TOSSETA,604,PV,SSSSSSSSSSSSSSSSSSSSSSSSSSSSSSSS2805
03064,CENTRE DE SOINS INFIRMIERS YIDJA,604,PV,SSSSSSSSSSSSSSSSSSSSSSSSSSSSSSSS3064
03405,CENTRE DE SOINS OBSTÉTRICAUX DU DENGUELÉ,604,PV,
02804,CENTRE DE SOINS OBSTÉTRICAUX LA PROVIDENCE,604,PV,SSSSSSSSSSSSSSSSSSSSSSSSSSSSSSSS2804
02803,CENTRE MEDICAL BETHEL	DE YAMOUSSOUKRO,604,PV,
03062,CENTRE MEDICAL CLOLAY DE YAMOUSSOUKRO,604,PV,SSSSSSSSSSSSSSSSSSSSSSSSSSSSSSSS3062
09819,CENTRE MEDICAL KOUILAND,604,PV,SSSSSSSSSSSSSSSSSSSSSSSSSSSSSSSS9819
09817,CENTRE MEDICO-SOCIAL LE WALE DE YAMOUSSOUKRO,604,PV,SSSSSSSSSSSSSSSSSSSSSSSSSSSSSSSS9817
01381,CHR PUBLIC DE YAMOUSSOUKRO,604,PB,SSSSSSSSSSSSSSSSSSSSSSSSSSSSSSSS1381
02802,CLINIQUE DE LA VIE,604,PV,SSSSSSSSSSSSSSSSSSSSSSSSSSSSSSSS2802
09831,CLINIQUE MEDICALE ALLIANCE,604,PV,SSSSSSSSSSSSSSSSSSSSSSSSSSSSSSSS9831
09732,CLINIQUE MEDICALE ENERGY DE YAMOUSSOUKRO,604,PV,SSSSSSSSSSSSSSSSSSSSSSSSSSSSSSSS9732
09733,CLINIQUE MEDICO-CHIRURGICALE LA GRACE DES LACS,604,PV,SSSSSSSSSSSSSSSSSSSSSSSSSSSSSSSS9733
09828,CM PRIVE EMMANUELLE DE YAMOUSSOUKRO,604,PV,SSSSSSSSSSSSSSSSSSSSSSSSSSSSSSSS9828
09824,CMS CONFESSIONNEL NOTRE DAME DE L'INCARNATION DE S,604,PV,SSSSSSSSSSSSSSSSSSSSSSSSSSSSSSSS9824
01921,CMS PRIVE SAINTE ANNE,604,PV,SSSSSSSSSSSSSSSSSSSSSSSSSSSSSSSS1921
03065,CMS PRIVE WALE DE TOUMBOKRO,604,PV,SSSSSSSSSSSSSSSSSSSSSSSSSSSSSSSS3065
02591,CSA EFA DE ZAMABAKRO,604,PB,SSSSSSSSSSSSSSSSSSSSSSSSSSSSSSSS2591
03372,CSA FORCES SPECIALES DE YAMOUSSOUKRO,604,PB,
02342,CSA GARDE REPUBLICAINE DE YAMOUSSOUKRO,604,PB,SSSSSSSSSSSSSSSSSSSSSSSSSSSSSSSS2342
02561,CSA GENDARMERIE DE YAMOUSSOUKRO,604,PB,SSSSSSSSSSSSSSSSSSSSSSSSSSSSSSSS2561
02343,CSA GSPM DE YAMOUSSOUKRO,604,PB,SSSSSSSSSSSSSSSSSSSSSSSSSSSSSSSS2343
02763,CSR-D PUBLIC DE ALLANGOUA N'GBESSOU,604,PB,SSSSSSSSSSSSSSSSSSSSSSSSSSSSSSSS2763
00713,CSR-D PUBLIC DE DUOKRO,604,PB,SSSSSSSSSSSSSSSSSSSSSSSSSSSSSSSS0713
01922,CSR-D PUBLIC DE KROUKROUBO,604,PB,SSSSSSSSSSSSSSSSSSSSSSSSSSSSSSSS1922
02661,CSR-D PUBLIC DE MAHOUNOU-AKOUE,604,PB,SSSSSSSSSSSSSSSSSSSSSSSSSSSSSSSS2661
00160,CSR-D PUBLIC DE YABRA,604,PB,SSSSSSSSSSSSSSSSSSSSSSSSSSSSSSSS0160
02008,CSR-DM DE PUBLIC DE ZAMBAKRO,604,PB,SSSSSSSSSSSSSSSSSSSSSSSSSSSSSSSS2008
09829,CSR-DM PUBLIC D' ASSANOU DE YAMOUSSOKRO,604,PB,SSSSSSSSSSSSSSSSSSSSSSSSSSSSSSSS9829
01374,CSR-DM PUBLIC DE AKPESSEKRO,604,PB,SSSSSSSSSSSSSSSSSSSSSSSSSSSSSSSS1374
02004,CSR-DM PUBLIC DE BONZI,604,PB,SSSSSSSSSSSSSSSSSSSSSSSSSSSSSSSS2004
03341,CSR-DM PUBLIC DE DJAMALABO,604,PB,
03340,CSR-DM PUBLIC DE KACOUBROUKRO,604,PB,
01377,CSR-DM PUBLIC DE KONGOUANOU,604,PB,SSSSSSSSSSSSSSSSSSSSSSSSSSSSSSSS1377
01755,CSR-DM PUBLIC DE LABOKRO,604,PB,SSSSSSSSSSSSSSSSSSSSSSSSSSSSSSSS1755
00802,CSR-DM PUBLIC DE LOGBAKRO,604,PB,SSSSSSSSSSSSSSSSSSSSSSSSSSSSSSSS0802
02007,CSR-DM PUBLIC DE N'GATTAKRO (DIST. YAMOUSSOUKRO),604,PB,SSSSSSSSSSSSSSSSSSSSSSSSSSSSSSSS2007
01799,CSR-DM PUBLIC DE N'ZERE,604,PB,SSSSSSSSSSSSSSSSSSSSSSSSSSSSSSSS1799
01379,CSR-DM PUBLIC DE OUFFOUE-DJEKRO,604,PB,SSSSSSSSSSSSSSSSSSSSSSSSSSSSSSSS1379
02006,CSR-DM PUBLIC DE SAHABO,604,PB,SSSSSSSSSSSSSSSSSSSSSSSSSSSSSSSS2006
01800,CSR-DM PUBLIC DE SAKIARE,604,PB,SSSSSSSSSSSSSSSSSSSSSSSSSSSSSSSS1800
00827,CSR-DM PUBLIC DE SEMAN,604,PB,SSSSSSSSSSSSSSSSSSSSSSSSSSSSSSSS0827
01380,CSR-DM PUBLIC DE TOUMBOKRO,604,PB,SSSSSSSSSSSSSSSSSSSSSSSSSSSSSSSS1380
02930,CSR-DM PUBLIC DE TOUNZUEBO,604,PB,SSSSSSSSSSSSSSSSSSSSSSSSSSSSSSSS2930
03306,CSR-DM PUBLIC GOUROMINANKRO DE YAMOUSSOUKRO,604,PB,
09830,CSU-D CONFESSIONNEL ST FAMILLE DE YAMOUSSOUKRO,604,PV,SSSSSSSSSSSSSSSSSSSSSSSSSSSSSSSS9830
01923,CSU-D PRIVE AIBEF DE YAMOUSSOUKRO,604,PV,SSSSSSSSSSSSSSSSSSSSSSSSSSSSSSSS1923
07132,CSU-D PUBLIC DIOULAKRO DE YAMOUSSOKRO,604,PB,SSSSSSSSSSSSSSSSSSSSSSSSSSSSSSSS7132
03155,CSU-D PUBLIC RÉSIDENCE DU PRÉSIDENT DE YAMOUSSOUKR,604,PB,SSSSSSSSSSSSSSSSSSSSSSSSSSSSSSSS3155
01375,CSU-DM PUBLIC DE ATTIEGOUAKRO,604,PB,SSSSSSSSSSSSSSSSSSSSSSSSSSSSSSSS1375
01378,CSU-DM PUBLIC DE KOSSOU,604,PB,SSSSSSSSSSSSSSSSSSSSSSSSSSSSSSSS1378
07130,CSU-DM PUBLIC DE LOLOBO,604,PB,SSSSSSSSSSSSSSSSSSSSSSSSSSSSSSSS7130
07131,CSU-DM PUBLIC DE NZUESSY (DIST. YAMOUSSOUKRO),604,PB,SSSSSSSSSSSSSSSSSSSSSSSSSSSSSSSS7131
01387,CSU-DM PUBLIC DE ZATTA,604,PB,SSSSSSSSSSSSSSSSSSSSSSSSSSSSSSSS1387
07133,CSU-DM PUBLIC MOROFÈ DE YAMOUSSOKRO,604,PB,SSSSSSSSSSSSSSSSSSSSSSSSSSSSSSSS7133
09823,CSUS-CAT PUBLIC DE YAMOUSSOUKRO,604,PB,SSSSSSSSSSSSSSSSSSSSSSSSSSSSSSSS9823
01382,CSUS-PMI PUBLIC DE YAMOUSSOUKRO,604,PB,SSSSSSSSSSSSSSSSSSSSSSSSSSSSSSSS1382
01383,CSUS-SSSU SAJ 1 PUBLIC DE YAMOUSSOUKRO,604,PB,SSSSSSSSSSSSSSSSSSSSSSSSSSSSSSSS1383
00067,CSUS-SSSU SAJ 2 PUBLIC DE YAMOUSSOUKRO,604,PB,SSSSSSSSSSSSSSSSSSSSSSSSSSSSSSSS0067
01583,CSUS-SSSU SAJ INPHB PUBLIC DE YAMOUSSOUKRO,604,PB,SSSSSSSSSSSSSSSSSSSSSSSSSSSSSSSS1583
09736,ESPACE MEDICO CHIRURGICALE ST AUGUSTIN DE YAKRO,604,PV,SSSSSSSSSSSSSSSSSSSSSSSSSSSSSSSS9736
03056,FSU COMMUNAUTAIRE HINNEH DE YAMOUSSOUKRO,604,PB,SSSSSSSSSSSSSSSSSSSSSSSSSSSSSSSS3056
09737,GROUPE MEDICAL ST SAUVEUR DE YAMOUSSOUKRO,604,PV,SSSSSSSSSSSSSSSSSSSSSSSSSSSSSSSS9737
09735,HÔPITAL CATHOLIQUE SAINT JOSEPH MOSCATI,604,PV,SSSSSSSSSSSSSSSSSSSSSSSSSSSSSSSS9735
01924,H P SAINT VINCENT DE PAUL,604,PV,SSSSSSSSSSSSSSSSSSSSSSSSSSSSSSSS1924
03046,HS PRIVE CONFESSIONEL DE KONGOUANOU,604,PV,SSSSSSSSSSSSSSSSSSSSSSSSSSSSSSSS3046
09825,INFIMERIE PRIVEE SOS VILLAGE YAKRO,604,PV,SSSSSSSSSSSSSSSSSSSSSSSSSSSSSSSS9825
03481,INF-PV LA PITIE DE YAMOUSSOUKRO,604,PV,
02590,INFIRMERIE PUBLIQUE CREMOS DE YAMOUSSOUKRO,604,PV,SSSSSSSSSSSSSSSSSSSSSSSSSSSSSSSS2590
02538,INF-LC PUBLIC CAFOP DE YAMOUSSOUKRO,604,PB,SSSSSSSSSSSSSSSSSSSSSSSSSSSSSSSS2538
02539,INF-LC PUBLIC ENSA/IAB  DE YAMOUSSOUKRO,604,PB,SSSSSSSSSSSSSSSSSSSSSSSSSSSSSSSS2539
01354,INF-LC PUBLIC ENSTP DE YAMOUSSOUKRO,604,PB,SSSSSSSSSSSSSSSSSSSSSSSSSSSSSSSS1354
00520,INF-LC PUBLIC INSET DE YAMOUSSOUKRO,604,PB,SSSSSSSSSSSSSSSSSSSSSSSSSSSSSSSS0520
02005,INF-LC PUBLIC LYCÉE BAD DE YAMOUSSOUKRO,604,PB,SSSSSSSSSSSSSSSSSSSSSSSSSSSSSSSS2005
02540,INF-LC PUBLIC LYCÉE MAMI ADJOUA DE YAMOUSSOUKRO,604,PB,SSSSSSSSSSSSSSSSSSSSSSSSSSSSSSSS2540
02983,INF-LC PUBLIC MUNICIPAL DE YAMOUSSOUKRO,604,PB,SSSSSSSSSSSSSSSSSSSSSSSSSSSSSSSS2983
07126,INF-PV NOTRE DAME D’AFRIQUE DE YAMOUSSOUKRO,604,PV,SSSSSSSSSSSSSSSSSSSSSSSSSSSSSSSS7126
08841,INF-PV PRIVE CIE DE KOSSOU,604,PV,SSSSSSSSSSSSSSSSSSSSSSSSSSSSSSSS8841
01862,INF-PV PRIVE CIE DE YAMOUSSOUKRO,604,PV,SSSSSSSSSSSSSSSSSSSSSSSSSSSSSSSS1862
02929,NOUVELLE CLINIQUE ST AUGUSTIN DE YAMOUSSOUKRO,604,PV,SSSSSSSSSSSSSSSSSSSSSSSSSSSSSSSS2929
02592,ONG ACTION SANITAIRE RURALE,604,PV,SSSSSSSSSSSSSSSSSSSSSSSSSSSSSSSS2592
09821,ONG ASAPSU,604,PV,SSSSSSSSSSSSSSSSSSSSSSSSSSSSSSSS9821
09816,ONG RSB,604,PV,SSSSSSSSSSSSSSSSSSSSSSSSSSSSSSSS9816
02868,SERVICE MEDICO-SOCIAL DE SODERTOUR LACS,604,PV,SSSSSSSSSSSSSSSSSSSSSSSSSSSSSSSS2868
02196,CSJA  CONFESSIONNEL DIANRA-VILLAGE,701,PV,SSSSSSSSSSSSSSSSSSSSSSSSSSSSSSSS2196
03236,CSR-D PUBLIC DE DALAGBE,701,PB,SSSSSSSSSSSSSSSSSSSSSSSSSSSSSSSS3236
03238,CSR-D PUBLIC DE GBONDIELE,701,PB,SSSSSSSSSSSSSSSSSSSSSSSSSSSSSSSS3238
03239,CSR-D PUBLIC DE LOKOLO,701,PB,SSSSSSSSSSSSSSSSSSSSSSSSSSSSSSSS3239
01635,CSR-D PUBLIC DE SIANKOUNON,701,PB,SSSSSSSSSSSSSSSSSSSSSSSSSSSSSSSS1635
03237,CSR-D PUBLIC DE TAMAFOUROU,701,PB,SSSSSSSSSSSSSSSSSSSSSSSSSSSSSSSS3237
01043,CSR-D PUBLIC DE YERETIELLE,701,PB,SSSSSSSSSSSSSSSSSSSSSSSSSSSSSSSS1043
01042,CSR-DM PUBLIC DE FARABA,701,PB,SSSSSSSSSSSSSSSSSSSSSSSSSSSSSSSS1042
03204,CSR-DM PUBLIC DE LENGUEDOUGOU,701,PB,SSSSSSSSSSSSSSSSSSSSSSSSSSSSSSSS3204
02377,CSR-DM PUBLIC DE OUAHIERE,701,PB,SSSSSSSSSSSSSSSSSSSSSSSSSSSSSSSS2377
02654,CSR-DM PUBLIC DE SONONZO,701,PB,SSSSSSSSSSSSSSSSSSSSSSSSSSSSSSSS2654
01045,CSU-D PUBLIC DE DIANRA-VILLAGE,701,PB,SSSSSSSSSSSSSSSSSSSSSSSSSSSSSSSS1045
01040,HG PUBLIC DE DIANRA,701,PB,SSSSSSSSSSSSSSSSSSSSSSSSSSSSSSSS1040
01251,CSR-D PUBLIC DE AGBAHOU,702,PB,SSSSSSSSSSSSSSSSSSSSSSSSSSSSSSSS1251
00987,CSR-D PUBLIC DE BAMBALOUMA,702,PB,SSSSSSSSSSSSSSSSSSSSSSSSSSSSSSSS0987
02198,CSR-D PUBLIC DE FOUTOUNOU,702,PB,SSSSSSSSSSSSSSSSSSSSSSSSSSSSSSSS2198
09941,CSR-D PUBLIC DE GBEMA,702,PB,SSSSSSSSSSSSSSSSSSSSSSSSSSSSSSSS9941
06796,CSR-D PUBLIC DE KOUATTA,702,PB,SSSSSSSSSSSSSSSSSSSSSSSSSSSSSSSS6796
02229,CSR-D PUBLIC DE LEASSO,702,PB,SSSSSSSSSSSSSSSSSSSSSSSSSSSSSSSS2229
02650,CSR-D PUBLIC DE TOUBALO,702,PB,SSSSSSSSSSSSSSSSSSSSSSSSSSSSSSSS2650
00637,CSR-DM PUBLIC DE BOAYAOKRO,702,PB,SSSSSSSSSSSSSSSSSSSSSSSSSSSSSSSS0637
01319,CSR-DM PUBLIC DE KOROKOPLA,702,PB,SSSSSSSSSSSSSSSSSSSSSSSSSSSSSSSS1319
01032,CSR-DM PUBLIC DE SOUKOUROUGBAN,702,PB,SSSSSSSSSSSSSSSSSSSSSSSSSSSSSSSS1032
02652,CSR-DM PUBLIC DE TRAFESSO,702,PB,SSSSSSSSSSSSSSSSSSSSSSSSSSSSSSSS2652
02202,CSU-DM PUBLIC DE KONGASSO,702,PB,SSSSSSSSSSSSSSSSSSSSSSSSSSSSSSSS2202
09942,CSUS-PMI PUBLIC DE KOUNAHIRI,702,PB,SSSSSSSSSSSSSSSSSSSSSSSSSSSSSSSS9942
03153,CSUS-SSSU PUBLIC DE KOUNAHIRI,702,PB,SSSSSSSSSSSSSSSSSSSSSSSSSSSSSSSS3153
01046,HG PUBLIC DE KOUNAHIRI,702,PB,SSSSSSSSSSSSSSSSSSSSSSSSSSSSSSSS1046
07230,CSR-D CONFESSIONNEL ND CONSOLATA DE MARANDALLAH,703,PV,SSSSSSSSSSSSSSSSSSSSSSSSSSSSSSSS7230
03178,CSR-D PUBLIC DE BADA,703,PB,SSSSSSSSSSSSSSSSSSSSSSSSSSSSSSSS3178
02197,CSR-D PUBLIC DE DAWARA,703,PB,SSSSSSSSSSSSSSSSSSSSSSSSSSSSSSSS2197
01778,CSR-D PUBLIC DE KAMORO,703,PB,SSSSSSSSSSSSSSSSSSSSSSSSSSSSSSSS1778
02199,CSR-D PUBLIC DE KOBADALLAH,703,PB,SSSSSSSSSSSSSSSSSSSSSSSSSSSSSSSS2199
02200,CSR-D PUBLIC DE KOUASSIDOUGOU,703,PB,SSSSSSSSSSSSSSSSSSSSSSSSSSSSSSSS2200
03179,CSR-D PUBLIC DE LIGBISSO,703,PB,SSSSSSSSSSSSSSSSSSSSSSSSSSSSSSSS3179
09128,CSR-D PUBLIC DE NIANKABI,703,PB,SSSSSSSSSSSSSSSSSSSSSSSSSSSSSSSS9128
02987,CSR-D PUBLIC DE PANIKO,703,PB,SSSSSSSSSSSSSSSSSSSSSSSSSSSSSSSS2987
03180,CSR-D PUBLIC DE SATAMA,703,PB,SSSSSSSSSSSSSSSSSSSSSSSSSSSSSSSS3180
00722,CSR-D PUBLIC DE SIRHIO,703,PB,SSSSSSSSSSSSSSSSSSSSSSSSSSSSSSSS0722
03177,CSR-D PUBLIC DE SOMOKORO,703,PB,SSSSSSSSSSSSSSSSSSSSSSSSSSSSSSSS3177
04449,CSR-DM PUBLIC DE BIELOU,703,PB,SSSSSSSSSSSSSSSSSSSSSSSSSSSSSSSS4449
01053,CSR-DM PUBLIC DE DANDOUGOU,703,PB,SSSSSSSSSSSSSSSSSSSSSSSSSSSSSSSS1053
00047,CSR-DM PUBLIC DE DANTOGO,703,PB,SSSSSSSSSSSSSSSSSSSSSSSSSSSSSSSS0047
02653,CSR-DM PUBLIC DE DIALAKORO,703,PB,SSSSSSSSSSSSSSSSSSSSSSSSSSSSSSSS2653
03403,CSR-DM PUBLIC DE FIZANKORO,703,PB,
00872,CSR-DM PUBLIC DE FIZANLOUMA,703,PB,SSSSSSSSSSSSSSSSSSSSSSSSSSSSSSSS0872
03404,CSR-DM PUBLIC DE KARAMOKOLA,703,PB,
04446,CSR-DM PUBLIC DE KPESSO,703,PB,SSSSSSSSSSSSSSSSSSSSSSSSSSSSSSSS4446
02201,CSR-DM PUBLIC DE NAKARA,703,PB,SSSSSSSSSSSSSSSSSSSSSSSSSSSSSSSS2201
00767,CSR-DM PUBLIC DE NINANKIRI,703,PB,SSSSSSSSSSSSSSSSSSSSSSSSSSSSSSSS0767
00876,CSR-DM PUBLIC DE OUEDALLAH,703,PB,SSSSSSSSSSSSSSSSSSSSSSSSSSSSSSSS0876
00081,CSR-DM PUBLIC DE TOMONO-SAMOROSSO,703,PB,SSSSSSSSSSSSSSSSSSSSSSSSSSSSSSSS0081
03235,CSU-D PUBLIC DE DIENEDIAN,703,PB,SSSSSSSSSSSSSSSSSSSSSSSSSSSSSSSS3235
00090,CSU-D PUBLIC DE MARANDALLAH,703,PB,SSSSSSSSSSSSSSSSSSSSSSSSSSSSSSSS0090
02203,CSU-D PUBLIC DE OUSSOUGOULA,703,PB,SSSSSSSSSSSSSSSSSSSSSSSSSSSSSSSS2203
01051,CSU-DM PUBLIC DE BOUANDOUGOU,703,PB,SSSSSSSSSSSSSSSSSSSSSSSSSSSSSSSS1051
03233,CSU-DM PUBLIC DE MISSIDOUGOU,703,PB,SSSSSSSSSSSSSSSSSSSSSSSSSSSSSSSS3233
03285,CSU-DM PUBLIC DE MISSIKORO,703,PB,
01049,CSU-DM PUBLIC DE SARHALA,703,PB,SSSSSSSSSSSSSSSSSSSSSSSSSSSSSSSS1049
01055,CSU-DM PUBLIC DE TIENINGBOUE,703,PB,SSSSSSSSSSSSSSSSSSSSSSSSSSSSSSSS1055
03432,CSUS-CAT PUBLIC DE MANKONO,703,PB,
03181,CSUS-PMI PUBLIC DE MANKONO,703,PB,SSSSSSSSSSSSSSSSSSSSSSSSSSSSSSSS3181
09940,CSUS-SSSU PUBLIC DE MANKONO,703,PB,SSSSSSSSSSSSSSSSSSSSSSSSSSSSSSSS9940
01047,HG PUBLIC DE MANKONO,703,PB,SSSSSSSSSSSSSSSSSSSSSSSSSSSSSSSS1047
08086,INF-LC PUBLIC LYCÉE MODERNE BAD DE TIENINGBOUE,703,PB,SSSSSSSSSSSSSSSSSSSSSSSSSSSSSSSS8086
02204,ONG BOBOSSO TIENIGBOUE,703,PV,SSSSSSSSSSSSSSSSSSSSSSSSSSSSSSSS2204
02205,ONG SESAMP-CI DE SOUNDOUGOUBA,703,PV,SSSSSSSSSSSSSSSSSSSSSSSSSSSSSSSS2205
02206,ONG TAMAGA DE BIELOU,703,PV,SSSSSSSSSSSSSSSSSSSSSSSSSSSSSSSS2206
02844,CSR-D PUBLIC D' ASSOUM 1,801,PB,SSSSSSSSSSSSSSSSSSSSSSSSSSSSSSSS2844
02664,CSR-D PUBLIC DE BANIA,801,PB,SSSSSSSSSSSSSSSSSSSSSSSSSSSSSSSS2664
02499,CSR-D PUBLIC DE DAPIDOUO,801,PB,SSSSSSSSSSSSSSSSSSSSSSSSSSSSSSSS2499
03303,CSR-D PUBLIC DE DIHINTEDOUO,801,PB,
00890,CSR-D PUBLIC DE KALTOUDOUO,801,PB,SSSSSSSSSSSSSSSSSSSSSSSSSSSSSSSS0890
03041,CSR-D PUBLIC DE KERMATEDOUO,801,PB,SSSSSSSSSSSSSSSSSSSSSSSSSSSSSSSS3041
01978,CSR-D PUBLIC DE KINTA,801,PB,SSSSSSSSSSSSSSSSSSSSSSSSSSSSSSSS1978
02497,CSR-D PUBLIC DE KOFLANDE,801,PB,SSSSSSSSSSSSSSSSSSSSSSSSSSSSSSSS2497
01180,CSR-D PUBLIC DE KOKPINGUE,801,PB,SSSSSSSSSSSSSSSSSSSSSSSSSSSSSSSS1180
03393,CSR-D PUBLIC DE KONTODOUO,801,PB,
00842,CSR-D PUBLIC DE LOMIDOUO,801,PB,SSSSSSSSSSSSSSSSSSSSSSSSSSSSSSSS0842
02665,CSR-D PUBLIC DE MASSITEON,801,PB,SSSSSSSSSSSSSSSSSSSSSSSSSSSSSSSS2665
01544,CSR-D PUBLIC DE NIANDEGUE,801,PB,SSSSSSSSSSSSSSSSSSSSSSSSSSSSSSSS1544
07786,CSR-D PUBLIC DE PIAYE,801,PB,SSSSSSSSSSSSSSSSSSSSSSSSSSSSSSSS7786
01990,CSR-D PUBLIC DE POUAN,801,PB,SSSSSSSSSSSSSSSSSSSSSSSSSSSSSSSS1990
02496,CSR-D PUBLIC DE SANGUINARI,801,PB,SSSSSSSSSSSSSSSSSSSSSSSSSSSSSSSS2496
00865,CSR-D PUBLIC DE SEPIDOUO,801,PB,SSSSSSSSSSSSSSSSSSSSSSSSSSSSSSSS0865
03329,CSR-D PUBLIC DE SITEDOUO,801,PB,
00853,CSR-D PUBLIC DE SOTITEDOUO,801,PB,SSSSSSSSSSSSSSSSSSSSSSSSSSSSSSSS0853
04700,CSR-D PUBLIC DE SYALEDOUO,801,PB,SSSSSSSSSSSSSSSSSSSSSSSSSSSSSSSS4700
01992,CSR-D PUBLIC DE VARGBO I,801,PB,SSSSSSSSSSSSSSSSSSSSSSSSSSSSSSSS1992
02003,CSR-D PUBLIC DE VONKORO,801,PB,SSSSSSSSSSSSSSSSSSSSSSSSSSSSSSSS2003
02500,CSR-D PUBLIC DE YOLONGO,801,PB,SSSSSSSSSSSSSSSSSSSSSSSSSSSSSSSS2500
02609,CSR-D PUBLIC DE YOUNDOUO,801,PB,SSSSSSSSSSSSSSSSSSSSSSSSSSSSSSSS2609
02012,CSR-D PUBLIC DE YOUTOURDOUO,801,PB,SSSSSSSSSSSSSSSSSSSSSSSSSSSSSSSS2012
01601,CSR-DM PUBLIC DE BOUKO,801,PB,SSSSSSSSSSSSSSSSSSSSSSSSSSSSSSSS1601
01603,CSR-DM PUBLIC DE ONDEFIDOUO,801,PB,SSSSSSSSSSSSSSSSSSSSSSSSSSSSSSSS1603
01511,CSR-DM PUBLIC DE PANZARANI,801,PB,SSSSSSSSSSSSSSSSSSSSSSSSSSSSSSSS1511
03328,CSR-M PUBLIC D'ASSOUM 2,801,PB,
02021,CSR-M PUBLIC DE VARGBO II,801,PB,SSSSSSSSSSSSSSSSSSSSSSSSSSSSSSSS2021
02023,CSU-D PUBLIC DE BOUNA,801,PB,SSSSSSSSSSSSSSSSSSSSSSSSSSSSSSSS2023
03436,CSU-I PUBLIC DE BOUNA,801,PB,
00315,CSUS-CAT PUBLIC DE BOUNA,801,PB,SSSSSSSSSSSSSSSSSSSSSSSSSSSSSSSS0315
01100,CSUS-PMI PUBLIC DE BOUNA,801,PB,SSSSSSSSSSSSSSSSSSSSSSSSSSSSSSSS1100
00586,CSUS-SSSU PUBLIC DE BOUNA,801,PB,SSSSSSSSSSSSSSSSSSSSSSSSSSSSSSSS0586
00584,HG PUBLIC DE BOUNA,801,PB,SSSSSSSSSSSSSSSSSSSSSSSSSSSSSSSS0584
02356,INF-P PUBLIC PRISON CIVIL MAC DE BOUNA,801,PB,SSSSSSSSSSSSSSSSSSSSSSSSSSSSSSSS2356
00928,CMS PRIVE LES FLAMBOYANTS DE DOROPO,802,PV,SSSSSSSSSSSSSSSSSSSSSSSSSSSSSSSS0928
01130,CSR-D PUBLIC DE ANGAYE,802,PB,SSSSSSSSSSSSSSSSSSSSSSSSSSSSSSSS1130
00078,CSR-D PUBLIC DE BAYANA,802,PB,SSSSSSSSSSSSSSSSSSSSSSSSSSSSSSSS0078
01960,CSR-D PUBLIC DE DOGBE,802,PB,SSSSSSSSSSSSSSSSSSSSSSSSSSSSSSSS1960
01971,CSR-D PUBLIC DE GNANDOTINKOYE,802,PB,SSSSSSSSSSSSSSSSSSSSSSSSSSSSSSSS1971
03334,CSR-D PUBLIC DE KODO,802,PB,
00591,CSR-D PUBLIC DE KOUNZIE,802,PB,SSSSSSSSSSSSSSSSSSSSSSSSSSSSSSSS0591
03335,CSR-D PUBLIC DE LAGBO,802,PB,
01989,CSR-D PUBLIC DE LANKIO,802,PB,SSSSSSSSSSSSSSSSSSSSSSSSSSSSSSSS1989
02498,CSR-D PUBLIC DE LATROUGO,802,PB,SSSSSSSSSSSSSSSSSSSSSSSSSSSSSSSS2498
03336,CSR-D PUBLIC DE SANSANDOUO,802,PB,
09123,CSR-D PUBLIC DE TINGO-YALO,802,PB,SSSSSSSSSSSSSSSSSSSSSSSSSSSSSSSS9123
00590,CSR-DM PUBLIC DE DANOA,802,PB,SSSSSSSSSSSSSSSSSSSSSSSSSSSSSSSS0590
00595,CSR-DM PUBLIC DE KALAMON,802,PB,SSSSSSSSSSSSSSSSSSSSSSSSSSSSSSSS0595
00316,CSR-DM PUBLIC DE NIAMOIN,802,PB,SSSSSSSSSSSSSSSSSSSSSSSSSSSSSSSS0316
01602,CSR-DM PUBLIC DE VARALE,802,PB,SSSSSSSSSSSSSSSSSSSSSSSSSSSSSSSS1602
01268,CSR-M PUBLIC DE SAYE,802,PB,SSSSSSSSSSSSSSSSSSSSSSSSSSSSSSSS1268
04267,HG CONFESSIONNEL BAPTISTE LIBRE DE DOROPO,802,PV,SSSSSSSSSSSSSSSSSSSSSSSSSSSSSSSS4267
00594,HG PUBLIC DE DOROPO,802,PB,SSSSSSSSSSSSSSSSSSSSSSSSSSSSSSSS0594
03162,CSR-D PUBLIC DE BANVAYO,803,PB,SSSSSSSSSSSSSSSSSSSSSSSSSSSSSSSS3162
07291,CSR-D PUBLIC DE BOGOFA,803,PB,SSSSSSSSSSSSSSSSSSSSSSSSSSSSSSSS7291
03163,CSR-D PUBLIC DE DEPINGO,803,PB,SSSSSSSSSSSSSSSSSSSSSSSSSSSSSSSS3163
00635,CSR-D PUBLIC DE LAMBIRA,803,PB,SSSSSSSSSSSSSSSSSSSSSSSSSSSSSSSS0635
02830,CSR-D PUBLIC DE SIRIKI-BANGO,803,PB,SSSSSSSSSSSSSSSSSSSSSSSSSSSSSSSS2830
02611,CSR-D PUBLIC DE TALAHINI,803,PB,SSSSSSSSSSSSSSSSSSSSSSSSSSSSSSSS2611
02025,CSR-D PUBLIC DE TOUNGBO YAGA,803,PB,SSSSSSSSSSSSSSSSSSSSSSSSSSSSSSSS2025
03127,CSR-DM PUBLIC DE BROBIREDOUO,803,PB,SSSSSSSSSSSSSSSSSSSSSSSSSSSSSSSS3127
00596,CSR-DM PUBLIC DE KAKPIN,803,PB,SSSSSSSSSSSSSSSSSSSSSSSSSSSSSSSS0596
00601,CSR-DM PUBLIC DE PARHADI,803,PB,SSSSSSSSSSSSSSSSSSSSSSSSSSSSSSSS0601
00603,CSU-D PUBLIC DE SOMINASSE,803,PB,SSSSSSSSSSSSSSSSSSSSSSSSSSSSSSSS0603
07290,CSU-DM PUBLIC DE KOUTOUBA,803,PB,SSSSSSSSSSSSSSSSSSSSSSSSSSSSSSSS7290
03126,CSUS-SSSU PUBLIC DE NASSIAN,803,PB,SSSSSSSSSSSSSSSSSSSSSSSSSSSSSSSS3126
00599,HG PUBLIC DE NASSIAN,803,PB,SSSSSSSSSSSSSSSSSSSSSSSSSSSSSSSS0599
03333,CSR-DM PUBLIC DE BOLE,804,PB,
01604,CSU-DM PUBLIC DE GOGO,804,PB,SSSSSSSSSSSSSSSSSSSSSSSSSSSSSSSS1604
03345,CSR-D PUBLIC DE GOVITAN,804,PB,
03192,CSR-DM PUBLIC DE KOINTA,804,PB,SSSSSSSSSSSSSSSSSSSSSSSSSSSSSSSS3192
01979,CSR-DM PUBLIC DE KOUEBONOU,804,PB,SSSSSSSSSSSSSSSSSSSSSSSSSSSSSSSS1979
03406,CSR-D PUBLIC DE LAGBO-TADJOTE,804,PB,
01009,CSR-DM PUBLIC DE BAVE,804,PB,SSSSSSSSSSSSSSSSSSSSSSSSSSSSSSSS1009
00606,CSU-DM PUBLIC DE TOUGBO,804,PB,SSSSSSSSSSSSSSSSSSSSSSSSSSSSSSSS0606
03407,CSUS-SSSU PUBLIC DE TEHINI,804,PB,
00604,HG PUBLIC DE TEHINI,804,PB,SSSSSSSSSSSSSSSSSSSSSSSSSSSSSSSS0604
00636,CDT-DS PUBLIC DE BLOLEQUIN,901,PB,SSSSSSSSSSSSSSSSSSSSSSSSSSSSSSSS0636
00017,CSR-D PUBLIC DE CHANTIER COLONEL,901,PB,SSSSSSSSSSSSSSSSSSSSSSSSSSSSSSSS0017
00018,CSR-D PUBLIC DE DANDROU,901,PB,SSSSSSSSSSSSSSSSSSSSSSSSSSSSSSSS0018
02284,CSR-D PUBLIC DE PETIT GUIGLO(DIST. BLOLEQUIN),901,PB,SSSSSSSSSSSSSSSSSSSSSSSSSSSSSSSS2284
01740,CSR-D PUBLIC DE TINHOU,901,PB,SSSSSSSSSSSSSSSSSSSSSSSSSSSSSSSS1740
03443,CSR-DM PUBLIC DE DEPOUTA,901,PB,
00651,CSR-DM PUBLIC DE DIBOKE,901,PB,SSSSSSSSSSSSSSSSSSSSSSSSSSSSSSSS0651
02282,CSR-DM PUBLIC DE GUIBOBLY,901,PB,SSSSSSSSSSSSSSSSSSSSSSSSSSSSSSSS2282
03444,CSR-DM PUBLIC DE PETIT BOUAKE (DIST. BLOLEQUIN),901,PB,
02283,CSR-DM PUBLIC DE TOMEPLEU,901,PB,SSSSSSSSSSSSSSSSSSSSSSSSSSSSSSSS2283
00044,CSR-M PUBLIC DE BLEDI DIEYA,901,PB,SSSSSSSSSSSSSSSSSSSSSSSSSSSSSSSS0044
01739,CSU-D PUBLIC DE DOKE,901,PB,SSSSSSSSSSSSSSSSSSSSSSSSSSSSSSSS1739
00894,CSU-D PUBLIC DE ZEAGLO,901,PB,SSSSSSSSSSSSSSSSSSSSSSSSSSSSSSSS0894
03148,CSUS-SSSU PUBLIC DE BLOLEQUIN,901,PB,SSSSSSSSSSSSSSSSSSSSSSSSSSSSSSSS3148
00892,HG PUBLIC DE BLOLEQUIN,901,PB,SSSSSSSSSSSSSSSSSSSSSSSSSSSSSSSS0892
02587,CENTRE MEDICO-SOCIAL CEEDEB,902,PV,SSSSSSSSSSSSSSSSSSSSSSSSSSSSSSSS2587
00895,CHR PUBLIC DE GUIGLO,902,PB,SSSSSSSSSSSSSSSSSSSSSSSSSSSSSSSS0895
02747,CLINIQUE MÉDICALE DU CAVALLY DE GUIGLO,902,PV,SSSSSSSSSSSSSSSSSSSSSSSSSSSSSSSS2747
02335,CLINIQUE SAINTE BERNADÉE DE GUIGLO,902,PV,SSSSSSSSSSSSSSSSSSSSSSSSSSSSSSSS2335
00096,CMS PRIVE CIP CAMES (HAPPYNESS) DE GUIGLO,902,PV,SSSSSSSSSSSSSSSSSSSSSSSSSSSSSSSS0096
09997,CMS PRIVE THANRY DE  GUIGLO,902,PV,SSSSSSSSSSSSSSSSSSSSSSSSSSSSSSSS9997
02236,CSR-D PUBLIC DE BEABLO,902,PB,SSSSSSSSSSSSSSSSSSSSSSSSSSSSSSSS2236
02742,CSR-D PUBLIC DE BEHEBOU V15,902,PB,SSSSSSSSSSSSSSSSSSSSSSSSSSSSSSSS2742
02596,CSR-D PUBLIC DE BEOUA,902,PB,SSSSSSSSSSSSSSSSSSSSSSSSSSSSSSSS2596
00125,CSR-D PUBLIC DE GBLAPLEU,902,PB,SSSSSSSSSSSSSSSSSSSSSSSSSSSSSSSS0125
01935,CSR-D PUBLIC DE GOYA,902,PB,SSSSSSSSSSSSSSSSSSSSSSSSSSSSSSSS1935
00579,CSR-D PUBLIC DE GUINKIN,902,PB,SSSSSSSSSSSSSSSSSSSSSSSSSSSSSSSS0579
02237,CSR-D PUBLIC DE KRIDY,902,PB,SSSSSSSSSSSSSSSSSSSSSSSSSSSSSSSS2237
00899,CSR-D PUBLIC DE MONA,902,PB,SSSSSSSSSSSSSSSSSSSSSSSSSSSSSSSS0899
00583,CSR-D PUBLIC DE PETIT-GUIGLO,902,PB,SSSSSSSSSSSSSSSSSSSSSSSSSSSSSSSS0583
01743,CSR-D PUBLIC DE ZRO,902,PB,SSSSSSSSSSSSSSSSSSSSSSSSSSSSSSSS1743
01546,CSR-DM PUBLIC DE BEDI-GOAZON,902,PB,SSSSSSSSSSSSSSSSSSSSSSSSSSSSSSSS1546
03170,CSR-DM PUBLIC DE DITROUDRA BEOUE,902,PB,SSSSSSSSSSSSSSSSSSSSSSSSSSSSSSSS3170
00900,CSR-DM PUBLIC DE NIZAHON,902,PB,SSSSSSSSSSSSSSSSSSSSSSSSSSSSSSSS0900
00967,CSR-DM PUBLIC DE ZOUAN,902,PB,SSSSSSSSSSSSSSSSSSSSSSSSSSSSSSSS0967
03169,CSR-M PUBLIC DE GLOPAOUDY,902,PB,SSSSSSSSSSSSSSSSSSSSSSSSSSSSSSSS3169
06802,CSU-DM PRIVE CLINIQUE ESPERANCE DE GUIGLO,902,PB,SSSSSSSSSSSSSSSSSSSSSSSSSSSSSSSS6802
02843,CSU-DM PUBLIC DE NICLA,902,PB,SSSSSSSSSSSSSSSSSSSSSSSSSSSSSSSS2843
02040,CSUS-CAT PUBLIC DE GUIGLO,902,PB,SSSSSSSSSSSSSSSSSSSSSSSSSSSSSSSS2040
01534,CSUS-PMI PUBLIC DE GUIGLO,902,PB,SSSSSSSSSSSSSSSSSSSSSSSSSSSSSSSS1534
00896,CSUS-SSSU PUBLIC DE GUIGLO,902,PB,SSSSSSSSSSSSSSSSSSSSSSSSSSSSSSSS0896
02334,INF-PV CORPS DE TROUPE DE GUIGLO,902,PV,SSSSSSSSSSSSSSSSSSSSSSSSSSSSSSSS2334
02731,CSR-D PRIVE COMPAGNIE HÉVIOCOLE DE ZAGNE,903,PV,SSSSSSSSSSSSSSSSSSSSSSSSSSSSSSSS2731
02238,CSR-D PUBLIC DE DJIDOUBAYE,903,PB,SSSSSSSSSSSSSSSSSSSSSSSSSSSSSSSS2238
07170,CSR-D PUBLIC DE KEIBLY,903,PB,SSSSSSSSSSSSSSSSSSSSSSSSSSSSSSSS7170
00126,CSR-D PUBLIC DE SAKRE,903,PB,SSSSSSSSSSSSSSSSSSSSSSSSSSSSSSSS0126
00589,CSR-D PUBLIC DE TIEOULE-OULA,903,PB,SSSSSSSSSSSSSSSSSSSSSSSSSSSSSSSS0589
03411,CSR-DM PUBLIC DE ZAÏPOBLY,903,PB,
00994,CSR-DM PUBLIC SŒURS MARIE CONSOLATRICE DE ZAGNE,903,PB,SSSSSSSSSSSSSSSSSSSSSSSSSSSSSSSS0994
00901,CSU-DM PUBLIC DE TAI,903,PB,SSSSSSSSSSSSSSSSSSSSSSSSSSSSSSSS0901
00903,CSU-DM PUBLIC DE ZAGNE,903,PB,SSSSSSSSSSSSSSSSSSSSSSSSSSSSSSSS0903
02872,CSU-I PUBLIC DE TAI,903,PB,SSSSSSSSSSSSSSSSSSSSSSSSSSSSSSSS2872
03503,HG PUBLIC DE TAI,903,PB,533784a4-b74b-11eb-afef-c8f75041a8b5
01723,CSR-D PUBLIC DE BOHIBLY,904,PB,SSSSSSSSSSSSSSSSSSSSSSSSSSSSSSSS1723
01721,CSR-D PUBLIC DE BOHOBLY,904,PB,SSSSSSSSSSSSSSSSSSSSSSSSSSSSSSSS1721
02336,CSR-D PUBLIC DE DENAN,904,PB,SSSSSSSSSSSSSSSSSSSSSSSSSSSSSSSS2336
01712,CSR-D PUBLIC DE KOARHO,904,PB,SSSSSSSSSSSSSSSSSSSSSSSSSSSSSSSS1712
07171,CSR-D PUBLIC DE NEZOBLY,904,PB,SSSSSSSSSSSSSSSSSSSSSSSSSSSSSSSS7171
01713,CSR-D PUBLIC DE PAHOUBLY,904,PB,SSSSSSSSSSSSSSSSSSSSSSSSSSSSSSSS1713
03203,CSR-D PUBLIC DE POYABLI,904,PB,SSSSSSSSSSSSSSSSSSSSSSSSSSSSSSSS3203
02678,CSR-D PUBLIC DE SAHIBLY,904,PB,SSSSSSSSSSSSSSSSSSSSSSSSSSSSSSSS2678
07173,CSR-D PUBLIC DE TOYEBLY,904,PB,SSSSSSSSSSSSSSSSSSSSSSSSSSSSSSSS7173
02047,CSR-D PUBLIC DE ZIOMBLY,904,PB,SSSSSSSSSSSSSSSSSSSSSSSSSSSSSSSS2047
09958,CSR-D PUBLIC KLAON DE TOULEUPLEU,904,PB,SSSSSSSSSSSSSSSSSSSSSSSSSSSSSSSS9958
09957,CSR-D PUBLIC PEKANHOUEBLY DE TOULEUPLEU,904,PB,SSSSSSSSSSSSSSSSSSSSSSSSSSSSSSSS9957
00479,CSU-D PUBLIC DE MEO,904,PB,SSSSSSSSSSSSSSSSSSSSSSSSSSSSSSSS0479
00906,CSU-D PUBLIC DE TIOBLY,904,PB,SSSSSSSSSSSSSSSSSSSSSSSSSSSSSSSS0906
02677,CSU-DM PUBLIC DE BAKOUBLY,904,PB,SSSSSSSSSSSSSSSSSSSSSSSSSSSSSSSS2677
00905,CSU-DM PUBLIC DE PEHE,904,PB,SSSSSSSSSSSSSSSSSSSSSSSSSSSSSSSS0905
02708,CSU-DM PUBLIC DE TOULEPLEU,904,PB,SSSSSSSSSSSSSSSSSSSSSSSSSSSSSSSS2708
01711,CSUS-SSSU PUBLIC DE TOULEPLEU,904,PB,SSSSSSSSSSSSSSSSSSSSSSSSSSSSSSSS1711
00907,HG PUBLIC DE TOULEPLEU,904,PB,SSSSSSSSSSSSSSSSSSSSSSSSSSSSSSSS0907
02562,ICT BSO TOULEPLEU,904,PB,SSSSSSSSSSSSSSSSSSSSSSSSSSSSSSSS2562
01409,CSR-D PUBLIC DE BANANKORO,1001,PB,SSSSSSSSSSSSSSSSSSSSSSSSSSSSSSSS1409
02332,CSR-D PUBLIC DE GBEYA,1001,PB,SSSSSSSSSSSSSSSSSSSSSSSSSSSSSSSS2332
02815,CSR-D PUBLIC DE KARALA,1001,PB,SSSSSSSSSSSSSSSSSSSSSSSSSSSSSSSS2815
07205,CSR-D PUBLIC DE KORO-OULE,1001,PB,SSSSSSSSSSSSSSSSSSSSSSSSSSSSSSSS7205
01078,CSR-D PUBLIC DE MANADOUN,1001,PB,SSSSSSSSSSSSSSSSSSSSSSSSSSSSSSSS1078
02816,CSR-D PUBLIC DE NAFADOUGOU,1001,PB,SSSSSSSSSSSSSSSSSSSSSSSSSSSSSSSS2816
01079,CSR-D PUBLIC DE OUELLI,1001,PB,SSSSSSSSSSSSSSSSSSSSSSSSSSSSSSSS1079
02331,CSR-D PUBLIC DE TAHARA,1001,PB,SSSSSSSSSSSSSSSSSSSSSSSSSSSSSSSS2331
00140,CSR-D PUBLIC DE WAHIRE,1001,PB,SSSSSSSSSSSSSSSSSSSSSSSSSSSSSSSS0140
01760,CSR-DM PUBLIC DE SANANFEREDOUGOU,1001,PB,SSSSSSSSSSSSSSSSSSSSSSSSSSSSSSSS1760
01074,CSU-DM PUBLIC DE GOULIA,1001,PB,SSSSSSSSSSSSSSSSSSSSSSSSSSSSSSSS1074
01076,CSU-DM PUBLIC DE MAHANDIANA-SOKOURANI,1001,PB,SSSSSSSSSSSSSSSSSSSSSSSSSSSSSSSS1076
01080,HG PUBLIC DE KANIASSO,1001,PB,SSSSSSSSSSSSSSSSSSSSSSSSSSSSSSSS1080
02333,CSR-D PUBLIC DE GOUENZOU,1002,PB,SSSSSSSSSSSSSSSSSSSSSSSSSSSSSSSS2333
