code,name,district_code,facility_type,source_uuid
02884,CABINET D’OPTICIEN-LUNETIER CLEAN VISION,101,PV,SSSSSSSSSSSSSSSSSSSSSSSSSSSSSSSS2884
02375,"CABINET PRE POST NATAL""LA FLÛTE""",101,PV,SSSSSSSSSSSSSSSSSSSSSSSSSSSSSSSS2375
03117,CENTRE DE SOINS INFIRMIER ESPACE SANTE,101,PV,SSSSSSSSSSSSSSSSSSSSSSSSSSSSSSSS3117
03113,CENTRE DE SOINS INFIRMIERS CHRIST ROI,101,PV,SSSSSSSSSSSSSSSSSSSSSSSSSSSSSSSS3113
03479,CENTRE DE SOINS INFIRMIERS MA’CHALLAH,101,PV,
03265,CSI SAINT RAPHAEL ABOBO,101,PV,
03424,CM BETHLEM D'ABOBO AKEIKOI,101,PV,
03074,CENTRE MEDICAL EDEN D' ABOBO EST,101,PV,SSSSSSSSSSSSSSSSSSSSSSSSSSSSSSSS3074
02833,CENTRE MEDICAL ESPERANCE,101,PV,SSSSSSSSSSSSSSSSSSSSSSSSSSSSSSSS2833
02822,CENTRE MEDICAL ESPOIR NANG,101,PV,SSSSSSSSSSSSSSSSSSSSSSSSSSSSSSSS2822
02821,CENTRE MEDICAL NOUR (CASAS),101,PV,SSSSSSSSSSSSSSSSSSSSSSSSSSSSSSSS2821
02820,CENTRE MEDICAL ROTARY,101,PV,SSSSSSSSSSSSSSSSSSSSSSSSSSSSSSSS2820
02465,CENTRE MEDICAL ST PAUL,101,PV,SSSSSSSSSSSSSSSSSSSSSSSSSSSSSSSS2465
00064,CHR PUBLIC HOUPHOUET BOIGNY DE ABOBO (ABOBO NORD),101,PB,SSSSSSSSSSSSSSSSSSSSSSSSSSSSSSSS0064
02460,CITE MEDICALE LA ROSERAIE,101,PV,SSSSSSSSSSSSSSSSSSSSSSSSSSSSSSSS2460
02834,CLINIQUE ASFI,101,PV,SSSSSSSSSSSSSSSSSSSSSSSSSSSSSSSS2834
03266,CLINIQUE EMMANUELLE,101,PV,
02464,CLINIQUE MEDICO-CHIRURGICALE D`ABOBO,101,PV,SSSSSSSSSSSSSSSSSSSSSSSSSSSSSSSS2464
01007,CLINIQUE PRIVEE LES GRACES,101,PV,SSSSSSSSSSSSSSSSSSSSSSSSSSSSSSSS1007
02999,CLINIQUE SAINT HOREB,101,PV,SSSSSSSSSSSSSSSSSSSSSSSSSSSSSSSS2999
09501,CM MADINA MOUNAWARA,101,PV,SSSSSSSSSSSSSSSSSSSSSSSSSSSSSSSS9501
02344,CM PRIVE CONFESSIONNEL ST COEUR D' ABOBO-TE,101,PV,SSSSSSSSSSSSSSSSSSSSSSSSSSSSSSSS2344
09505,CM PRIVE ONG SAMUEL,101,PV,SSSSSSSSSSSSSSSSSSSSSSSSSSSSSSSS9505
01983,CMS CONFESSIONNEL ANGE GARDIEN DE ABOBO,101,PV,SSSSSSSSSSSSSSSSSSSSSSSSSSSSSSSS1983
09727,CMS PRIVE GRAND CENTRE MEDICAL (ROUTE DE AKEÏKOI),101,PV,SSSSSSSSSSSSSSSSSSSSSSSSSSSSSSSS9727
09504,CMS PRIVE ONG  IDEE,101,PV,SSSSSSSSSSSSSSSSSSSSSSSSSSSSSSSS9504
09500,CMS PRIVE ONG ACID,101,PV,SSSSSSSSSSSSSSSSSSSSSSSSSSSSSSSS9500
09852,CMS PRIVE ONG BAYEWA D' ABOBO EST,101,PV,SSSSSSSSSSSSSSSSSSSSSSSSSSSSSSSS9852
09853,CMS PRIVE ONG BLETY,101,PV,SSSSSSSSSSSSSSSSSSSSSSSSSSSSSSSS9853
09503,CMS PRIVE ONG CENTRE MEDICAL BEDEMI,101,PV,SSSSSSSSSSSSSSSSSSSSSSSSSSSSSSSS9503
09502,CMS PRIVE ONG MATERNITE VIE AMOUR,101,PV,SSSSSSSSSSSSSSSSSSSSSSSSSSSSSSSS9502
01019,CMS UNIVERSITE NANGUI ABROGOUA,101,PV,SSSSSSSSSSSSSSSSSSSSSSSSSSSSSSSS1019
03425,CSR-DM PRIVE BENJAMIN MEKROBLA D'ABOBO BELLEVILLE,101,PV,
00446,CSU-DM COMMUNAUTAIRE DE ABOBO BANCO-SUD,101,PB,SSSSSSSSSSSSSSSSSSSSSSSSSSSSSSSS0446
00504,CSU-DM COMMUNAUTAIRE DE ABOBO BC,101,PB,SSSSSSSSSSSSSSSSSSSSSSSSSSSSSSSS0504
00420,CSU-DM COMMUNAUTAIRE DE ABOBO KENNEDY CLOUETCHA,101,PB,SSSSSSSSSSSSSSSSSSSSSSSSSSSSSSSS0420
00563,CSU-DM COMMUNAUTAIRE DE ABOBO-TE,101,PB,SSSSSSSSSSSSSSSSSSSSSSSSSSSSSSSS0563
01031,CSU-DM PUBLIC DE DJIBI VILLAGE,101,PB,SSSSSSSSSSSSSSSSSSSSSSSSSSSSSSSS1031
01475,CSUS-CAT PUBLIC DE ABOBO SOGEFIHA,101,PB,SSSSSSSSSSSSSSSSSSSSSSSSSSSSSSSS1475
07024,CSUS-CDV PRIVE LUMIÈRE ACTION D' ABOBO,101,PV,SSSSSSSSSSSSSSSSSSSSSSSSSSSSSSSS7024
02730,CSUS-SSSU PUBLIC DE ABOBO CENTRE,101,PB,SSSSSSSSSSSSSSSSSSSSSSSSSSSSSSSS2730
00061,CSUS-SSSU PUBLIC DE ABOBO-SOGEFIHA,101,PB,SSSSSSSSSSSSSSSSSSSSSSSSSSSSSSSS0061
01050,ESPACE MÉDICAL LE SILOE PK18,101,PV,SSSSSSSSSSSSSSSSSSSSSSSSSSSSSSSS1050
03140,ESPACE SANTE COMMUNAUTAIRE D' ABOBO BELLEVILLE,101,PV,SSSSSSSSSSSSSSSSSSSSSSSSSSSSSSSS3140
07408,FSU COM DM SOS VE D' ABOBO,101,PB,SSSSSSSSSSSSSSSSSSSSSSSSSSSSSSSS7408
00747,FSU COMMUNAUTAIRE DE ABOBO AVOCATIER,101,PB,SSSSSSSSSSSSSSSSSSSSSSSSSSSSSSSS0747
00765,FSU COMMUNAUTAIRE DE AKEIKOIA,101,PB,SSSSSSSSSSSSSSSSSSSSSSSSSSSSSSSS0765
00056,FSU COMMUNAUTAURE DE ABOBO BAOULE,101,PB,SSSSSSSSSSSSSSSSSSSSSSSSSSSSSSSS0056
03050,FSU HINNEH D'ABOBO PK18,101,PB,SSSSSSSSSSSSSSSSSSSSSSSSSSSSSSSS3050
01809,GRAND CLINIQUE DU DOKUI,101,PV,SSSSSSSSSSSSSSSSSSSSSSSSSSSSSSSS1809
01317,HG CONFESSIONNEL DE ABOBO CLOUETCHA,101,PV,SSSSSSSSSSSSSSSSSSSSSSSSSSSSSSSS1317
02570,ICT BATAILLON PROJETABLE ABOBO,101,PB,SSSSSSSSSSSSSSSSSSSSSSSSSSSSSSSS2570
09854,ICT D' ABOBO EST,101,PB,SSSSSSSSSSSSSSSSSSSSSSSSSSSSSSSS9854
02569,ICT FORCES SPECIALES N'DOTRE,101,PB,SSSSSSSSSSSSSSSSSSSSSSSSSSSSSSSS2569
02341,INF-LC PUBLIC LYCÉE MODERNE DE ABOBO,101,PB,SSSSSSSSSSSSSSSSSSSSSSSSSSSSSSSS2341
02374,INF-PUBLIC CAMP COMMANDO ABOBO,101,PB,SSSSSSSSSSSSSSSSSSSSSSSSSSSSSSSS2374
03275,INF-PV PRIVEE LA VIE D'ABOBO,101,PV,
01438,ONG ARC-EN-CIEL,101,PV,SSSSSSSSSSSSSSSSSSSSSSSSSSSSSSSS1438
09855,ONG FARAFIN DENI JUNIOR D' ABOBO EST,101,PV,SSSSSSSSSSSSSSSSSSSSSSSSSSSSSSSS9855
02459,ONG LUMIERE ACTION MOBILE,101,PV,SSSSSSSSSSSSSSSSSSSSSSSSSSSSSSSS2459
01056,ONG MIBEF,101,PV,SSSSSSSSSSSSSSSSSSSSSSSSSSSSSSSS1056
02835,ONG SAUVONS 2 VIES,101,PV,SSSSSSSSSSSSSSSSSSSSSSSSSSSSSSSS2835
09856,ONG SOLIDARITE PLUS D' ABOBO-EST,101,PV,SSSSSSSSSSSSSSSSSSSSSSSSSSSSSSSS9856
01075,ONG SOURCE DE VIE,101,PV,SSSSSSSSSSSSSSSSSSSSSSSSSSSSSSSS1075
01831,POLYCLINIQUE CENTRALE D'ABOBO,101,PV,SSSSSSSSSSSSSSSSSSSSSSSSSSSSSSSS1831
02458,SOCIETE MEDICALE SCHEKINA,101,PV,SSSSSSSSSSSSSSSSSSSSSSSSSSSSSSSS2458
03021,CABINET D’OPTICIEN-LUNETIER CHANAN OPTIQUE,102,PV,SSSSSSSSSSSSSSSSSSSSSSSSSSSSSSSS3021
02846,CENTRE DE SOINS LE PRINCIPAL,102,PV,SSSSSSSSSSSSSSSSSSSSSSSSSSSSSSSS2846
07193,CENTRE MÉDICAL EL BETHEL,102,PV,SSSSSSSSSSSSSSSSSSSSSSSSSSSSSSSS7193
02450,CENTRE MEDICAL LES BEATITUDES,102,PV,SSSSSSSSSSSSSSSSSSSSSSSSSSSSSSSS2450
01840,CENTRE MEDICAL PRIVE ABOBO BANCO,102,PV,SSSSSSSSSSSSSSSSSSSSSSSSSSSSSSSS1840
02311,CLINIQUE FATIMA,102,PV,SSSSSSSSSSSSSSSSSSSSSSSSSSSSSSSS2311
02451,CLINIQUE NAFA,102,PV,SSSSSSSSSSSSSSSSSSSSSSSSSSSSSSSS2451
02310,CLINIQUE RAHMAN,102,PV,SSSSSSSSSSSSSSSSSSSSSSSSSSSSSSSS2310
01982,CM PRIVE CLINIQUE EL RAPHA DE ABOBO,102,PV,SSSSSSSSSSSSSSSSSSSSSSSSSSSSSSSS1982
01984,CM PRIVE CLINIQUE SOUTRA DE ABOBO-SAGBE,102,PV,SSSSSSSSSSSSSSSSSSSSSSSSSSSSSSSS1984
01839,CM PRIVE ESPACE MÉDICAL LE SPHYNX,102,PV,SSSSSSSSSSSSSSSSSSSSSSSSSSSSSSSS1839
03441,CM PRIVE MATERNITE SAINT PAUL,102,PV,
07701,CM PRIVE-ONG SAQUO DE ABOBO,102,PV,SSSSSSSSSSSSSSSSSSSSSSSSSSSSSSSS7701
07027,CMS PUBLIC DE ABOBO,102,PB,SSSSSSSSSSSSSSSSSSSSSSSSSSSSSSSS7027
01173,CSU-DM COMMUNAUTAIRE DE ABOBO-AGOUETO,102,PB,SSSSSSSSSSSSSSSSSSSSSSSSSSSSSSSS1173
03015,CSU-DM PRIVE DE  ABOBO,102,PB,SSSSSSSSSSSSSSSSSSSSSSSSSSSSSSSS3015
01567,CSU-DM PUBLIC ASSAPSU ANONKOUA III DE ABOBO,102,PB,SSSSSSSSSSSSSSSSSSSSSSSSSSSSSSSS1567
00678,CSU-DM PUBLIC ASSOUMIN DE ABOBO,102,PB,SSSSSSSSSSSSSSSSSSSSSSSSSSSSSSSS0678
00611,CSU-DM PUBLIC DE ABOBO BOCABO,102,PB,SSSSSSSSSSSSSSSSSSSSSSSSSSSSSSSS0611
01233,CSUS-SSSU 3 PUBLIC DE ABOBO PK18,102,PB,SSSSSSSSSSSSSSSSSSSSSSSSSSSSSSSS1233
00226,FSU COMMUNAUTAIRE DE ABOBO SAGBE,102,PB,SSSSSSSSSSSSSSSSSSSSSSSSSSSSSSSS0226
00065,FSU COMMUNAUTAIRE DE ANONKOUA-KOUTE,102,PB,SSSSSSSSSSSSSSSSSSSSSSSSSSSSSSSS0065
00612,HG PUBLIC DE ABOBO SUD,102,PB,SSSSSSSSSSSSSSSSSSSSSSSSSSSSSSSS0612
00360,ONG COMUPASC,102,PV,SSSSSSSSSSSSSSSSSSSSSSSSSSSSSSSS0360
02449,ONG SMI (SANTE MATERNELLE INFANTILE),102,PV,SSSSSSSSSSSSSSSSSSSSSSSSSSSSSSSS2449
01609,POLYCLINIQUE LES ETOILES DE ABOBO-OUEST,102,PV,SSSSSSSSSSSSSSSSSSSSSSSSSSSSSSSS1609
02828,CENTRE MÉDICAL EMMANUEL EL RAPHA,103,PV,SSSSSSSSSSSSSSSSSSSSSSSSSSSSSSSS2828
03135,CENTRE MEDICAL ESPACE CONFIANCE D' ANYAMA,103,PV,SSSSSSSSSSSSSSSSSSSSSSSSSSSSSSSS3135
02827,CENTRE MÉDICAL OLYMPIQUE,103,PV,SSSSSSSSSSSSSSSSSSSSSSSSSSSSSSSS2827
02826,CENTRE MÉDICAL ROUTE D'ANYAMA,103,PV,SSSSSSSSSSSSSSSSSSSSSSSSSSSSSSSS2826
06678,CM ONG AIME TON PROCHAIN DE ANYAMA,103,PV,SSSSSSSSSSSSSSSSSSSSSSSSSSSSSSSS6678
00806,CSR-D PUBLIC DE AZAGUIE-BLIDA,103,PB,SSSSSSSSSSSSSSSSSSSSSSSSSSSSSSSS0806
02829,CSR-D PUBLIC DE DÉBARCADAIRE,103,PB,SSSSSSSSSSSSSSSSSSSSSSSSSSSSSSSS2829
03253,CSR-DM PUBLIC D'ADAROME,103,PB,
02508,CSR-DM PUBLIC D'ADONKOI 2,103,PB,SSSSSSSSSSSSSSSSSSSSSSSSSSSSSSSS2508
08417,CSR-DM PUBLIC DE AHOUABO,103,PB,SSSSSSSSSSSSSSSSSSSSSSSSSSSSSSSS8417
01418,CSR-DM PUBLIC DE AHOUE,103,PB,SSSSSSSSSSSSSSSSSSSSSSSSSSSSSSSS1418
00187,CSU-DM PUBLIC DE AKOUPE-ANYAMA,103,PB,SSSSSSSSSSSSSSSSSSSSSSSSSSSSSSSS0187
00193,CSR-DM PUBLIC DE ATTIEKOI,103,PB,SSSSSSSSSSSSSSSSSSSSSSSSSSSSSSSS0193
00195,CSU-DM PUBLIC DE ATTINGUIE,103,PB,SSSSSSSSSSSSSSSSSSSSSSSSSSSSSSSS0195
00197,CSU-DM PUBLIC DE BROFODOUME,103,PB,SSSSSSSSSSSSSSSSSSSSSSSSSSSSSSSS0197
00199,CSR-DM PUBLIC DE EBIMPE,103,PB,SSSSSSSSSSSSSSSSSSSSSSSSSSSSSSSS0199
00172,CSR-DM PUBLIC DE IRHO LAME,103,PB,SSSSSSSSSSSSSSSSSSSSSSSSSSSSSSSS0172
00204,CSR-DM PUBLIC DE M'BONOUA,103,PB,SSSSSSSSSSSSSSSSSSSSSSSSSSSSSSSS0204
01838,CSR-DM PUBLIC DE M'BRAGO 1 DE ANYAMA,103,PB,SSSSSSSSSSSSSSSSSSSSSSSSSSSSSSSS1838
00202,CSR-DM PUBLIC DE M'PODY,103,PB,SSSSSSSSSSSSSSSSSSSSSSSSSSSSSSSS0202
06677,CSU-D PRIVE SCB  SIEA DE ANYAMA,103,PV,SSSSSSSSSSSSSSSSSSSSSSSSSSSSSSSS6677
02507,CSU-D PUBLIC D'ALLOKOI,103,PB,SSSSSSSSSSSSSSSSSSSSSSSSSSSSSSSS2507
01981,CSU-D PUBLIC DE ANYAMA,103,PB,SSSSSSSSSSSSSSSSSSSSSSSSSSSSSSSS1981
03134,CSU-DM PUBLIC CISSE D'ANYAMA,103,PB,SSSSSSSSSSSSSSSSSSSSSSSSSSSSSSSS3134
03381,CSU-DM PUBLIC DE ABBEBROUKOI,103,PB,
03383,CSR-DM PUBLIC DE ANYAMA-ADJAME,103,PB,
03380,CSR-DM PUBLIC DE DUBAÏ,103,PB,
03382,CSU-DM PUBLIC DE UNICAFE,103,PB,
07026,CSUS-CDV PUBLIC MAIRIE DE ANYAMA,103,PB,SSSSSSSSSSSSSSSSSSSSSSSSSSSSSSSS7026
07778,HG CONFESSIONNEL SAINT LOUIS ORIONE DE ANYAMA,103,PV,SSSSSSSSSSSSSSSSSSSSSSSSSSSSSSSS7778
00189,HG PUBLIC DE ANYAMA,103,PB,SSSSSSSSSSSSSSSSSSSSSSSSSSSSSSSS0189
01499,INF-LC PUBLIC LYCÉE MODERNE DE ANYAMA,103,PB,SSSSSSSSSSSSSSSSSSSSSSSSSSSSSSSS1499
00190,INF-PRIVE CHRIST ROI DE ANYAMA,103,PV,SSSSSSSSSSSSSSSSSSSSSSSSSSSSSSSS0190
06680,INF-PV PRIVE CLINIQUE TITAGA DE ANYAMA,103,PV,SSSSSSSSSSSSSSSSSSSSSSSSSSSSSSSS6680
06681,INF-PV PRIVE INFIRMÉRIE SCB BADEMA DE ANYAMA,103,PV,SSSSSSSSSSSSSSSSSSSSSSSSSSSSSSSS6681
03028,INF-PV SAINTE MARIE,103,PV,SSSSSSSSSSSSSSSSSSSSSSSSSSSSSSSS3028
02926,CABINET D’OPTICIEN-LUNETIER ESPACE OPTIC STE RITA,104,PV,SSSSSSSSSSSSSSSSSSSSSSSSSSSSSSSS2926
02879,CABINET D’OPTICIEN-LUNETIER OCEAN VISION,104,PV,SSSSSSSSSSSSSSSSSSSSSSSSSSSSSSSS2879
02912,CABINET D’OPTICIEN-LUNETIER OPTIQUE NUCLEAIRE,104,PV,SSSSSSSSSSSSSSSSSSSSSSSSSSSSSSSS2912
02885,COL PENIEL OPTIQUE SHALOM YOP,104,PV,SSSSSSSSSSSSSSSSSSSSSSSSSSSSSSSS2885
02914,COL PROFESSIONNEL OPTIC YOP KOUTE,104,PV,SSSSSSSSSSSSSSSSSSSSSSSSSSSSSSSS2914
02906,CABINET D’OPTICIEN-LUNETIER TOP VISION,104,PV,SSSSSSSSSSSSSSSSSSSSSSSSSSSSSSSS2906
02978,CENTRE MÉDICAL DU FPPN (POLICE NATIONALE),104,PB,SSSSSSSSSSSSSSSSSSSSSSSSSSSSSSSS2978
02418,CENTRE MEDICAL NDA DE NOUVEAU QUARTIER,104,PV,SSSSSSSSSSSSSSSSSSSSSSSSSSSSSSSS2418
03085,CM SACRE COEUR DE YOPOUGON CAMP MILITAIRE,104,PV,SSSSSSSSSSSSSSSSSSSSSSSSSSSSSSSS3085
02416,CLINIQUE SILOHE,104,PV,SSSSSSSSSSSSSSSSSSSSSSSSSSSSSSSS2416
02421,CLINIQUE HOZANNA  DE CAMP MILITAIRE,104,PV,SSSSSSSSSSSSSSSSSSSSSSSSSSSSSSSS2421
02309,CLINIQUE LES OLIVIERS,104,PV,SSSSSSSSSSSSSSSSSSSSSSSSSSSSSSSS2309
09722,CM CHRYSALIDE DE YOPOUGON TOIT-ROUGE,104,PV,SSSSSSSSSSSSSSSSSSSSSSSSSSSSSSSS9722
02423,CLINIQUE PIERRE MARIE HAGMAN DE SIDECI IGES,104,PV,SSSSSSSSSSSSSSSSSSSSSSSSSSSSSSSS2423
02422,CLINIQUE SAINTE FAMILLE DE SIDECI LEM,104,PV,SSSSSSSSSSSSSSSSSSSSSSSSSSSSSSSS2422
07911,CMS CONFESSIONNEL BETHESDA DE YOPOUGON,104,PV,SSSSSSSSSSSSSSSSSSSSSSSSSSSSSSSS7911
07912,CMS CONFESSIONNEL OEUVRES ET MISSION BAPTISTE DE Y,104,PV,SSSSSSSSSSSSSSSSSSSSSSSSSSSSSSSS7912
07921,CMS CONFESSIONNEL OEUVRES ET MISSION BAPTISTE DE Y,104,PV,SSSSSSSSSSSSSSSSSSSSSSSSSSSSSSSS7921
03254,CMS CONFESSIONNEL SAINT LAURENT DE YOPOUGON KOUTE,104,PV,
00151,CMS PRIVE CNPS DE YOPOUGON,104,PV,SSSSSSSSSSSSSSSSSSSSSSSSSSSSSSSS0151
00939,CMS PRIVE-ONG CENTRE PLUS DE YOPOUGON-EST,104,PV,SSSSSSSSSSSSSSSSSSSSSSSSSSSSSSSS0939
09734,CMS PRIVE-ONG EDEN DE YOPOUGON EST,104,PV,SSSSSSSSSSSSSSSSSSSSSSSSSSSSSSSS9734
02380,CMS PRIVE-ONG GVD,104,PV,SSSSSSSSSSSSSSSSSSSSSSSSSSSSSSSS2380
07704,CMS PRIVE-ONG NAZAREEN DE YOPOUGON,104,PV,SSSSSSSSSSSSSSSSSSSSSSSSSSSSSSSS7704
00155,CSU-D PUBLIC DE PRISON MACA DE YOPOUGON,104,PB,SSSSSSSSSSSSSSSSSSSSSSSSSSSSSSSS0155
01276,CSU-DM COMMUNAUTAIRE DE YOPOUGON ANDOKOI,104,PB,SSSSSSSSSSSSSSSSSSSSSSSSSSSSSSSS1276
07702,CSU-DM PRIVE-ONG ASAPSU I DE YOPOUGON,104,PV,SSSSSSSSSSSSSSSSSSSSSSSSSSSSSSSS7702
07703,CSU-DM PRIVE-ONG CAMES DE YOPOUGON,104,PV,SSSSSSSSSSSSSSSSSSSSSSSSSSSSSSSS7703
00012,CSU-DM PUBLIC DE YOPOUGON SANTE,104,PB,SSSSSSSSSSSSSSSSSSSSSSSSSSSSSSSS0012
00941,CSU-DM PUBLIC DE YOPOUGON-ILE BOULAY,104,PB,SSSSSSSSSSSSSSSSSSSSSSSSSSSSSSSS0941
01498,CSUS-SSSU PUBLIC SICOGI DE YOPOUGON,104,PB,SSSSSSSSSSSSSSSSSSSSSSSSSSSSSSSS1498
02415,ESPACE MEDICAL PHENIX,104,PV,SSSSSSSSSSSSSSSSSSSSSSSSSSSSSSSS2415
02417,ESPACE MEDICAL SAINT SIMON,104,PV,SSSSSSSSSSSSSSSSSSSSSSSSSSSSSSSS2417
01443,FSU COMMUNAUTAIRE DE YOPOUGON KOUTE,104,PB,SSSSSSSSSSSSSSSSSSSSSSSSSSSSSSSS1443
00150,FSU COMMUNAUTAIRE DE YOPOUGON TOITS-ROUGES,104,PB,SSSSSSSSSSSSSSSSSSSSSSSSSSSSSSSS0150
06155,FSU COMMUNAUTAIRE MUDESCA KOWEIT DE YOPOUGON,104,PB,SSSSSSSSSSSSSSSSSSSSSSSSSSSSSSSS6155
00080,FSU COMMUNAUTAIRE OUASSAKARA DE YOPOUGON,104,PB,SSSSSSSSSSSSSSSSSSSSSSSSSSSSSSSS0080
02419,HOTEL MEDICAL MARIA DE CAMP MILITAIRE,104,PV,SSSSSSSSSSSSSSSSSSSSSSSSSSSSSSSS2419
02572,ICT 4ÈME CIE GSPM DE YOPOUGON,104,PB,SSSSSSSSSSSSSSSSSSSSSSSSSSSSSSSS2572
03255,INF-D PUBLIC MACA EXTERIEUR,104,PB,
03029,INFIRMERIE ASSISTANCE MÉDICALE HUMANITAIRE,104,PV,SSSSSSSSSSSSSSSSSSSSSSSSSSSSSSSS3029
00071,INF-LC PUBLIC COLLÈGE JEUNES FILLES DE YOPOUGON,104,PB,SSSSSSSSSSSSSSSSSSSSSSSSSSSSSSSS0071
01117,INF-LC PUBLIC COLLÈGE MODERNE ANDOKOI DE YOPOUGON,104,PB,SSSSSSSSSSSSSSSSSSSSSSSSSSSSSSSS1117
01508,INF-LC PUBLIC LYCÉE PROFESSIONNEL DE YOPOUGON,104,PB,SSSSSSSSSSSSSSSSSSSSSSSSSSSSSSSS1508
01280,INF-LC PUBLIC MUNICIPAL DE YOPOUGON,104,PB,SSSSSSSSSSSSSSSSSSSSSSSSSSSSSSSS1280
03484,MATERNITE SAINTE MADELAINE,104,PV,
03488,NOUFRA OPTIC,104,PV,
02414,NOUVELLE CLINIQUE IROKO,104,PV,SSSSSSSSSSSSSSSSSSSSSSSSSSSSSSSS2414
02819,NOUVELLE CLINIQUE SAINTE JOSIANE,104,PV,SSSSSSSSSSSSSSSSSSSSSSSSSSSSSSSS2819
02420,POLYCLINIQUE DE YOPOUGON DE ABOBODOUME,104,PV,SSSSSSSSSSSSSSSSSSSSSSSSSSSSSSSS2420
02855,SERVICE MEDICO-SOCIAL DE SOTRA YOPOUGON,104,PV,SSSSSSSSSSSSSSSSSSSSSSSSSSSSSSSS2855
03024,CABINET D’OPTICIEN-LUNETIER   OPTIC ROC,105,PV,SSSSSSSSSSSSSSSSSSSSSSSSSSSSSSSS3024
02915,CABINET D’OPTICIEN-LUNETIER BIO-MED OPTIQUE,105,PV,SSSSSSSSSSSSSSSSSSSSSSSSSSSSSSSS2915
02875,CABINET D’OPTICIEN-LUNETIER EDEN OPTIC,105,PV,SSSSSSSSSSSSSSSSSSSSSSSSSSSSSSSS2875
03019,CABINET D’OPTICIEN-LUNETIER MAITRE OPTICS,105,PV,SSSSSSSSSSSSSSSSSSSSSSSSSSSSSSSS3019
02911,CABINET D’OPTICIEN-LUNETIER MIRACLE OPTIC,105,PV,SSSSSSSSSSSSSSSSSSSSSSSSSSSSSSSS2911
02916,CABINET D’OPTICIEN-LUNETIER OPTIC CENTER,105,PV,SSSSSSSSSSSSSSSSSSSSSSSSSSSSSSSS2916
02907,CABINET D’OPTICIEN-LUNETIER RÉEL OPTICAL,105,PV,SSSSSSSSSSSSSSSSSSSSSSSSSSSSSSSS2907
03100,CABINET D’OPTICIEN-LUNETIER SHAMMA OPTIQUE,105,PV,SSSSSSSSSSSSSSSSSSSSSSSSSSSSSSSS3100
03009,CABINET DE CSPA BOYA,105,PV,SSSSSSSSSSSSSSSSSSSSSSSSSSSSSSSS3009
03256,CENTRE  MEDICAL EDEN 2,105,PV,
02441,CENTRE MEDECIAL SAINT-MICHEL ARCHANGE,105,PV,SSSSSSSSSSSSSSSSSSSSSSSSSSSSSSSS2441
02443,CENTRE MEDICAL  LA NOUVELLE ALLIANCE,105,PV,SSSSSSSSSSSSSSSSSSSSSSSSSSSSSSSS2443
02447,CENTRE MEDICAL REHOBOTH,105,PV,SSSSSSSSSSSSSSSSSSSSSSSSSSSSSSSS2447
03480,CENTRE SOCIAL DE NIANGON SUD,105,PB,
03495,CENTRE SOCIAL DE PORT BOUET 2,105,PB,
00149,CHU PUBLIC DE YOPOUGON,105,PB,LLLLLLLLLLLLLLLLLLLLLLLLLLLLLLLLL148
02424,CLINIQUE CITE VERTE,105,PV,SSSSSSSSSSSSSSSSSSSSSSSSSSSSSSSS2424
00943,CLINIQUE GRAND CENTRE,105,PV,SSSSSSSSSSSSSSSSSSSSSSSSSSSSSSSS0943
09721,CLINIQUE JANE LEORA,105,PV,SSSSSSSSSSSSSSSSSSSSSSSSSSSSSSSS9721
02429,CLINIQUE LA GRACE DIVINE DE YOPOUGON,105,PV,SSSSSSSSSSSSSSSSSSSSSSSSSSSSSSSS2429
02442,CLINIQUE MAMIE ADJOUA,105,PV,SSSSSSSSSSSSSSSSSSSSSSSSSSSSSSSS2442
03223,CLINIQUE MEDICALE ACADEMIE DES MERS,105,PV,SSSSSSSSSSSSSSSSSSSSSSSSSSSSSSSS3223
02427,CLINIQUE MEDICALE CHANDILIE,105,PV,SSSSSSSSSSSSSSSSSSSSSSSSSSSSSSSS2427
02437,CLINIQUE MEDICALE GRANDE ETOILE,105,PV,SSSSSSSSSSSSSSSSSSSSSSSSSSSSSSSS2437
02446,CLINIQUE MEDICALE HOUPHOUET,105,PV,SSSSSSSSSSSSSSSSSSSSSSSSSSSSSSSS2446
02435,CLINIQUE MEDICALE LE BANCO,105,PV,SSSSSSSSSSSSSSSSSSSSSSSSSSSSSSSS2435
02433,CLINIQUE MEDICALE LE BELIER,105,PV,SSSSSSSSSSSSSSSSSSSSSSSSSSSSSSSS2433
02448,CLINIQUE MEDICALE MONT CARMEL,105,PV,SSSSSSSSSSSSSSSSSSSSSSSSSSSSSSSS2448
03121,CM SAINT MATTHIEU YOPOUGON CITÉ VERTE,105,PV,SSSSSSSSSSSSSSSSSSSSSSSSSSSSSSSS3121
02440,CLINIQUE MEDICO CHIRURGICALE SAINT RAPHAEL,105,PV,SSSSSSSSSSSSSSSSSSSSSSSSSSSSSSSS2440
02432,CLINIQUE QUEEN LATIFA,105,PV,SSSSSSSSSSSSSSSSSSSSSSSSSSSSSSSS2432
02425,CLINIQUE SAINTE MARIE,105,PV,SSSSSSSSSSSSSSSSSSSSSSSSSSSSSSSS2425
09720,CLINIQUE STE RITA DE CASCIA,105,PV,SSSSSSSSSSSSSSSSSSSSSSSSSSSSSSSS9720
07901,CM PRIVE NIEKY DE SONGON KASSABLE,105,PV,SSSSSSSSSSSSSSSSSSSSSSSSSSSSSSSS7901
07902,CM PRIVE PALMAFRIQUE DE SONGON KASSABLE,105,PV,SSSSSSSSSSSSSSSSSSSSSSSSSSSSSSSS7902
07272,CM PRIVE SOLIDARITÉ DE YOPOUGON,105,PV,SSSSSSSSSSSSSSSSSSSSSSSSSSSSSSSS7272
07275,CMS PRIVE ABOYA-VIE DE YOPOUGON,105,PV,SSSSSSSSSSSSSSSSSSSSSSSSSSSSSSSS7275
02769,CMS PRIVÉ DROPPIN CENTER ESPACE CONFIANCE,105,PV,SSSSSSSSSSSSSSSSSSSSSSSSSSSSSSSS2769
00954,CMS PRIVE FUTURO DE SONGON AGBAN,105,PV,SSSSSSSSSSSSSSSSSSSSSSSSSSSSSSSS0954
00964,CMS PRIVE JC EL RAPHA,105,PV,SSSSSSSSSSSSSSSSSSSSSSSSSSSSSSSS0964
00980,CNRA,105,PV,SSSSSSSSSSSSSSSSSSSSSSSSSSSSSSSS0980
06799,CSC AS PRIVE DE BONIKRO,105,PV,SSSSSSSSSSSSSSSSSSSSSSSSSSSSSSSS6799
00266,CSR-D PUBLIC DE BAGO,105,PB,SSSSSSSSSSSSSSSSSSSSSSSSSSSSSSSS0266
01197,CSR-D PUBLIC DE KOSSIHOUEN,105,PB,SSSSSSSSSSSSSSSSSSSSSSSSSSSSSSSS1197
03276,CSR-DM PUBLIC D' ISSAKRO (DIST. YOPOUGON-OUEST SON,105,PB,
00207,CSR-DM PUBLIC DE ADIOPODOUME,105,PB,SSSSSSSSSSSSSSSSSSSSSSSSSSSSSSSS0207
00270,CSR-DM PUBLIC DE SONGON AGBAN,105,PB,SSSSSSSSSSSSSSSSSSSSSSSSSSSSSSSS0270
01965,CSR-I PUBLIC DE ABADJIN-KOUTE,105,PB,SSSSSSSSSSSSSSSSSSSSSSSSSSSSSSSS1965
04557,CSU-D CONF SOEUR PASSIONNISTE D' ABADJIN-DOUME,105,PB,SSSSSSSSSSSSSSSSSSSSSSSSSSSSSSSS4557
00013,CSU-D PRIVE THÈRESE HAULY DE ADIOPODOUME,105,PV,SSSSSSSSSSSSSSSSSSSSSSSSSSSSSSSS0013
01406,CSU-DM COMMUNAUTAIRE DE YOPOUGON AZITO,105,PB,SSSSSSSSSSSSSSSSSSSSSSSSSSSSSSSS1406
01572,CSU-DM COMMUNAUTAIRE GESCO MANUTENTION DE YOPOUGON,105,PB,SSSSSSSSSSSSSSSSSSSSSSSSSSSSSSSS1572
00158,CSU-DM COMMUNAUTAIRE NIANGON LOKOA DE YOPOUGON,105,PB,SSSSSSSSSSSSSSSSSSSSSSSSSSSSSSSS0158
02740,CSU-DM CONFESSIONNEL SOEUR CATHÉRINE DE YOPOUGON,105,PV,SSSSSSSSSSSSSSSSSSSSSSSSSSSSSSSS2740
06800,CSU-DM PRIVE ASAPSU DE GESCO,105,PB,SSSSSSSSSSSSSSSSSSSSSSSSSSSSSSSS6800
00268,CSU-DM PUBLIC DE SONGON KASSABLE,105,PB,SSSSSSSSSSSSSSSSSSSSSSSSSSSSSSSS0268
03054,CSUS-CAT PUBLIC DE YOPOUGON ATTIE,105,PB,SSSSSSSSSSSSSSSSSSSSSSSSSSSSSSSS3054
07707,CSUS-CDV PRIVE AIBEF DE YOPOUGON,105,PV,SSSSSSSSSSSSSSSSSSSSSSSSSSSSSSSS7707
07708,CSUS-CDV PRIVE CENTRE D'ESPÉRANCE NDA GESCO,105,PV,SSSSSSSSSSSSSSSSSSSSSSSSSSSSSSSS7708
02680,CSUS-SSSU 3 PUBLIC DE YOPOUGON KOUTE,105,PB,SSSSSSSSSSSSSSSSSSSSSSSSSSSSSSSS2680
06801,CSUS-SSSU PUBLIC DE  YOUPOUGON OUEST SONGON,105,PB,SSSSSSSSSSSSSSSSSSSSSSSSSSSSSSSS6801
03138,CSUS-SSSU PUBLIC DE SONGON (DIST. YOS),105,PB,SSSSSSSSSSSSSSSSSSSSSSSSSSSSSSSS3138
00339,FSU COMMUNAUTAIRE DE ADIOPODOUME,105,PB,SSSSSSSSSSSSSSSSSSSSSSSSSSSSSSSS0339
01025,FSU COMMUNAUTAIRE DE YOPOUGON GESCO,105,PB,SSSSSSSSSSSSSSSSSSSSSSSSSSSSSSSS1025
00679,FSU COMMUNAUTAIRE DE YOPOUGON NIANGON-SUD,105,PB,SSSSSSSSSSSSSSSSSSSSSSSSSSSSSSSS0679
01001,FSU COMMUNAUTAIRE DE YOPOUGON PORT-BOUET II,105,PB,SSSSSSSSSSSSSSSSSSSSSSSSSSSSSSSS1001
03199,FSU PUBLIC DE MICAO,105,PB,SSSSSSSSSSSSSSSSSSSSSSSSSSSSSSSS3199
02426,GROUPE MEDICAL PROMETHÉE,105,PV,SSSSSSSSSSSSSSSSSSSSSSSSSSSSSSSS2426
00152,HG PUBLIC DE YOPOUGON-ATTIE,105,PB,SSSSSSSSSSSSSSSSSSSSSSSSSSSSSSSS0152
03048,HGS PRIVE CEPREF DE YOPOUGON ATTIE,105,PV,SSSSSSSSSSSSSSSSSSSSSSSSSSSSSSSS3048
02584,ICT ESC 2/1 YOPOUGON,105,PB,SSSSSSSSSSSSSSSSSSSSSSSSSSSSSSSS2584
01335,INF-LC PUBLIC COLLÈGE ABADJAN KOUTÉ DE YOPOUGON,105,PB,SSSSSSSSSSSSSSSSSSSSSSSSSSSSSSSS1335
03304,INF-P PUBLIC POUPONNIERE DE YOPOUGON ATTIE,105,PB,
04441,INF-M BASE NAVALE DE LOCODJORO,201,PB,SSSSSSSSSSSSSSSSSSSSSSSSSSSSSSSS4441
02874,CABINET D’OPTICIEN-LUNETIER AMITIE OPTIQUE,201,PV,SSSSSSSSSSSSSSSSSSSSSSSSSSSSSSSS2874
02920,CABINET D’OPTICIEN-LUNETIER COMUTUALISTE CI,201,PV,SSSSSSSSSSSSSSSSSSSSSSSSSSSSSSSS2920
02905,CABINET D’OPTICIEN-LUNETIER DELTA OPTIQUE,201,PV,SSSSSSSSSSSSSSSSSSSSSSSSSSSSSSSS2905
02904,CABINET D’OPTICIEN-LUNETIER ENVIE D'Y VOIR,201,PV,SSSSSSSSSSSSSSSSSSSSSSSSSSSSSSSS2904
02909,CABINET D’OPTICIEN-LUNETIER FAMILLE VISION,201,PV,SSSSSSSSSSSSSSSSSSSSSSSSSSSSSSSS2909
02883,CABINET D’OPTICIEN-LUNETIER IVOIRE LUNETTE,201,PV,SSSSSSSSSSSSSSSSSSSSSSSSSSSSSSSS2883
02886,CABINET D’OPTICIEN-LUNETIER OPTICA,201,PV,SSSSSSSSSSSSSSSSSSSSSSSSSSSSSSSS2886
02878,COL PENIEL OPTIQUE SHALOM ADJAME,201,PV,SSSSSSSSSSSSSSSSSSSSSSSSSSSSSSSS2878
02919,CABINET OPTICIEN-LUNETIER SALUNE,201,PV,SSSSSSSSSSSSSSSSSSSSSSSSSSSSSSSS2919
01586,CDV GARE ROUTIÈRE (ONG ACTION LUMIÈRE) DE ADJAME,201,PV,SSSSSSSSSSSSSSSSSSSSSSSSSSSSSSSS1586
00366,CDV PAVVIOS DE ATTECOUBE,201,PV,SSSSSSSSSSSSSSSSSSSSSSSSSSSSSSSS0366
00521,CENTRE D' ECOUTE ALLAH KOUADIO REMI DE ATTECOUBE,201,PV,SSSSSSSSSSSSSSSSSSSSSSSSSSSSSSSS0521
00541,CENTRE DE CROIX BLEUE DE WILLIAMSVILLE,201,PV,SSSSSSSSSSSSSSSSSSSSSSSSSSSSSSSS0541
03277,CENTRE DE SANTE MEDICAL LA GLOIRE (SODECI/FILTISAC,201,PV,
03278,CENTRE MEDICAL ANADER,201,PV,
02776,CENTRE MEDICAL FILTISAC,201,PV,SSSSSSSSSSSSSSSSSSSSSSSSSSSSSSSS2776
01977,CENTRE MÉDICAL INTERENTREPRISE DU PLATEAU,201,PV,SSSSSSSSSSSSSSSSSSSSSSSSSSSSSSSS1977
03084,CENTRE MEDICAL LA MAIRIE D’ADJAMÉ,201,PV,SSSSSSSSSSSSSSSSSSSSSSSSSSSSSSSS3084
01694,CENTRE MEDICAL PUBLIC  DE LA PRESIDENCE,201,PB,SSSSSSSSSSSSSSSSSSSSSSSSSSSSSSSS1694
01649,CM PUBLIC DE LA GARDE REPUBLICAINE ABIDJAN,201,PB,SSSSSSSSSSSSSSSSSSSSSSSSSSSSSSSS1649
03081,CENTRE MEDICAL RASSOUL D' ADJAMÉ,201,PV,SSSSSSSSSSSSSSSSSSSSSSSSSSSSSSSS3081
03000,CENTRE MEDICAL SAINT JOSEPH,201,PV,SSSSSSSSSSSSSSSSSSSSSSSSSSSSSSSS3000
00587,CENTRE MEDICAL THEMIS DU PLATEAU,201,PV,SSSSSSSSSSSSSSSSSSSSSSSSSSSSSSSS0587
00610,CENTRE SOCIAL DE 220 LOGEMENTS DE ADJAME,201,PB,SSSSSSSSSSSSSSSSSSSSSSSSSSSSSSSS0610
00699,CENTRE SOCIAL DE ABOBO DOUME,201,PB,SSSSSSSSSSSSSSSSSSSSSSSSSSSSSSSS0699
00733,CENTRE SOCIAL DE ADJAME SANTE,201,PB,SSSSSSSSSSSSSSSSSSSSSSSSSSSSSSSS0733
00745,CENTRE SOCIAL DE ADJAME VILLAGE,201,PB,SSSSSSSSSSSSSSSSSSSSSSSSSSSSSSSS0745
00775,CENTRE SOCIAL DE ATTECOUBE,201,PB,SSSSSSSSSSSSSSSSSSSSSSSSSSSSSSSS0775
00779,CENTRE SOCIAL DE BROMAKOTE,201,PB,SSSSSSSSSSSSSSSSSSSSSSSSSSSSSSSS0779
00809,CLINIQUE HALL INRI FRATERNITÉ,201,PV,SSSSSSSSSSSSSSSSSSSSSSSSSSSSSSSS0809
02780,CLINIQUE HOPE ROAD HOSPITAL,201,PV,SSSSSSSSSSSSSSSSSSSSSSSSSSSSSSSS2780
01781,CLINIQUE MÉDICAL FRATERNITE DE ADJAME,201,PV,SSSSSSSSSSSSSSSSSSSSSSSSSSSSSSSS1781
01706,CLINIQUE MEDICAL PRIVE D'ADJAME LIBERTE,201,PV,SSSSSSSSSSSSSSSSSSSSSSSSSSSSSSSS1706
02774,CLINIQUE MEDICALE AZIZ,201,PV,SSSSSSSSSSSSSSSSSSSSSSSSSSSSSSSS2774
02771,CLINIQUE MEDICALE ELEIS,201,PV,SSSSSSSSSSSSSSSSSSSSSSSSSSSSSSSS2771
02772,CLINIQUE MEDICALE LA CITADELLE,201,PV,SSSSSSSSSSSSSSSSSSSSSSSSSSSSSSSS2772
02773,CLINIQUE MEDICALE LE PLURIEL,201,PV,SSSSSSSSSSSSSSSSSSSSSSSSSSSSSSSS2773
02775,CLINIQUE MEDICALE RASSUL,201,PV,SSSSSSSSSSSSSSSSSSSSSSSSSSSSSSSS2775
01782,CLINIQUE PRIVÉE GROUPE MÉDICAL DU PLATEAU,201,PV,SSSSSSSSSSSSSSSSSSSSSSSSSSSSSSSS1782
02777,CM NOUVELLE ALLIANCE AVEC DIEU D'ADJAME,201,PV,SSSSSSSSSSSSSSSSSSSSSSSSSSSSSSSS2777
07784,CMS PRIVE ASSEMBLÉE NATIONAL DE PLATEAU,201,PV,SSSSSSSSSSSSSSSSSSSSSSSSSSSSSSSS7784
03165,CMS PRIVÉ DIC ESPACE CONFIANCE APA,201,PV,SSSSSSSSSSSSSSSSSSSSSSSSSSSSSSSS3165
01980,CMS PRIVE KOUASSI KOUAMÉ DES FINANCES DE PLATEAU,201,PV,SSSSSSSSSSSSSSSSSSSSSSSSSSSSSSSS1980
01033,CMS PRIVE PAUL BOHOUN BOUABRÉ DU TRÉSOR DE PLATEAU,201,PV,SSSSSSSSSSSSSSSSSSSSSSSSSSSSSSSS1033
00387,CMS PUBLIC GSPM DE INDENIÉ DE ADJAME,201,PB,SSSSSSSSSSSSSSSSSSSSSSSSSSSSSSSS0387
01538,CMS PUBLIC IMPRIMÉRIE NATIONAL DE PLATEAU,201,PB,SSSSSSSSSSSSSSSSSSSSSSSSSSSSSSSS1538
00122,CMS PUBLIC MARINE DE PLATEAU,201,PB,SSSSSSSSSSSSSSSSSSSSSSSSSSSSSSSS0122
00083,CSU-D PUBLIC CITÉ ENFANCE - CROIX ROUGE D' ADJAME,201,PB,SSSSSSSSSSSSSSSSSSSSSSSSSSSSSSSS0083
00082,CSU-D PUBLIC DE ADJAME WILLIAMSVILLE,201,PB,SSSSSSSSSSSSSSSSSSSSSSSSSSSSSSSS0082
01633,CSU-D PUBLIC DISPENSAIRE DE LA MARINE DE PLATEAU,201,PB,SSSSSSSSSSSSSSSSSSSSSSSSSSSSSSSS1633
01208,CSU-DM COMMUNAUTAIRE DE ABOBO-DOUME,201,PB,SSSSSSSSSSSSSSSSSSSSSSSSSSSSSSSS1208
01122,CSU-DM COMMUNAUTAIRE DE ADJAME WILIAMSVILLE,201,PB,SSSSSSSSSSSSSSSSSSSSSSSSSSSSSSSS1122
00945,CSU-DM COMMUNAUTAIRE DE AGBAN VILLAGE,201,PB,SSSSSSSSSSSSSSSSSSSSSSSSSSSSSSSS0945
01127,CSU-DM COMMUNAUTAIRE JEAN PAUL II ASSAPSU DE ATTEC,201,PB,SSSSSSSSSSSSSSSSSSSSSSSSSSSSSSSS1127
02211,CSU-DM PUBLIC ABIDJAN SANTAI,201,PB,SSSSSSSSSSSSSSSSSSSSSSSSSSSSSSSS2211
02778,CSU-DM PUBLIC ATTÉCOUBÉ 3,201,PB,SSSSSSSSSSSSSSSSSSSSSSSSSSSSSSSS2778
00089,CSU-DM PUBLIC DE ABOBO-DOUME,201,PB,SSSSSSSSSSSSSSSSSSSSSSSSSSSSSSSS0089
00093,CSU-DM PUBLIC DE LOCODJRO,201,PB,SSSSSSSSSSSSSSSSSSSSSSSSSSSSSSSS0093
02779,CSU-M PUBLIC DIYA,201,PB,SSSSSSSSSSSSSSSSSSSSSSSSSSSSSSSS2779
00069,CSUS-CAT PUBLIC DE ADJAME,201,PB,SSSSSSSSSSSSSSSSSSSSSSSSSSSSSSSS0069
06993,CSUS-CDV PRIVE CIPS ESPOIR DE PLATEAU,201,PV,SSSSSSSSSSSSSSSSSSSSSSSSSSSSSSSS6993
00123,CSUS-PMI PUBLIC INSP DE PLATEAU,201,PB,SSSSSSSSSSSSSSSSSSSSSSSSSSSSSSSS0123
00073,CSUS-SSSU PUBLIC DE ADJAME-CENTRE,201,PB,SSSSSSSSSSSSSSSSSSSSSSSSSSSSSSSS0073
00072,CSUS-SSSU PUBLIC DE ADJAME-NORD,201,PB,SSSSSSSSSSSSSSSSSSSSSSSSSSSSSSSS0072
