code,name,district_code,facility_type,source_uuid
00433,CSU-D PUBLIC DE DIEOUZON,1601,PB,SSSSSSSSSSSSSSSSSSSSSSSSSSSSSSSS0433
00436,CSU-D PUBLIC DE GOHOUO ZAGNA,1601,PB,SSSSSSSSSSSSSSSSSSSSSSSSSSSSSSSS0436
01934,CSU-D PUBLIC DE GUINGLO TAHOUAKE,1601,PB,SSSSSSSSSSSSSSSSSSSSSSSSSSSSSSSS1934
08825,CSU-D PUBLIC DE KAHEN-ZARABAON,1601,PB,SSSSSSSSSSSSSSSSSSSSSSSSSSSSSSSS8825
00439,CSU-D PUBLIC DE ZOU,1601,PB,SSSSSSSSSSSSSSSSSSSSSSSSSSSSSSSS0439
02748,CSU-DM PUBLIC DE BANGOLO CARREFOUR,1601,PB,SSSSSSSSSSSSSSSSSSSSSSSSSSSSSSSS2748
00438,CSU-DM PUBLIC DE ZEO,1601,PB,SSSSSSSSSSSSSSSSSSSSSSSSSSSSSSSS0438
00349,CSUS-PMI PUBLIC DE BANGOLO,1601,PB,SSSSSSSSSSSSSSSSSSSSSSSSSSSSSSSS0349
00430,HG PUBLIC DE BANGOLO,1601,PB,SSSSSSSSSSSSSSSSSSSSSSSSSSSSSSSS0430
00816,CHR PUBLIC DE DUEKOUE,1602,PB,SSSSSSSSSSSSSSSSSSSSSSSSSSSSSSSS0816
02038,CMS PRIVE AIBEF DE  DUEKOUE,1602,PV,SSSSSSSSSSSSSSSSSSSSSSSSSSSSSSSS2038
03061,CMS PRIVE THANRY DE  DUEKOUE,1602,PV,SSSSSSSSSSSSSSSSSSSSSSSSSSSSSSSS3061
09842,CSR-D PUBLIC DE  BAHE-SEBON,1602,PB,SSSSSSSSSSSSSSSSSSSSSSSSSSSSSSSS9842
02245,CSR-D PUBLIC DE AMANI MICHELKRO,1602,PB,SSSSSSSSSSSSSSSSSSSSSSSSSSSSSSSS2245
01893,CSR-D PUBLIC DE BAOUBLY,1602,PB,SSSSSSSSSSSSSSSSSSSSSSSSSSSSSSSS1893
02249,BINAO,1602,PB,SSSSSSSSSSSSSSSSSSSSSSSSSSSSSSSS2249
02240,CSR-D PUBLIC DE BLODY,1602,PB,SSSSSSSSSSSSSSSSSSSSSSSSSSSSSSSS2240
01889,CSR-D PUBLIC DE BOHOUSSOUKRO,1602,PB,SSSSSSSSSSSSSSSSSSSSSSSSSSSSSSSS1889
02242,CSR-D PUBLIC DE DAHOUA,1602,PB,SSSSSSSSSSSSSSSSSSSSSSSSSSSSSSSS2242
01886,CSR-D PUBLIC DE DIAHOUIN,1602,PB,SSSSSSSSSSSSSSSSSSSSSSSSSSSSSSSS1886
01297,CSR-D PUBLIC DE DIBOBLY,1602,PB,SSSSSSSSSSSSSSSSSSSSSSSSSSSSSSSS1297
07679,CSR-D PUBLIC DE DIOUROUZON,1602,PB,SSSSSSSSSSSSSSSSSSSSSSSSSSSSSSSS7679
01761,CSR-D PUBLIC DE FENGOLO (S/P DUÉKOUÉ),1602,PB,SSSSSSSSSSSSSSSSSSSSSSSSSSSSSSSS1761
01891,CSR-D PUBLIC DE FOUEDOUGOU,1602,PB,SSSSSSSSSSSSSSSSSSSSSSSSSSSSSSSS1891
02241,CSR-D PUBLIC DE GLAOU,1602,PB,SSSSSSSSSSSSSSSSSSSSSSSSSSSSSSSS2241
02246,CSR-D PUBLIC DE GOZON (DIST. DUEKOUE),1602,PB,SSSSSSSSSSSSSSSSSSSSSSSSSSSSSSSS2246
02244,CSR-D PUBLIC DE GREIKRO,1602,PB,SSSSSSSSSSSSSSSSSSSSSSSSSSSSSSSS2244
00571,CSR-D PUBLIC DE GUINGLO-ZIA,1602,PB,SSSSSSSSSSSSSSSSSSSSSSSSSSSSSSSS0571
07178,CSR-D PUBLIC DE KRANZADOUGOU,1602,PB,SSSSSSSSSSSSSSSSSSSSSSSSSSSSSSSS7178
01936,CSR-D PUBLIC DE LEDJAN V14,1602,PB,SSSSSSSSSSSSSSSSSSSSSSSSSSSSSSSS1936
01888,CSR-D PUBLIC DE NIAMBLY,1602,PB,SSSSSSSSSSSSSSSSSSSSSSSSSSSSSSSS1888
08210,CSR-D PUBLIC DE NIDROU (S/P BAGOHOUO),1602,PB,SSSSSSSSSSSSSSSSSSSSSSSSSSSSSSSS8210
07180,CSR-D PUBLIC DE OUATTARADOUGOU (S/P GBAPLEU),1602,PB,SSSSSSSSSSSSSSSSSSSSSSSSSSSSSSSS7180
02501,CSR-D PUBLIC DE PAPADOUGOU,1602,PB,SSSSSSSSSSSSSSSSSSSSSSSSSSSSSSSS2501
02247,CSR-D PUBLIC DE PETIT GUIGLO (DIST. DUEKOUE),1602,PB,SSSSSSSSSSSSSSSSSSSSSSSSSSSSSSSS2247
01737,CSR-D PUBLIC DE PINHOU,1602,PB,SSSSSSSSSSSSSSSSSSSSSSSSSSSSSSSS1737
02243,CSR-D PUBLIC DE PONAN OUINLO,1602,PB,SSSSSSSSSSSSSSSSSSSSSSSSSSSSSSSS2243
00574,CSR-D PUBLIC DE PONAN VAHI,1602,PB,SSSSSSSSSSSSSSSSSSSSSSSSSSSSSSSS0574
01887,CSR-D PUBLIC DE TOA ZEO,1602,PB,SSSSSSSSSSSSSSSSSSSSSSSSSSSSSSSS1887
02248,CSR-D PUBLIC DE YROUZON,1602,PB,SSSSSSSSSSSSSSSSSSSSSSSSSSSSSSSS2248
02994,CSR-DM PUBLIC DE LOKOSSO,1602,PB,SSSSSSSSSSSSSSSSSSSSSSSSSSSSSSSS2994
02039,CSU-D CONFESSIONNEL DES SŒURS SALESIENNES,1602,PV,SSSSSSSSSSSSSSSSSSSSSSSSSSSSSSSS2039
00820,CSU-D PUBLIC DE GUEHIEBLY,1602,PB,SSSSSSSSSSSSSSSSSSSSSSSSSSSSSSSS0820
01735,CSU-D PUBLIC DE GUEZON,1602,PB,SSSSSSSSSSSSSSSSSSSSSSSSSSSSSSSS1735
00555,CSU-D PUBLIC DIAYE BERNARD DE DUEKOUE,1602,PB,SSSSSSSSSSSSSSSSSSSSSSSSSSSSSSSS0555
02476,CSU-DM PUBLIC DE BAGOHOUO,1602,PB,SSSSSSSSSSSSSSSSSSSSSSSSSSSSSSSS2476
00819,CSU-DM PUBLIC DE GBAPLEU,1602,PB,SSSSSSSSSSSSSSSSSSSSSSSSSSSSSSSS0819
02502,CSU-M PUBLIC DE KOKOMAN,1602,PB,SSSSSSSSSSSSSSSSSSSSSSSSSSSSSSSS2502
03431,CSUS-CAT PUBLIC DE DUEKOUE,1602,PB,
00059,CSUS-PMI PUBLIC DE DUEKOUE,1602,PB,SSSSSSSSSSSSSSSSSSSSSSSSSSSSSSSS0059
00817,CSUS-SSSU PUBLIC DE DUEKOUE,1602,PB,SSSSSSSSSSSSSSSSSSSSSSSSSSSSSSSS0817
02045,CSR-D  PUBLIC DE ZOUATTA  2,1603,PB,SSSSSSSSSSSSSSSSSSSSSSSSSSSSSSSS2045
02041,CSR-D  PUBLIC DE DOUAGUE 2,1603,PB,SSSSSSSSSSSSSSSSSSSSSSSSSSSSSSSS2041
02042,CSR-D  PUBLIC DE KONTROU,1603,PB,SSSSSSSSSSSSSSSSSSSSSSSSSSSSSSSS2042
02043,CSR-D  PUBLIC DE TACOURABLY,1603,PB,SSSSSSSSSSSSSSSSSSSSSSSSSSSSSSSS2043
02044,CSR-D  PUBLIC DE TOUANDROU GBEAN,1603,PB,SSSSSSSSSSSSSSSSSSSSSSSSSSSSSSSS2044
02598,CSR-D PUBLIC DE BATIEBLY-TRODROU,1603,PB,SSSSSSSSSSSSSSSSSSSSSSSSSSSSSSSS2598
02997,CSR-D PUBLIC DE BIBITA,1603,PB,SSSSSSSSSSSSSSSSSSSSSSSSSSSSSSSS2997
02599,CSR-D PUBLIC DE FLANSOBLY,1603,PB,SSSSSSSSSSSSSSSSSSSSSSSSSSSSSSSS2599
03490,CSR-D PUBLIC DE GBEZIO,1603,PB,
00793,CSR-D PUBLIC DE GUEZON (S/P FACOBLY),1603,PB,SSSSSSSSSSSSSSSSSSSSSSSSSSSSSSSS0793
06794,CSR-D PUBLIC DE KANEBLY,1603,PB,SSSSSSSSSSSSSSSSSSSSSSSSSSSSSSSS6794
01758,CSR-D PUBLIC DE KORDROU,1603,PB,SSSSSSSSSSSSSSSSSSSSSSSSSSSSSSSS1758
01052,CSR-D PUBLIC DE KOUA,1603,PB,SSSSSSSSSSSSSSSSSSSSSSSSSSSSSSSS1052
01013,CSR-D PUBLIC DE NIDROU (S/P NIDROU),1603,PB,SSSSSSSSSSSSSSSSSSSSSSSSSSSSSSSS1013
02770,CSR-D PUBLIC DE OUYABLY-GNONDROU,1603,PB,SSSSSSSSSSSSSSSSSSSSSSSSSSSSSSSS2770
00092,CSR-D PUBLIC DE PIANDROU,1603,PB,SSSSSSSSSSSSSSSSSSSSSSSSSSSSSSSS0092
01014,CSR-D PUBLIC DE POUMBLY,1603,PB,SSSSSSSSSSSSSSSSSSSSSSSSSSSSSSSS1014
02597,CSR-D PUBLIC DE SIEBLY,1603,PB,SSSSSSSSSSSSSSSSSSSSSSSSSSSSSSSS2597
06795,CSR-D PUBLIC DE SOAKPE-DOUEDY,1603,PB,SSSSSSSSSSSSSSSSSSSSSSSSSSSSSSSS6795
02535,CSR-D PUBLIC DE SOUEBLY-MAYEBLY,1603,PB,SSSSSSSSSSSSSSSSSSSSSSSSSSSSSSSS2535
03491,CSR-D PUBLIC DE TEISSON,1603,PB,
03492,CSR-D PUBLIC DE TIEDROU-KOLEA,1603,PB,
00643,CSR-D PUBLIC DE TIENY-SEABLY,1603,PB,SSSSSSSSSSSSSSSSSSSSSSSSSSSSSSSS0643
02996,CSR-D PUBLIC DE TIESSAN,1603,PB,SSSSSSSSSSSSSSSSSSSSSSSSSSSSSSSS2996
00792,CSR-D PUBLIC DE TOUANDROU-BEOUE2,1603,PB,SSSSSSSSSSSSSSSSSSSSSSSSSSSSSSSS0792
09850,CSR-D PUBLIC PIEBLY 1 DE KOUIBLY,1603,PB,SSSSSSSSSSSSSSSSSSSSSSSSSSSSSSSS9850
00661,CSR-DM PUBLIC DE GBADROU,1603,PB,SSSSSSSSSSSSSSSSSSSSSSSSSSSSSSSS0661
01011,CSR-DM PUBLIC DE GUINGLO-GUEZON,1603,PB,SSSSSSSSSSSSSSSSSSSSSSSSSSSSSSSS1011
01435,CSR-DM PUBLIC DE KLANGBOLABLY,1603,PB,SSSSSSSSSSSSSSSSSSSSSSSSSSSSSSSS1435
01015,CSR-DM PUBLIC DE TROKPADROU,1603,PB,SSSSSSSSSSSSSSSSSSSSSSSSSSSSSSSS1015
01006,CSU-DM PUBLIC DE FACOBLY,1603,PB,SSSSSSSSSSSSSSSSSSSSSSSSSSSSSSSS1006
01010,CSU-DM PUBLIC DE SEMIEN,1603,PB,SSSSSSSSSSSSSSSSSSSSSSSSSSSSSSSS1010
01016,CSU-DM PUBLIC DE TOTRODOU,1603,PB,SSSSSSSSSSSSSSSSSSSSSSSSSSSSSSSS1016
01012,HG PUBLIC DE KOUIBLY,1603,PB,SSSSSSSSSSSSSSSSSSSSSSSSSSSSSSSS1012
07129,INF-PV PRIVE STE ANNE SIABLY DE  FACOBLY,1603,PV,SSSSSSSSSSSSSSSSSSSSSSSSSSSSSSSS7129
03027,CABINET PARAMÉDICAL LA RENAISSANCE,1701,PV,SSSSSSSSSSSSSSSSSSSSSSSSSSSSSSSS3027
02099,CDT-DS DABAKALA,1701,PB,SSSSSSSSSSSSSSSSSSSSSSSSSSSSSSSS2099
00399,CSR-D PUBLIC DE KOGBERA,1701,PB,SSSSSSSSSSSSSSSSSSSSSSSSSSSSSSSS0399
01466,CSR-D PUBLIC DE KPANA-KALO,1701,PB,SSSSSSSSSSSSSSSSSSSSSSSSSSSSSSSS1466
03234,CSR-D PUBLIC DE LAFIGUE,1701,PB,SSSSSSSSSSSSSSSSSSSSSSSSSSSSSSSS3234
02100,CSR-D PUBLIC DE SITIOLO,1701,PB,SSSSSSSSSSSSSSSSSSSSSSSSSSSSSSSS2100
02101,CSR-D PUBLIC DE WENDENE,1701,PB,SSSSSSSSSSSSSSSSSSSSSSSSSSSSSSSS2101
01253,CSR-D PUBLIC DE YAOSSEDOUGOU,1701,PB,SSSSSSSSSSSSSSSSSSSSSSSSSSSSSSSS1253
00301,CSR-DM PUBLIC DE BOKALA NIAMPONDOUGOU,1701,PB,SSSSSSSSSSSSSSSSSSSSSSSSSSSSSSSS0301
00657,CSR-DM PUBLIC DE FENESSIGUEDOUGOU,1701,PB,SSSSSSSSSSSSSSSSSSSSSSSSSSSSSSSS0657
00398,CSR-DM PUBLIC DE KAFOUDOUGOU BAMBARASSO,1701,PB,SSSSSSSSSSSSSSSSSSSSSSSSSSSSSSSS0398
00330,CSR-DM PUBLIC DE KAWOLO-SOBARA,1701,PB,SSSSSSSSSSSSSSSSSSSSSSSSSSSSSSSS0330
00658,CSR-DM PUBLIC DE M'BORLA DIOULASSO,1701,PB,SSSSSSSSSSSSSSSSSSSSSSSSSSSSSSSS0658
03457,CSR-DM PUBLIC DE NAHOLO,1701,PB,
00652,CSR-DM PUBLIC DE NIEMENE,1701,PB,SSSSSSSSSSSSSSSSSSSSSSSSSSSSSSSS0652
01314,CSR-DM PUBLIC DE SOKALA-SOBARA,1701,PB,SSSSSSSSSSSSSSSSSSSSSSSSSSSSSSSS1314
00163,CSR-DM PUBLIC DE TENDENE BAMBARASSO,1701,PB,SSSSSSSSSSSSSSSSSSSSSSSSSSSSSSSS0163
01473,CSR-I PUBLIC DE KAFINE NOUMOUSSO,1701,PB,SSSSSSSSSSSSSSSSSSSSSSSSSSSSSSSS1473
01376,CSR-I PUBLIC DE LISSOLO SOBARA,1701,PB,SSSSSSSSSSSSSSSSSSSSSSSSSSSSSSSS1376
00648,CSU-DM PUBLIC DE BASSAWA,1701,PB,SSSSSSSSSSSSSSSSSSSSSSSSSSSSSSSS0648
00650,CSU-DM PUBLIC DE BONIEREDOUGOU,1701,PB,SSSSSSSSSSSSSSSSSSSSSSSSSSSSSSSS0650
00660,CSU-DM PUBLIC DE FOUMBOLO,1701,PB,SSSSSSSSSSSSSSSSSSSSSSSSSSSSSSSS0660
00662,CSU-DM PUBLIC DE SATAMA-SOKORO,1701,PB,SSSSSSSSSSSSSSSSSSSSSSSSSSSSSSSS0662
00664,CSU-DM PUBLIC DE SATAMA-SOKOURA,1701,PB,SSSSSSSSSSSSSSSSSSSSSSSSSSSSSSSS0664
00484,CSUS-SSSU PUBLIC DE DABAKALA,1701,PB,SSSSSSSSSSSSSSSSSSSSSSSSSSSSSSSS0484
00653,HG PUBLIC DE DABAKALA,1701,PB,SSSSSSSSSSSSSSSSSSSSSSSSSSSSSSSS0653
09121,ACDP DE KATIOLA,1702,PV,SSSSSSSSSSSSSSSSSSSSSSSSSSSSSSSS9121
00925,CHR PUBLIC DE KATIOLA,1702,PB,SSSSSSSSSSSSSSSSSSSSSSSSSSSSSSSS0925
00924,CSR-D PUBLIC DE KANAGONON,1702,PB,SSSSSSSSSSSSSSSSSSSSSSSSSSSSSSSS0924
02376,CSR-D PUBLIC DE KPEFELE,1702,PB,SSSSSSSSSSSSSSSSSSSSSSSSSSSSSSSS2376
01634,CSR-D PUBLIC DE LOUGBONOU,1702,PB,SSSSSSSSSSSSSSSSSSSSSSSSSSSSSSSS1634
01390,CSR-D PUBLIC DE OUNADIEKAHA,1702,PB,SSSSSSSSSSSSSSSSSSSSSSSSSSSSSSSS1390
01247,CSR-D PUBLIC DE TOURO,1702,PB,SSSSSSSSSSSSSSSSSSSSSSSSSSSSSSSS1247
01365,CSR-DM PUBLIC DE DARAKOKAHA,1702,PB,SSSSSSSSSSSSSSSSSSSSSSSSSSSSSSSS1365
00405,CSR-DM PUBLIC DE KOFFISSIOKAHA,1702,PB,SSSSSSSSSSSSSSSSSSSSSSSSSSSSSSSS0405
01136,CSR-DM PUBLIC DE NAMPLEKAHA,1702,PB,SSSSSSSSSSSSSSSSSSSSSSSSSSSSSSSS1136
00101,CSR-DM PUBLIC DE NIKOLO,1702,PB,SSSSSSSSSSSSSSSSSSSSSSSSSSSSSSSS0101
04256,CSU-D CONFESSIONNEL DE KATIOLA,1702,PB,SSSSSSSSSSSSSSSSSSSSSSSSSSSSSSSS4256
03057,CSU-DM PRIVE-ONG AIME TON PROCHAIN DE KATIOLA,1702,PV,SSSSSSSSSSSSSSSSSSSSSSSSSSSSSSSS3057
00922,CSU-DM PUBLIC DE FRONAN,1702,PB,SSSSSSSSSSSSSSSSSSSSSSSSSSSSSSSS0922
00929,CSU-DM PUBLIC DE TIMBE,1702,PB,SSSSSSSSSSSSSSSSSSSSSSSSSSSSSSSS0929
02297,CSUS-CAT PUBLIC KATIOLA,1702,PB,SSSSSSSSSSSSSSSSSSSSSSSSSSSSSSSS2297
00926,CSUS-PMI PUBLIC DE KATIOLA,1702,PB,SSSSSSSSSSSSSSSSSSSSSSSSSSSSSSSS0926
00927,CSUS-SSSU PUBLIC DE KATIOLA,1702,PB,SSSSSSSSSSSSSSSSSSSSSSSSSSSSSSSS0927
00211,INF-LC PUBLIC CAFOP DE KATIOLA,1702,PB,SSSSSSSSSSSSSSSSSSSSSSSSSSSSSSSS0211
01444,INF-LC PUBLIC LYCÉE MODERNE DE KATIOLA,1702,PB,SSSSSSSSSSSSSSSSSSSSSSSSSSSSSSSS1444
02358,INF-P PUBLIC PRISON CIVIL MAC DE KATIOLA,1702,PB,SSSSSSSSSSSSSSSSSSSSSSSSSSSSSSSS2358
00567,INHP-A PUBLIC DE KATIOLA,1702,PB,SSSSSSSSSSSSSSSSSSSSSSSSSSSSSSSS0567
01235,CENTRE MÉDICAL (CM) TORTIYA DE NIAKARADOUGOU,1703,PV,SSSSSSSSSSSSSSSSSSSSSSSSSSSSSSSS1235
01630,CSR-D PUBLIC DE ARIKOKAHA,1703,PB,SSSSSSSSSSSSSSSSSSSSSSSSSSSSSSSS1630
02963,CSR-D PUBLIC DE NANGONIEKAHA,1703,PB,SSSSSSSSSSSSSSSSSSSSSSSSSSSSSSSS2963
00933,CSR-D PUBLIC DE PETIONARA,1703,PB,SSSSSSSSSSSSSSSSSSSSSSSSSSSSSSSS0933
01168,CSR-D PUBLIC DE SEPIKAHA,1703,PB,SSSSSSSSSSSSSSSSSSSSSSSSSSSSSSSS1168
02962,CSR-D PUBLIC DE TIMOROKAHA,1703,PB,SSSSSSSSSSSSSSSSSSSSSSSSSSSSSSSS2962
03073,CSR-DM PUBLIC D'ANGOLOKAHA,1703,PB,SSSSSSSSSSSSSSSSSSSSSSSSSSSSSSSS3073
01638,CSR-DM PUBLIC DE BADIKAHA,1703,PB,SSSSSSSSSSSSSSSSSSSSSSSSSSSSSSSS1638
01631,CSR-DM PUBLIC DE KANAWOLO,1703,PB,SSSSSSSSSSSSSSSSSSSSSSSSSSSSSSSS1631
02388,CSR-DM PUBLIC DE KOUROUKOUNA,1703,PB,SSSSSSSSSSSSSSSSSSSSSSSSSSSSSSSS2388
00407,CSR-DM PUBLIC DE NGOLODOUGOU,1703,PB,SSSSSSSSSSSSSSSSSSSSSSSSSSSSSSSS0407
00932,CSR-DM PUBLIC DE NIEDIEKAHA,1703,PB,SSSSSSSSSSSSSSSSSSSSSSSSSSSSSSSS0932
02389,CSR-DM PUBLIC DE OUEREGUEKAHA,1703,PB,SSSSSSSSSSSSSSSSSSSSSSSSSSSSSSSS2389
00171,CSR-DM PUBLIC DE TENINDERI,1703,PB,SSSSSSSSSSSSSSSSSSSSSSSSSSSSSSSS0171
02390,CSR-DM PUBLIC SUCAF-EXTENSION DE NIAKARAMADOUGOU,1703,PB,SSSSSSSSSSSSSSSSSSSSSSSSSSSSSSSS2390
07100,CSU-DM PRIVE SUCAF CI DE TAFIRE,1703,PV,SSSSSSSSSSSSSSSSSSSSSSSSSSSSSSSS7100
00934,CSU-DM PUBLIC DE TAFIRE,1703,PB,SSSSSSSSSSSSSSSSSSSSSSSSSSSSSSSS0934
00935,CSU-DM PUBLIC DE TORTIYA,1703,PB,SSSSSSSSSSSSSSSSSSSSSSSSSSSSSSSS0935
02102,CSUS-SSSU PUBLIC DE NIAKARAMADOUGOU,1703,PB,SSSSSSSSSSSSSSSSSSSSSSSSSSSSSSSS2102
08090,HG PUBLIC DE NIAKARA,1703,PB,SSSSSSSSSSSSSSSSSSSSSSSSSSSSSSSS8090
03477,CABINET DENTAIRE CHRIST ROI,1801,PV,
01772,CENTRE MEDICAL CROU DALOA,1801,PV,SSSSSSSSSSSSSSSSSSSSSSSSSSSSSSSS1772
03474,CENTRE MEDICAL SAINT JEAN,1801,PV,
02488,CENTRE MEDICO-SOCIAL POLYVALENT DALOA,1801,PV,SSSSSSSSSSSSSSSSSSSSSSSSSSSSSSSS2488
00294,CHR PUBLIC DE DALOA,1801,PB,SSSSSSSSSSSSSSSSSSSSSSSSSSSSSSSS0294
03076,CLINIQUE MEDICALE ESPOIR DE DALOA,1801,PV,SSSSSSSSSSSSSSSSSSSSSSSSSSSSSSSS3076
02485,CLINIQUE MEDICALE GRACE DIVINE,1801,PV,SSSSSSSSSSSSSSSSSSSSSSSSSSSSSSSS2485
02489,CLINIQUE MEDICALE SOLIDARITE,1801,PV,SSSSSSSSSSSSSSSSSSSSSSSSSSSSSSSS2489
02793,CM PRIVE CLINIQUE LA RECONCILIATION DE DALOA,1801,PV,SSSSSSSSSSSSSSSSSSSSSSSSSSSSSSSS2793
02791,CM PRIVE CLINIQUE SAINT CHRISTOPHE DE DALOA,1801,PV,SSSSSSSSSSSSSSSSSSSSSSSSSSSSSSSS2791
00649,CMS PRIVE - ONG SAPHARM DE DALOA,1801,PV,SSSSSSSSSSSSSSSSSSSSSSSSSSSSSSSS0649
00680,CMS PUBLIC CNPS DE DALOA,1801,PB,SSSSSSSSSSSSSSSSSSSSSSSSSSSSSSSS0680
07968,CSR-D  PUBLIC DE  ZOKOGUHE DE DALOA,1801,PB,SSSSSSSSSSSSSSSSSSSSSSSSSSSSSSSS7968
00205,CSR-D PUBLIC DE BANDIAHI,1801,PB,SSSSSSSSSSSSSSSSSSSSSSSSSSSSSSSS0205
02484,CSR-D PUBLIC DE BEGAFLA (GNAMANOU),1801,PB,SSSSSSSSSSSSSSSSSSSSSSSSSSSSSSSS2484
00217,CSR-D PUBLIC DE BIDIAHOUAN,1801,PB,SSSSSSSSSSSSSSSSSSSSSSSSSSSSSSSS0217
00038,CSR-D PUBLIC DE BRIBOUO,1801,PB,SSSSSSSSSSSSSSSSSSSSSSSSSSSSSSSS0038
02682,CSR-D PUBLIC DE KIBOUO,1801,PB,SSSSSSSSSSSSSSSSSSSSSSSSSSSSSSSS2682
00592,CSR-D PUBLIC DE LAGOGUHE,1801,PB,SSSSSSSSSSSSSSSSSSSSSSSSSSSSSSSS0592
00290,CSR-D PUBLIC DE NIOUBOUA,1801,PB,SSSSSSSSSSSSSSSSSSSSSSSSSSSSSSSS0290
00684,CSR-D PUBLIC DE TAGOURA,1801,PB,SSSSSSSSSSSSSSSSSSSSSSSSSSSSSSSS0684
00214,CSR-D PUBLIC DE TAHIRAGUHE,1801,PB,SSSSSSSSSSSSSSSSSSSSSSSSSSSSSSSS0214
00319,CSR-D PUBLIC DE TAPEGUHE,1801,PB,SSSSSSSSSSSSSSSSSSSSSSSSSSSSSSSS0319
01213,CSR-D PUBLIC DE YOKOREA,1801,PB,SSSSSSSSSSSSSSSSSSSSSSSSSSSSSSSS1213
02623,CSR-D PUBLIC DE ZEBRA,1801,PB,SSSSSSSSSSSSSSSSSSSSSSSSSSSSSSSS2623
02679,CSR-D PUBLIC DE ZEPREGUHE,1801,PB,SSSSSSSSSSSSSSSSSSSSSSSSSSSSSSSS2679
02684,CSR-D PUBLIC DE ZOBOUA,1801,PB,SSSSSSSSSSSSSSSSSSSSSSSSSSSSSSSS2684
03261,CSR-DM PUBLIC CHANTIER DE GBOPROUYA,1801,PB,
00669,CSR-DM PUBLIC DE BOBOUA-BAHOUAN,1801,PB,SSSSSSSSSSSSSSSSSSSSSSSSSSSSSSSS0669
00300,CSR-DM PUBLIC DE DIGBAPIA,1801,PB,SSSSSSSSSSSSSSSSSSSSSSSSSSSSSSSS0300
00854,CSR-DM PUBLIC DE KEIBLA,1801,PB,SSSSSSSSSSSSSSSSSSSSSSSSSSSSSSSS0854
00668,CSR-DM PUBLIC DE LUENOUFLA,1801,PB,SSSSSSSSSSSSSSSSSSSSSSSSSSSSSSSS0668
02483,CSR-DM PUBLIC DE SERIA,1801,PB,SSSSSSSSSSSSSSSSSSSSSSSSSSSSSSSS2483
03260,CSR-DM PUBLIC DE SIKABOUTOU,1801,PB,
00685,CSR-DM PUBLIC DE TCHEBLOGUHE,1801,PB,SSSSSSSSSSSSSSSSSSSSSSSSSSSSSSSS0685
00557,CSR-DM PUBLIC DE ZAHIA,1801,PB,SSSSSSSSSSSSSSSSSSSSSSSSSSSSSSSS0557
00687,CSR-DM PUBLIC DE ZALIOHOUAN,1801,PB,SSSSSSSSSSSSSSSSSSSSSSSSSSSSSSSS0687
03262,CSR-M PUBLIC DE BEFLA,1801,PB,
00761,CSR-M PUBLIC DE GOKRA,1801,PB,SSSSSSSSSSSSSSSSSSSSSSSSSSSSSSSS0761
00667,CSR-M PUBLIC DE GROGUHE (DIGBA),1801,PB,SSSSSSSSSSSSSSSSSSSSSSSSSSSSSSSS0667
09841,CSU D PRIVE CANNAAN,1801,PV,SSSSSSSSSSSSSSSSSSSSSSSSSSSSSSSS9841
08990,CSU-D PRIVE-ONG ESPÉRANCE APROSAM DE DALOA,1801,PV,SSSSSSSSSSSSSSSSSSSSSSSSSSSSSSSS8990
00672,CSU-D PUBLIC DE DALOA,1801,PB,SSSSSSSSSSSSSSSSSSSSSSSSSSSSSSSS0672
00681,CSU-D PUBLIC DE DERAHOUAN,1801,PB,SSSSSSSSSSSSSSSSSSSSSSSSSSSSSSSS0681
09991,CSU-DM CONFESSIONNEL NOTRE DAME DE LA PROVIDENCE,1801,PV,SSSSSSSSSSSSSSSSSSSSSSSSSSSSSSSS9991
09992,CSU-DM CONFESSIONNEL TONINO D'ABATTOIR 2,1801,PV,SSSSSSSSSSSSSSSSSSSSSSSSSSSSSSSS9992
00666,CSU-DM PUBLIC DE BEDIALA,1801,PB,SSSSSSSSSSSSSSSSSSSSSSSSSSSSSSSS0666
00682,CSU-DM PUBLIC DE GADOUAN,1801,PB,SSSSSSSSSSSSSSSSSSSSSSSSSSSSSSSS0682
01171,CSU-DM PUBLIC DE GAMINA,1801,PB,SSSSSSSSSSSSSSSSSSSSSSSSSSSSSSSS1171
01663,CSU-DM PUBLIC DE GBOGUHE,1801,PB,SSSSSSSSSSSSSSSSSSSSSSSSSSSSSSSS1663
00542,CSU-DM PUBLIC DE GONATE,1801,PB,SSSSSSSSSSSSSSSSSSSSSSSSSSSSSSSS0542
01536,CSU-DM PUBLIC QUARTIER GARAGE DE DALOA,1801,PB,SSSSSSSSSSSSSSSSSSSSSSSSSSSSSSSS1536
01669,CSU-M PUBLIC DE DALOA,1801,PB,SSSSSSSSSSSSSSSSSSSSSSSSSSSSSSSS1669
00676,CSUS-CAT PUBLIC DE DALOA,1801,PB,SSSSSSSSSSSSSSSSSSSSSSSSSSSSSSSS0676
07060,CSUS-CDV PUBLIC AIBEF DE DALOA,1801,PB,SSSSSSSSSSSSSSSSSSSSSSSSSSSSSSSS7060
02532,CSUS-LEP PUBLIC LÈPROSERIE DE DALOA,1801,PB,SSSSSSSSSSSSSSSSSSSSSSSSSSSSSSSS2532
00674,CSUS-PMI PUBLIC DE DALOA,1801,PB,SSSSSSSSSSSSSSSSSSSSSSSSSSSSSSSS0674
00271,CSUS-PRC PUBLIC TRYPANOSOMIASE DE DALOA,1801,PB,SSSSSSSSSSSSSSSSSSSSSSSSSSSSSSSS0271
00675,CSUS-SSSU PUBLIC DE DALOA,1801,PB,SSSSSSSSSSSSSSSSSSSSSSSSSSSSSSSS0675
02671,CSUS-SSSU PUBLIC DE DALOA 2,1801,PB,SSSSSSSSSSSSSSSSSSSSSSSSSSSSSSSS2671
09122,F S POLICE DE DALOA,1801,PB,SSSSSSSSSSSSSSSSSSSSSSSSSSSSSSSS9122
09826,HG PRIVE ISLAMIQUE,1801,PV,SSSSSSSSSSSSSSSSSSSSSSSSSSSSSSSS9826
02578,ICT ECOLE GEND TOROGUHE,1801,PB,SSSSSSSSSSSSSSSSSSSSSSSSSSSSSSSS2578
01207,INF-M PUBLIC GARNISON DE DALOA,1801,PB,SSSSSSSSSSSSSSSSSSSSSSSSSSSSSSSS1207
01701,INF-M PUBLIC MILITAIRE DE DALOA,1801,PB,SSSSSSSSSSSSSSSSSSSSSSSSSSSSSSSS1701
00920,INF-P PUBLIC PRISON CIVIL DE DALOA,1801,PB,SSSSSSSSSSSSSSSSSSSSSSSSSSSSSSSS0920
01575,INHP-A PUBLIC DE DALOA,1801,PB,SSSSSSSSSSSSSSSSSSSSSSSSSSSSSSSS1575
02103,CDT-DS ISSIA,1802,PB,SSSSSSSSSSSSSSSSSSSSSSSSSSSSSSSS2103
03002,CENTRE MEDICAL KAYAF,1802,PV,SSSSSSSSSSSSSSSSSSSSSSSSSSSSSSSS3002
00551,CMS PRIVE AMOUR COMMUNE DE ISSIA,1802,PV,SSSSSSSSSSSSSSSSSSSSSSSSSSSSSSSS0551
08989,CSR-D COMMUNAUTAIRE DE BEMADI,1802,PB,SSSSSSSSSSSSSSSSSSSSSSSSSSSSSSSS8989
00796,CSR-D PUBLIC DE BEKORA,1802,PB,SSSSSSSSSSSSSSSSSSSSSSSSSSSSSSSS0796
01202,CSR-D PUBLIC DE BEZIBOU-ZOUZOUA,1802,PB,SSSSSSSSSSSSSSSSSSSSSSSSSSSSSSSS1202
00908,CSR-D PUBLIC DE BOBREGUHE,1802,PB,SSSSSSSSSSSSSSSSSSSSSSSSSSSSSSSS0908
00234,CSR-D PUBLIC DE BROKOUA,1802,PB,SSSSSSSSSSSSSSSSSSSSSSSSSSSSSSSS0234
01698,CSR-D PUBLIC DE BROMA,1802,PB,SSSSSSSSSSSSSSSSSSSSSSSSSSSSSSSS1698
00758,CSR-D PUBLIC DE DAHIRA,1802,PB,SSSSSSSSSSSSSSSSSSSSSSSSSSSSSSSS0758
00298,CSR-D PUBLIC DE DEGAULLEKRO,1802,PB,SSSSSSSSSSSSSSSSSSSSSSSSSSSSSSSS0298
02531,CSR-D PUBLIC DE DIASSA,1802,PB,SSSSSSSSSSSSSSSSSSSSSSSSSSSSSSSS2531
01907,CSR-D PUBLIC DE GAZIBOUO,1802,PB,SSSSSSSSSSSSSSSSSSSSSSSSSSSSSSSS1907
00910,CSR-D PUBLIC DE GOLIHOA,1802,PB,SSSSSSSSSSSSSSSSSSSSSSSSSSSSSSSS0910
02757,CSR-D PUBLIC DE MABOGUHE,1802,PB,SSSSSSSSSSSSSSSSSSSSSSSSSSSSSSSS2757
08895,CSR-D PUBLIC DE MADIA,1802,PB,SSSSSSSSSSSSSSSSSSSSSSSSSSSSSSSS8895
00373,CSR-D PUBLIC DE NIAKIA,1802,PB,SSSSSSSSSSSSSSSSSSSSSSSSSSSSSSSS0373
00921,CSR-D PUBLIC DE TEZIE,1802,PB,SSSSSSSSSSSSSSSSSSSSSSSSSSSSSSSS0921
01909,CSR-D PUBLIC DE ZADIOHA,1802,PB,SSSSSSSSSSSSSSSSSSSSSSSSSSSSSSSS1909
00351,CSR-DM PUBLIC DE DADEGUHE,1802,PB,SSSSSSSSSSSSSSSSSSSSSSSSSSSSSSSS0351
01699,CSR-DM PUBLIC DE GABIA (S/P SAÏOUA),1802,PB,SSSSSSSSSSSSSSSSSSSSSSSSSSSSSSSS1699
01695,CSR-DM PUBLIC DE GOGOGUHE,1802,PB,SSSSSSSSSSSSSSSSSSSSSSSSSSSSSSSS1695
03361,CSR-DM PUBLIC DE GOGOUAGUHE,1802,PB,
03362,CSR-DM PUBLIC DE IROGOGOUA,1802,PB,
00323,CSR-DM PUBLIC DE LUEHOUAN,1802,PB,SSSSSSSSSSSSSSSSSSSSSSSSSSSSSSSS0323
00286,CSR-DM PUBLIC DE MAPAIX,1802,PB,SSSSSSSSSSSSSSSSSSSSSSSSSSSSSSSS0286
00909,CSU-DM PUBLIC DE BOGUEDIA,1802,PB,SSSSSSSSSSSSSSSSSSSSSSSSSSSSSSSS0909
01693,CSU-DM PUBLIC DE IBOGUHE,1802,PB,SSSSSSSSSSSSSSSSSSSSSSSSSSSSSSSS1693
00344,CSU-DM PUBLIC DE NAHIO,1802,PB,SSSSSSSSSSSSSSSSSSSSSSSSSSSSSSSS0344
03161,CSU-DM PUBLIC DE NAMANE,1802,PB,SSSSSSSSSSSSSSSSSSSSSSSSSSSSSSSS3161
00919,CSU-DM PUBLIC DE SAIOUA,1802,PB,SSSSSSSSSSSSSSSSSSSSSSSSSSSSSSSS0919
03160,CSU-DM PUBLIC DE TAPEGUIA,1802,PB,SSSSSSSSSSSSSSSSSSSSSSSSSSSSSSSS3160
02493,CSU-DMPUBLIC HKB DE ISSIA,1802,PB,SSSSSSSSSSSSSSSSSSSSSSSSSSSSSSSS2493
00912,CSUS-PMI PUBLIC DE ISSIA,1802,PB,SSSSSSSSSSSSSSSSSSSSSSSSSSSSSSSS0912
00913,CSUS-SSSU PUBLIC DE ISSIA,1802,PB,SSSSSSSSSSSSSSSSSSSSSSSSSSSSSSSS0913
00911,HG PUBLIC DE ISSIA,1802,PB,SSSSSSSSSSSSSSSSSSSSSSSSSSSSSSSS0911
03086,CENTRE MEDICAL ESPOIR (DIST. VAVOUA),1803,PV,SSSSSSSSSSSSSSSSSSSSSSSSSSSSSSSS3086
01671,CSR-D PUBLIC DE BAHOULIFLA,1803,PB,SSSSSSSSSSSSSSSSSSSSSSSSSSSSSSSS1671
03211,CSR-D PUBLIC DE BIENOUFLA,1803,PB,SSSSSSSSSSSSSSSSSSSSSSSSSSSSSSSS3211
02106,CSR-D PUBLIC DE BODOUASSO,1803,PB,SSSSSSSSSSSSSSSSSSSSSSSSSSSSSSSS2106
01674,CSR-D PUBLIC DE BONOUFLA,1803,PB,SSSSSSSSSSSSSSSSSSSSSSSSSSSSSSSS1674
01241,CSR-D PUBLIC DE DANANON,1803,PB,SSSSSSSSSSSSSSSSSSSSSSSSSSSSSSSS1241
01345,CSR-D PUBLIC DE DEDIAFLA,1803,PB,SSSSSSSSSSSSSSSSSSSSSSSSSSSSSSSS1345
01906,CSR-D PUBLIC DE GOURIELA,1803,PB,SSSSSSSSSSSSSSSSSSSSSSSSSSSSSSSS1906
00262,CSR-D PUBLIC DE KETRO BASSAM,1803,PB,SSSSSSSSSSSSSSSSSSSSSSSSSSSSSSSS0262
00613,CSR-D PUBLIC DE PELEZI,1803,PB,SSSSSSSSSSSSSSSSSSSSSSSSSSSSSSSS0613
02107,CSR-D PUBLIC DE SEBEDOUFLA,1803,PB,SSSSSSSSSSSSSSSSSSSSSSSSSSSSSSSS2107
00200,CSR-D PUBLIC DE TRAFLA-GOTRON,1803,PB,SSSSSSSSSSSSSSSSSSSSSSSSSSSSSSSS0200
09989,CSR-D PUBLIC DE VAAFLA (DIST. VAVOUA),1803,PB,SSSSSSSSSSSSSSSSSSSSSSSSSSSSSSSS9989
02781,CSR-D PUBLIC DE VROUO2,1803,PB,SSSSSSSSSSSSSSSSSSSSSSSSSSSSSSSS2781
01673,CSR-D PUBLIC DE YOUREDOUFLA,1803,PB,SSSSSSSSSSSSSSSSSSSSSSSSSSSSSSSS1673
00342,CSR-DM PUBLIC DE ANCIEN PROZI,1803,PB,SSSSSSSSSSSSSSSSSSSSSSSSSSSSSSSS0342
01343,CSR-DM PUBLIC DE BAZRA-NATIS,1803,PB,SSSSSSSSSSSSSSSSSSSSSSSSSSSSSSSS1343
02370,CSR-DM PUBLIC DE DERAGON,1803,PB,SSSSSSSSSSSSSSSSSSSSSSSSSSSSSSSS2370
00227,CSR-DM PUBLIC DE GBABO,1803,PB,SSSSSSSSSSSSSSSSSSSSSSSSSSSSSSSS0227
02104,CSR-DM PUBLIC DE MIGNORE,1803,PB,SSSSSSSSSSSSSSSSSSSSSSSSSSSSSSSS2104
00246,CSR-DM PUBLIC DE MONOKO-ZOHI,1803,PB,SSSSSSSSSSSSSSSSSSSSSSSSSSSSSSSS0246
01039,CSR-DM PUBLIC DE NEOULEFLA,1803,PB,SSSSSSSSSSSSSSSSSSSSSSSSSSSSSSSS1039
02105,CSR-DM PUBLIC DE TENEFERO,1803,PB,SSSSSSSSSSSSSSSSSSSSSSSSSSSSSSSS2105
00324,CSR-DM PUBLIC DE VAOU,1803,PB,SSSSSSSSSSSSSSSSSSSSSSSSSSSSSSSS0324
02369,CSR-DM PUBLIC DE ZUEHI GOTRON,1803,PB,SSSSSSSSSSSSSSSSSSSSSSSSSSSSSSSS2369
01650,CSR-M PUBLIC DE DENZERVILLE,1803,PB,SSSSSSSSSSSSSSSSSSSSSSSSSSSSSSSS1650
01346,CSU-DM PUBLIC DE DANIA,1803,PB,SSSSSSSSSSSSSSSSSSSSSSSSSSSSSSSS1346
01347,CSU-DM PUBLIC DE SEITIFLA,1803,PB,SSSSSSSSSSSSSSSSSSSSSSSSSSSSSSSS1347
02798,CSU-DM PUBLIC DE VAVOUA,1803,PB,SSSSSSSSSSSSSSSSSSSSSSSSSSSSSSSS2798
01349,CSUS-PMI PUBLIC DE VAVOUA,1803,PB,SSSSSSSSSSSSSSSSSSSSSSSSSSSSSSSS1349
02108,CSUS-SSSU PUBLIC DE VAVOUA,1803,PB,SSSSSSSSSSSSSSSSSSSSSSSSSSSSSSSS2108
01348,HG PUBLIC DE VAVOUA,1803,PB,SSSSSSSSSSSSSSSSSSSSSSSSSSSSSSSS1348
00562,INF-PV PRIVE (ONG LAFED) DE VAVOUA,1803,PV,SSSSSSSSSSSSSSSSSSSSSSSSSSSSSSSS0562
01853,INF-PV PRIVE AIDARA CHEICK DE VAVOUA,1803,PV,SSSSSSSSSSSSSSSSSSSSSSSSSSSSSSSS1853
01865,INF-PV PRIVE AL RAHIM DE GBABO,1803,PV,SSSSSSSSSSSSSSSSSSSSSSSSSSSSSSSS1865
01850,INF-PV PRIVE AMBE SUNGHUNY DE VAVOUA,1803,PV,SSSSSSSSSSSSSSSSSSSSSSSSSSSSSSSS1850
01835,INF-PV PRIVE ARMEL DE MINORE,1803,PV,SSSSSSSSSSSSSSSSSSSSSSSSSSSSSSSS1835
01870,INF-PV PRIVE BADO DE VAOU II,1803,PV,SSSSSSSSSSSSSSSSSSSSSSSSSSSSSSSS1870
01848,INF-PV PRIVE BAMBA DE VAVOUA,1803,PV,SSSSSSSSSSSSSSSSSSSSSSSSSSSSSSSS1848
01832,INF-PV PRIVE BASSOLÉ DE BAHOULIFLA,1803,PV,SSSSSSSSSSSSSSSSSSSSSSSSSSSSSSSS1832
01822,INF-PV PRIVE BON SAMARITAIN DE ANCIEN PROZI,1803,PV,SSSSSSSSSSSSSSSSSSSSSSSSSSSSSSSS1822
01855,INF-PV PRIVE CHÂTEAU DE VAVOUA,1803,PV,SSSSSSSSSSSSSSSSSSSSSSSSSSSSSSSS1855
00564,INF-PV PRIVE COME-CI DE VAVOUA,1803,PV,SSSSSSSSSSSSSSSSSSSSSSSSSSSSSSSS0564
01846,INF-PV PRIVE CONFIDENCE DE VAVOUA,1803,PV,SSSSSSSSSSSSSSSSSSSSSSSSSSSSSSSS1846
01851,INF-PV PRIVE DERRIÈRE CI-TELCOM DE VAVOUA,1803,PV,SSSSSSSSSSSSSSSSSSSSSSSSSSSSSSSS1851
01867,INF-PV PRIVE DIAFLA I DE DIAFLA,1803,PV,SSSSSSSSSSSSSSSSSSSSSSSSSSSSSSSS1867
01868,INF-PV PRIVE DIAFLA II DE DIAFLA,1803,PV,SSSSSSSSSSSSSSSSSSSSSSSSSSSSSSSS1868
01858,INF-PV PRIVE DIEUDONNÉ DE LAMBERKRO,1803,PV,SSSSSSSSSSSSSSSSSSSSSSSSSSSSSSSS1858
01852,INF-PV PRIVE ECOLE II DE VAVOUA,1803,PV,SSSSSSSSSSSSSSSSSSSSSSSSSSSSSSSS1852
01847,INF-PV PRIVE ESPÉRANCE DE VAVOUA,1803,PV,SSSSSSSSSSSSSSSSSSSSSSSSSSSSSSSS1847
01803,INF-PV PRIVE GOUEBI DE MINORE,1803,PV,SSSSSSSSSSSSSSSSSSSSSSSSSSSSSSSS1803
01827,INF-PV PRIVE GRACE À DIEU DE GOUEFLA,1803,PV,SSSSSSSSSSSSSSSSSSSSSSSSSSSSSSSS1827
01854,INF-PV PRIVE GRANDE MOSQUÉE DE VAVOUA,1803,PV,SSSSSSSSSSSSSSSSSSSSSSSSSSSSSSSS1854
01875,INF-PV PRIVE GUEI-BLA DE VAOU,1803,PV,SSSSSSSSSSSSSSSSSSSSSSSSSSSSSSSS1875
01834,INF-PV PRIVE HERESSO DE MINORE,1803,PV,SSSSSSSSSSSSSSSSSSSSSSSSSSSSSSSS1834
01842,INF-PV PRIVE INCHALLA DE BONOUFLA,1803,PV,SSSSSSSSSSSSSSSSSSSSSSSSSSSSSSSS1842
01863,INF-PV PRIVE KABORÉ DE DANIA,1803,PV,SSSSSSSSSSSSSSSSSSSSSSSSSSSSSSSS1863
01874,INF-PV PRIVE KOUALA DE VAOU,1803,PV,SSSSSSSSSSSSSSSSSSSSSSSSSSSSSSSS1874
01833,INF-PV PRIVE LA PAIX DE MINORE,1803,PV,SSSSSSSSSSSSSSSSSSSSSSSSSSSSSSSS1833
01841,INF-PV PRIVE LOHE DE BAZRA-NATIS,1803,PV,SSSSSSSSSSSSSSSSSSSSSSSSSSSSSSSS1841
01823,INF-PV PRIVE MOSQUÉE DE ANCIEN PROZI,1803,PV,SSSSSSSSSSSSSSSSSSSSSSSSSSSSSSSS1823
01829,INF-PV PRIVE PANG Y'A WENDE DE NANDIFLA,1803,PV,SSSSSSSSSSSSSSSSSSSSSSSSSSSSSSSS1829
01828,INF-PV PRIVE PROZI DE NANDIFLA,1803,PV,SSSSSSSSSSSSSSSSSSSSSSSSSSSSSSSS1828
01872,INF-PV PRIVE RATAMANEGRE DE VAOU,1803,PV,SSSSSSSSSSSSSSSSSSSSSSSSSSSSSSSS1872
01808,INF-PV PRIVE SAGESSE DE MINORE,1803,PV,SSSSSSSSSSSSSSSSSSSSSSSSSSSSSSSS1808
01830,INF-PV PRIVE SAGESSE DE SECTA 2,1803,PV,SSSSSSSSSSSSSSSSSSSSSSSSSSSSSSSS1830
01821,INF-PV PRIVE SAINTE MARIE 2 DE BAZRA-NATIS,1803,PV,SSSSSSSSSSSSSSSSSSSSSSSSSSSSSSSS1821
01873,INF-PV PRIVE SANTÉ POUR TOUS 3 DE VAOU,1803,PV,SSSSSSSSSSSSSSSSSSSSSSSSSSSSSSSS1873
01819,INF-PV PRIVE SANTÉ POUR TOUS II DE MINORE,1803,PV,SSSSSSSSSSSSSSSSSSSSSSSSSSSSSSSS1819
01826,INF-PV PRIVE SAPROCI DE GOUEFLA,1803,PV,SSSSSSSSSSSSSSSSSSSSSSSSSSSSSSSS1826
