code,name,district_code,facility_type,source_uuid
01948,CSR-DM PUBLIC DE LABODOUGOU,2201,PB,SSSSSSSSSSSSSSSSSSSSSSSSSSSSSSSS1948
00756,CSR-DM PUBLIC DE NEBO,2201,PB,SSSSSSSSSSSSSSSSSSSSSSSSSSSSSSSS0756
00759,CSR-DM PUBLIC DE SAKOTA,2201,PB,SSSSSSSSSSSSSSSSSSSSSSSSSSSSSSSS0759
00328,CSR-DM PUBLIC DE TABLEGUIKOU,2201,PB,SSSSSSSSSSSSSSSSSSSSSSSSSSSSSSSS0328
02409,CSR-DM PUBLIC DE ZAROKO BOUAKAKO,2201,PB,SSSSSSSSSSSSSSSSSSSSSSSSSSSSSSSS2409
00778,CSR-DM PUBLIC DE ZEGO,2201,PB,SSSSSSSSSSSSSSSSSSSSSSSSSSSSSSSS0778
00760,CSR-DM PUBLIC DE ZEHIRI,2201,PB,SSSSSSSSSSSSSSSSSSSSSSSSSSSSSSSS0760
03385,CSR-DM PUBLIC DE ZEREDOUGOU,2201,PB,
00762,CSR-DM PUBLIC DE ZIKI DIES,2201,PB,SSSSSSSSSSSSSSSSSSSSSSSSSSSSSSSS0762
00743,CSU-D CONFESSIONNEL NDA DE DIVO,2201,PB,SSSSSSSSSSSSSSSSSSSSSSSSSSSSSSSS0743
00741,CSU-DM PUBLIC DE DIDOKO,2201,PB,SSSSSSSSSSSSSSSSSSSSSSSSSSSSSSSS0741
01684,CSU-DM PUBLIC DE DIVO,2201,PB,SSSSSSSSSSSSSSSSSSSSSSSSSSSSSSSS1684
00754,CSU-DM PUBLIC DE HERMANKONO GARE,2201,PB,SSSSSSSSSSSSSSSSSSSSSSSSSSSSSSSS0754
00776,CSU-DM PUBLIC DE HIRE,2201,PB,SSSSSSSSSSSSSSSSSSSSSSSSSSSSSSSS0776
00757,CSU-DM PUBLIC DE OGOUDOU,2201,PB,SSSSSSSSSSSSSSSSSSSSSSSSSSSSSSSS0757
02124,CSUS-CAT PUBLIC DE DIVO,2201,PB,SSSSSSSSSSSSSSSSSSSSSSSSSSSSSSSS2124
03066,CSU-D CONFESSIONNEL NDE DE HIRE,2201,PV,SSSSSSSSSSSSSSSSSSSSSSSSSSSSSSSS3066
02625,CSUS-PMI PUBLIC DE DIVO,2201,PB,SSSSSSSSSSSSSSSSSSSSSSSSSSSSSSSS2625
00744,CSUS-SSSU PUBLIC DE DIVO,2201,PB,SSSSSSSSSSSSSSSSSSSSSSSSSSSSSSSS0744
01651,FSU COMMUNAUTAIRE DE DIVO,2201,PB,SSSSSSSSSSSSSSSSSSSSSSSSSSSSSSSS1651
02473,INF-LC PUBLIC LYCÉE MODERNE DE DIVO,2201,PB,SSSSSSSSSSSSSSSSSSSSSSSSSSSSSSSS2473
03068,INF-P PUBLIC MAC DE DIVO,2201,PB,SSSSSSSSSSSSSSSSSSSSSSSSSSSSSSSS3068
03205,CSR-D PUBLIC D' ANOUMABOU,2202,PB,SSSSSSSSSSSSSSSSSSSSSSSSSSSSSSSS3205
02281,CSR-D PUBLIC DE ADAHIDOUGOU,2202,PB,SSSSSSSSSSSSSSSSSSSSSSSSSSSSSSSS2281
01495,CSR-D PUBLIC DE BABOKON-APPOLO,2202,PB,SSSSSSSSSSSSSSSSSSSSSSSSSSSSSSSS1495
02972,CSR-D PUBLIC DE BOUBOUDI,2202,PB,SSSSSSSSSSSSSSSSSSSSSSSSSSSSSSSS2972
00801,CSR-D PUBLIC DE BROUDOUKOU PENDA,2202,PB,SSSSSSSSSSSSSSSSSSSSSSSSSSSSSSSS0801
02973,CSR-D PUBLIC DE DIOLIGBI,2202,PB,SSSSSSSSSSSSSSSSSSSSSSSSSSSSSSSS2973
01883,CSR-D PUBLIC DE GNANBOUASSO,2202,PB,SSSSSSSSSSSSSSSSSSSSSSSSSSSSSSSS1883
02280,CSR-D PUBLIC DE KOUTA,2202,PB,SSSSSSSSSSSSSSSSSSSSSSSSSSSSSSSS2280
07782,CSR-D PUBLIC DE TEHIRI (S/P DE GUITRY),2202,PB,SSSSSSSSSSSSSSSSSSSSSSSSSSSSSSSS7782
02799,CSR-DM PUBLIC DE COCHEM DIDA,2202,PB,SSSSSSSSSSSSSSSSSSSSSSSSSSSSSSSS2799
01290,CSR-DM PUBLIC DE HERMANKONO DIES,2202,PB,SSSSSSSSSSSSSSSSSSSSSSSSSSSSSSSS1290
03039,CSR-DM PUBLIC DE KOFESSO DIOULABOUGOU,2202,PB,SSSSSSSSSSSSSSSSSSSSSSSSSSSSSSSS3039
07182,CSU-DM PUBLIC DE DAIRO-DIDIZO,2202,PB,SSSSSSSSSSSSSSSSSSSSSSSSSSSSSSSS7182
00772,CSU-DM PUBLIC DE LAUZOUA,2202,PB,SSSSSSSSSSSSSSSSSSSSSSSSSSSSSSSS0772
00773,CSU-DM PUBLIC DE TIEGBA (S/P GUITRY),2202,PB,SSSSSSSSSSSSSSSSSSSSSSSSSSSSSSSS0773
00774,CSU-DM PUBLIC DE YOCOBOUE,2202,PB,SSSSSSSSSSSSSSSSSSSSSSSSSSSSSSSS0774
00770,CSUS-PMI CONFESSIONNEL DE GUITRY,2202,PB,SSSSSSSSSSSSSSSSSSSSSSSSSSSSSSSS0770
03150,CSUS-SSSU PUBLIC DE GUITRY,2202,PB,SSSSSSSSSSSSSSSSSSSSSSSSSSSSSSSS3150
00768,HG PUBLIC DE GUITRY,2202,PB,SSSSSSSSSSSSSSSSSSSSSSSSSSSSSSSS0768
00769,INF-LC PUBLIC LYCÉE MODERNE DE GUITRY,2202,PB,SSSSSSSSSSSSSSSSSSSSSSSSSSSSSSSS0769
02135,CMS PRIVE- JERICHO,2203,PV,SSSSSSSSSSSSSSSSSSSSSSSSSSSSSSSS2135
04701,CMS PRIVE-ONG UNIVERSELLE AIDE SÉNÉVÉ DE LAKOTA,2203,PV,SSSSSSSSSSSSSSSSSSSSSSSSSSSSSSSS4701
01952,CSR-D PUBLIC DE BEYO,2203,PB,SSSSSSSSSSSSSSSSSSSSSSSSSSSSSSSS1952
02515,CSR-D PUBLIC DE DIEKOLILIE,2203,PB,SSSSSSSSSSSSSSSSSSSSSSSSSSSSSSSS2515
00815,CSR-D PUBLIC DE DJIMON GUEBOLILIE,2203,PB,SSSSSSSSSSSSSSSSSSSSSSSSSSSSSSSS0815
02136,CSR-D PUBLIC DE GBAGRELILIE,2203,PB,SSSSSSSSSSSSSSSSSSSSSSSSSSSSSSSS2136
00121,CSR-D PUBLIC DE GBAHIRI,2203,PB,SSSSSSSSSSSSSSSSSSSSSSSSSSSSSSSS0121
00805,CSR-D PUBLIC DE GRAGBA-DAGOLILIE,2203,PB,SSSSSSSSSSSSSSSSSSSSSSSSSSSSSSSS0805
07991,CSR-D PUBLIC DE GROGOUYA,2203,PB,SSSSSSSSSSSSSSSSSSSSSSSSSSSSSSSS7991
01492,CSR-D PUBLIC DE MAHOUREBOUA,2203,PB,SSSSSSSSSSSSSSSSSSSSSSSSSSSSSSSS1492
02744,CSR-D PUBLIC DE NIABLÉ (DIST. LAKOTA),2203,PB,SSSSSSSSSSSSSSSSSSSSSSSSSSSSSSSS2744
02745,CSR-D PUBLIC DE SATROKO,2203,PB,SSSSSSSSSSSSSSSSSSSSSSSSSSSSSSSS2745
01487,CSR-D PUBLIC DE SELIBOUA,2203,PB,SSSSSSSSSSSSSSSSSSSSSSSSSSSSSSSS1487
00813,CSR-D PUBLIC DE TAGOLILIE,2203,PB,SSSSSSSSSSSSSSSSSSSSSSSSSSSSSSSS0813
01002,CSR-D PUBLIC DE ZATOBOUA,2203,PB,SSSSSSSSSSSSSSSSSSSSSSSSSSSSSSSS1002
02746,CSR-D PUBLIC DE ZOZO,2203,PB,SSSSSSSSSSSSSSSSSSSSSSSSSSSSSSSS2746
01477,CSR-DM PUBLIC DE AKRIDOULADE,2203,PB,SSSSSSSSSSSSSSSSSSSSSSSSSSSSSSSS1477
03343,CSR-DM PUBLIC DE BOBOLILIE,2203,PB,
01516,CSR-DM PUBLIC DE BRIHIRI,2203,PB,SSSSSSSSSSSSSSSSSSSSSSSSSSSSSSSS1516
01000,CSR-DM PUBLIC DE DJIDJI,2203,PB,SSSSSSSSSSSSSSSSSSSSSSSSSSSSSSSS1000
07201,CSR-DM PUBLIC DE GAGORE,2203,PB,SSSSSSSSSSSSSSSSSSSSSSSSSSSSSSSS7201
00804,CSR-DM PUBLIC DE GNAKOUBOUE,2203,PB,SSSSSSSSSSSSSSSSSSSSSSSSSSSSSSSS0804
07835,CSR-DM PUBLIC DE GODOU,2203,PB,SSSSSSSSSSSSSSSSSSSSSSSSSSSSSSSS7835
03202,CSR-DM PUBLIC DE GOGNE,2203,PB,SSSSSSSSSSSSSSSSSSSSSSSSSSSSSSSS3202
00992,CSR-DM PUBLIC DE GUIGUEDOU,2203,PB,SSSSSSSSSSSSSSSSSSSSSSSSSSSSSSSS0992
07200,CSR-DM PUBLIC DE KOKOLILIE,2203,PB,SSSSSSSSSSSSSSSSSSSSSSSSSSSSSSSS7200
00468,CSR-DM PUBLIC DE NEKO 2,2203,PB,SSSSSSSSSSSSSSSSSSSSSSSSSSSSSSSS0468
00995,CSR-DM PUBLIC DE NIAKOBLOGNOA,2203,PB,SSSSSSSSSSSSSSSSSSSSSSSSSSSSSSSS0995
00998,CSR-DM PUBLIC DE ZOKOLILIE,2203,PB,SSSSSSSSSSSSSSSSSSSSSSSSSSSSSSSS0998
01642,CSR-I PUBLIC DE KOUASSILILIE,2203,PB,SSSSSSSSSSSSSSSSSSSSSSSSSSSSSSSS1642
00915,CSR-I PUBLIC DE NASSALILIE,2203,PB,SSSSSSSSSSSSSSSSSSSSSSSSSSSSSSSS0915
02137,CSU-DM PUBLIC DE AKABREBOUA,2203,PB,SSSSSSSSSSSSSSSSSSSSSSSSSSSSSSSS2137
01195,CSU-DM PUBLIC DE GOUDOUKO,2203,PB,SSSSSSSSSSSSSSSSSSSSSSSSSSSSSSSS1195
02138,CSU-DM PUBLIC DE KOUDOULILIE,2203,PB,SSSSSSSSSSSSSSSSSSSSSSSSSSSSSSSS2138
00996,CSU-DM PUBLIC DE NIAMBEZARIA,2203,PB,SSSSSSSSSSSSSSSSSSSSSSSSSSSSSSSS0996
01004,CSU-DM PUBLIC DE ZIKISSO,2203,PB,SSSSSSSSSSSSSSSSSSSSSSSSSSSSSSSS1004
03149,CSUS-SSSU PUBLIC DE LAKOTA,2203,PB,SSSSSSSSSSSSSSSSSSSSSSSSSSSSSSSS3149
00993,HG PUBLIC DE LAKOTA,2203,PB,SSSSSSSSSSSSSSSSSSSSSSSSSSSSSSSS0993
02685,INF-LC PUBLIC LYCÉE MODERNE DE LAKOTA,2203,PB,SSSSSSSSSSSSSSSSSSSSSSSSSSSSSSSS2685
01641,INF-P PUBLIC MAC DE  LAKOTA,2203,PB,SSSSSSSSSSSSSSSSSSSSSSSSSSSSSSSS1641
00538,CHR PUBLIC DE BOUAFLE,2301,PB,SSSSSSSSSSSSSSSSSSSSSSSSSSSSSSSS0538
02647,CMS PRIVE SOLIBRA DE BOUAFLE,2301,PV,SSSSSSSSSSSSSSSSSSSSSSSSSSSSSSSS2647
07984,CSR-D  PUBLIC DE KLAN,2301,PB,SSSSSSSSSSSSSSSSSSSSSSSSSSSSSSSS7984
00786,CSR-D PUBLIC DE AKA N'GUESSANKRO (S/P BOUAFLÉ),2301,PB,SSSSSSSSSSSSSSSSSSSSSSSSSSSSSSSS0786
01545,CSR-D PUBLIC DE BANNONFLA,2301,PB,SSSSSSSSSSSSSSSSSSSSSSSSSSSSSSSS1545
00797,CSR-D PUBLIC DE BOUAFLA,2301,PB,SSSSSSSSSSSSSSSSSSSSSSSSSSSSSSSS0797
02669,CSR-D PUBLIC DE BOUNANTINFLA,2301,PB,SSSSSSSSSSSSSSSSSSSSSSSSSSSSSSSS2669
03036,CSR-D PUBLIC DE DEHITA,2301,PB,SSSSSSSSSSSSSSSSSSSSSSSSSSSSSSSS3036
01644,CSR-D PUBLIC DE DIACOHOU,2301,PB,SSSSSSSSSSSSSSSSSSSSSSSSSSSSSSSS1644
06687,CSR-D PUBLIC DE DIACOHOU NORD,2301,PB,SSSSSSSSSSSSSSSSSSSSSSSSSSSSSSSS6687
00142,CSR-D PUBLIC DE DUONFLA,2301,PB,SSSSSSSSSSSSSSSSSSSSSSSSSSSSSSSS0142
00145,CSR-D PUBLIC DE GOBAZRA,2301,PB,SSSSSSSSSSSSSSSSSSSSSSSSSSSSSSSS0145
06793,CSR-D PUBLIC DE KONEFLA,2301,PB,SSSSSSSSSSSSSSSSSSSSSSSSSSSSSSSS6793
01521,CSR-D PUBLIC DE KOUAKOUGNANOU,2301,PB,SSSSSSSSSSSSSSSSSSSSSSSSSSSSSSSS1521
00829,CSR-D PUBLIC DE KPANGBANKOUAMEKRO,2301,PB,SSSSSSSSSSSSSSSSSSSSSSSSSSSSSSSS0829
07195,CSR-D PUBLIC DE N'DEMOUKRO,2301,PB,SSSSSSSSSSSSSSSSSSSSSSSSSSSSSSSS7195
00288,CSR-D PUBLIC DE OUANZANOU,2301,PB,SSSSSSSSSSSSSSSSSSSSSSSSSSSSSSSS0288
00838,CSR-D PUBLIC DE YOHO,2301,PB,SSSSSSSSSSSSSSSSSSSSSSSSSSSSSSSS0838
01741,CSR-DM PUBLIC DE ANGOVIA,2301,PB,SSSSSSSSSSSSSSSSSSSSSSSSSSSSSSSS1741
00335,CSR-DM PUBLIC DE BLANFLA,2301,PB,SSSSSSSSSSSSSSSSSSSSSSSSSSSSSSSS0335
00157,CSR-DM PUBLIC DE BLANOUFLA,2301,PB,SSSSSSSSSSSSSSSSSSSSSSSSSSSSSSSS0157
00787,CSR-DM PUBLIC DE BLE,2301,PB,SSSSSSSSSSSSSSSSSSSSSSSSSSSSSSSS0787
00543,CSR-DM PUBLIC DE BOZI,2301,PB,SSSSSSSSSSSSSSSSSSSSSSSSSSSSSSSS0543
00821,CSR-DM PUBLIC DE BOZI-SATMACI,2301,PB,SSSSSSSSSSSSSSSSSSSSSSSSSSSSSSSS0821
00545,CSR-DM PUBLIC DE GBEGBESSOU,2301,PB,SSSSSSSSSSSSSSSSSSSSSSSSSSSSSSSS0545
00546,CSR-DM PUBLIC DE NANGREKRO,2301,PB,SSSSSSSSSSSSSSSSSSSSSSSSSSSSSSSS0546
00547,CSR-DM PUBLIC DE N'DOUFFOUKANKRO,2301,PB,SSSSSSSSSSSSSSSSSSSSSSSSSSSSSSSS0547
01643,CSR-DM PUBLIC DE SIETINFLA,2301,PB,SSSSSSSSSSSSSSSSSSSSSSSSSSSSSSSS1643
06686,CSR-DM PUBLIC DE TIBEITA,2301,PB,SSSSSSSSSSSSSSSSSSSSSSSSSSSSSSSS6686
00536,CSR-DM PUBLIC DE ZAGUIETA,2301,PB,SSSSSSSSSSSSSSSSSSSSSSSSSSSSSSSS0536
00544,CSR-DM PUBLIC DE ZOOLA DANANGORO,2301,PB,SSSSSSSSSSSSSSSSSSSSSSSSSSSSSSSS0544
01574,CSU-D PUBLIC ECOLE FORESTIÈRE DE BOUAFLE,2301,PB,SSSSSSSSSSSSSSSSSSSSSSSSSSSSSSSS1574
02550,CSU-DM PUBLIC DE GARANGO,2301,PB,SSSSSSSSSSSSSSSSSSSSSSSSSSSSSSSS2550
00549,CSU-DM PUBLIC DE PAKOUABO,2301,PB,SSSSSSSSSSSSSSSSSSSSSSSSSSSSSSSS0549
02139,CSUS-CAT PUBLIC DE BOUAFLÉ,2301,PB,SSSSSSSSSSSSSSSSSSSSSSSSSSSSSSSS2139
00539,CSUS-PMI PUBLIC DE BOUAFLE,2301,PB,SSSSSSSSSSSSSSSSSSSSSSSSSSSSSSSS0539
01666,CSUS-PMI PUBLIC DIOULABOUGOU DE BOUAFLE,2301,PB,SSSSSSSSSSSSSSSSSSSSSSSSSSSSSSSS1666
00540,CSUS-SSSU PUBLIC DE BOUAFLE,2301,PB,SSSSSSSSSSSSSSSSSSSSSSSSSSSSSSSS0540
00535,HG PUBLIC DE BONON,2301,PB,SSSSSSSSSSSSSSSSSSSSSSSSSSSSSSSS0535
01432,INF-P PUBLIC PRISON CIVIL DE BOUAFLE,2301,PB,SSSSSSSSSSSSSSSSSSSSSSSSSSSSSSSS1432
00431,INF-PV ACID DE BONON,2301,PV,SSSSSSSSSSSSSSSSSSSSSSSSSSSSSSSS0431
01255,INF-PV GRACE DIVINE DE BONON,2301,PV,SSSSSSSSSSSSSSSSSSSSSSSSSSSSSSSS1255
02673,INF-PV PRIVE AMITIÉ DE BOUAFLE,2301,PV,SSSSSSSSSSSSSSSSSSSSSSSSSSSSSSSS2673
02646,INF-PV PRIVE AMOUR DU PROCHAIN DE BOUAFLE,2301,PV,SSSSSSSSSSSSSSSSSSSSSSSSSSSSSSSS2646
01368,INF-PV PRIVE BON SAMARITAIN DE BONON,2301,PV,SSSSSSSSSSSSSSSSSSSSSSSSSSSSSSSS1368
02287,INF-PV PRIVE DIOULABOUGOU DE BOUAFLE,2301,PV,SSSSSSSSSSSSSSSSSSSSSSSSSSSSSSSS2287
06792,INF-PV PRIVE DOMINICAINE DE BOUAFLE,2301,PV,SSSSSSSSSSSSSSSSSSSSSSSSSSSSSSSS6792
02645,INF-PV PRIVE FANNY MAKIE DE BOUAFLE,2301,PV,SSSSSSSSSSSSSSSSSSSSSSSSSSSSSSSS2645
02288,INF-PV PRIVE ISMAC DE BOUAFLE,2301,PV,SSSSSSSSSSSSSSSSSSSSSSSSSSSSSSSS2288
00811,INF-PV PRIVE LA COLOMBE DE BOUAFLE,2301,PV,SSSSSSSSSSSSSSSSSSSSSSSSSSSSSSSS0811
02286,INF-PV PRIVE LA PAIX DE BONON,2301,PV,SSSSSSSSSSSSSSSSSSSSSSSSSSSSSSSS2286
00814,INF-PV PRIVE LE MAJOR DE BOUAFLE,2301,PV,SSSSSSSSSSSSSSSSSSSSSSSSSSSSSSSS0814
02644,INF-PV PRIVE LE PARTAGE DE BOUAFLE,2301,PV,SSSSSSSSSSSSSSSSSSSSSSSSSSSSSSSS2644
02672,INF-PV PRIVE SOLIDARITÉ DE BOUAFLE,2301,PV,SSSSSSSSSSSSSSSSSSSSSSSSSSSSSSSS2672
00194,CENTRE MEDICO CHIRURGICAL KENEYA,2302,PV,SSSSSSSSSSSSSSSSSSSSSSSSSSSSSSSS0194
00421,CLINIQUE DE BELEM DE YAOKRO,2302,PV,SSSSSSSSSSSSSSSSSSSSSSSSSSSSSSSS0421
00707,CLINIQUE SIEMO DE YAOKRO,2302,PV,SSSSSSSSSSSSSSSSSSSSSSSSSSSSSSSS0707
01646,CSR-D PUBLIC DE BINOUFLA,2302,PB,SSSSSSSSSSSSSSSSSSSSSSSSSSSSSSSS1646
03339,CSR-D PUBLIC DE GBRIZOKRO,2302,PB,
01884,CSR-D PUBLIC DE MANOUFLA,2302,PB,SSSSSSSSSSSSSSSSSSSSSSSSSSSSSSSS1884
03264,CSR-D PUBLIC DE TIEZANKRO3,2302,PB,
03263,CSR-DM PUBLIC DE BRUNOKRO,2302,PB,
01645,CSR-DM PUBLIC DE DJENEDOUFLA,2302,PB,SSSSSSSSSSSSSSSSSSSSSSSSSSSSSSSS1645
00780,CSR-DM PUBLIC DE HUAFLA,2302,PB,SSSSSSSSSSSSSSSSSSSSSSSSSSSSSSSS0780
01566,CSR-DM PUBLIC DE KAYETA,2302,PB,SSSSSSSSSSSSSSSSSSSSSSSSSSSSSSSS1566
00946,CSR-DM PUBLIC DE KPANGBASSOU,2302,PB,SSSSSSSSSSSSSSSSSSSSSSSSSSSSSSSS0946
03252,CSR-DM PUBLIC DE YAOKRO,2302,PB,
01212,CSU-D CONFESSIONNEL DMCR DE SINFRA,2302,PV,SSSSSSSSSSSSSSSSSSSSSSSSSSSSSSSS1212
01206,CSU-DM PUBLIC DE BAZRE,2302,PB,SSSSSSSSSSSSSSSSSSSSSSSSSSSSSSSS1206
01209,CSU-DM PUBLIC DE KONONFLA,2302,PB,SSSSSSSSSSSSSSSSSSSSSSSSSSSSSSSS1209
00203,CSU-DM PUBLIC DE KOUETINFLA,2302,PB,SSSSSSSSSSSSSSSSSSSSSSSSSSSSSSSS0203
02728,CSUS-CDV COMMUNAUTAIRE DE SINFRA,2302,PB,SSSSSSSSSSSSSSSSSSSSSSSSSSSSSSSS2728
09834,CSUS-PMI PUBLIC DE SINFRA,2302,PB,SSSSSSSSSSSSSSSSSSSSSSSSSSSSSSSS9834
09833,CSUS-SSSU PUBLIC DE SINFRA,2302,PB,SSSSSSSSSSSSSSSSSSSSSSSSSSSSSSSS9833
01211,HG PUBLIC DE SINFRA,2302,PB,SSSSSSSSSSSSSSSSSSSSSSSSSSSSSSSS1211
07147,INF-PV PRIVE ESPOIR SANTÉ DE SINFRA,2302,PV,SSSSSSSSSSSSSSSSSSSSSSSSSSSSSSSS7147
07146,INF-PV PRIVE HUMANITÉ DE SINFRA,2302,PV,SSSSSSSSSSSSSSSSSSSSSSSSSSSSSSSS7146
07143,INF-PV PRIVE LA FAMILLE DE SINFRA,2302,PV,SSSSSSSSSSSSSSSSSSSSSSSSSSSSSSSS7143
07148,INF-PV PRIVE REMEDS DE SINFRA,2302,PV,SSSSSSSSSSSSSSSSSSSSSSSSSSSSSSSS7148
01914,ONG LAFED DE SINFRA,2302,PV,SSSSSSSSSSSSSSSSSSSSSSSSSSSSSSSS1914
03349,CENTRE DE SOINS INFIRMIER SAINT RAPHAEL,2303,PV,
03458,CENTRE DE SOINS INFIRMIERS SORAYA,2303,PV,
08807,CMS PRIVE COMPLEXE SUCRIER DE ZUENOULA,2303,PV,SSSSSSSSSSSSSSSSSSSSSSSSSSSSSSSS8807
00336,CSR-DM PUBLIC DE FLAYA,2303,PB,SSSSSSSSSSSSSSSSSSSSSSSSSSSSSSSS0336
02675,CSR-D PUBLIC DE GROHOUNFLA,2303,PB,SSSSSSSSSSSSSSSSSSSSSSSSSSSSSSSS2675
03350,CSR-D PUBLIC DE VAAFLA (DIST. ZUENOULA),2303,PB,
01659,CSR-DM PUBLIC DE ZIRIFLA,2303,PB,SSSSSSSSSSSSSSSSSSSSSSSSSSSSSSSS1659
01391,CSR-DM PUBLIC DE ZRALUO,2303,PB,SSSSSSSSSSSSSSSSSSSSSSSSSSSSSSSS1391
01392,CSR-DM PUBLIC DE BEZIAKA,2303,PB,SSSSSSSSSSSSSSSSSSSSSSSSSSSSSSSS1392
00781,CSR-DM PUBLIC DE BINZRA,2303,PB,SSSSSSSSSSSSSSSSSSSSSSSSSSSSSSSS0781
02674,CSR-DM PUBLIC DE BOHIZRA,2303,PB,SSSSSSSSSSSSSSSSSSSSSSSSSSSSSSSS2674
01657,CSR-DM PUBLIC DE DHEZRA,2303,PB,SSSSSSSSSSSSSSSSSSSSSSSSSSSSSSSS1657
02140,CSR-DM PUBLIC DE GLOAZRA,2303,PB,SSSSSSSSSSSSSSSSSSSSSSSSSSSSSSSS2140
02754,CSR-DM PUBLIC DE GOUNGA,2303,PB,SSSSSSSSSSSSSSSSSSSSSSSSSSSSSSSS2754
08808,CSR-DM PUBLIC DE IRIEFLA,2303,PB,SSSSSSSSSSSSSSSSSSSSSSSSSSSSSSSS8808
00803,CSR-DM PUBLIC DE MANFLA,2303,PB,SSSSSSSSSSSSSSSSSSSSSSSSSSSSSSSS0803
00972,CSR-DM PUBLIC DE MINFLA,2303,PB,SSSSSSSSSSSSSSSSSSSSSSSSSSSSSSSS0972
01393,CSR-DM PUBLIC DE PAOUFLA,2303,PB,SSSSSSSSSSSSSSSSSSSSSSSSSSSSSSSS1393
01395,CSR-DM PUBLIC DE ZANZRA,2303,PB,SSSSSSSSSSSSSSSSSSSSSSSSSSSSSSSS1395
02676,CSR-D PUBLIC DE ZIDUHO-BOUENOU,2303,PB,SSSSSSSSSSSSSSSSSSSSSSSSSSSSSSSS2676
00267,CSR-DM PUBLIC DE ZOROFLA,2303,PB,SSSSSSSSSSSSSSSSSSSSSSSSSSSSSSSS0267
00782,CSR-DM PUBLIC DE ZOUGOUNEFLA,2303,PB,SSSSSSSSSSSSSSSSSSSSSSSSSSSSSSSS0782
02753,CSR-M PUBLIC DE BAZRAA,2303,PB,SSSSSSSSSSSSSSSSSSSSSSSSSSSSSSSS2753
01389,CSU-DM PUBLIC DE GOHITAFLA,2303,PB,SSSSSSSSSSSSSSSSSSSSSSSSSSSSSSSS1389
00265,CSU-DM PUBLIC DE KANZRA,2303,PB,SSSSSSSSSSSSSSSSSSSSSSSSSSSSSSSS0265
01517,CSU-DM PUBLIC DE MAMINIGUI,2303,PB,SSSSSSSSSSSSSSSSSSSSSSSSSSSSSSSS1517
01394,CSU-DM PUBLIC DE VOUEBOUFLA,2303,PB,SSSSSSSSSSSSSSSSSSSSSSSSSSSSSSSS1394
00616,CSUS-PMI PUBLIC DE ZUENOULA,2303,PB,SSSSSSSSSSSSSSSSSSSSSSSSSSSSSSSS0616
06797,CSUS-SSSU PUBLIC DE ZUENOULA,2303,PB,SSSSSSSSSSSSSSSSSSSSSSSSSSSSSSSS6797
01396,HG PUBLIC DE ZUENOULA,2303,PB,SSSSSSSSSSSSSSSSSSSSSSSSSSSSSSSS1396
03267,INF-PV PRIVEE LA VIE DE ZUENOULA,2303,PV,
01793,ONG FEMME ACTIVE DE CÔTE D' IVOIRE (FACCI),2303,PV,SSSSSSSSSSSSSSSSSSSSSSSSSSSSSSSS1793
02720,CMS PUBLIC DE ADZOPE,2401,PB,SSSSSSSSSSSSSSSSSSSSSSSSSSSSSSSS2720
01757,CSR-D PUBLIC DE AHOKOI,2401,PB,SSSSSSSSSSSSSSSSSSSSSSSSSSSSSSSS1757
01565,CSR-D PUBLIC DE BASSADZIN,2401,PB,SSSSSSSSSSSSSSSSSSSSSSSSSSSSSSSS1565
01486,CSR-D PUBLIC DE BIASSO,2401,PB,SSSSSSSSSSSSSSSSSSSSSSSSSSSSSSSS1486
02845,CSR-D PUBLIC DE BOAPE,2401,PB,SSSSSSSSSSSSSSSSSSSSSSSSSSSSSSSS2845
03489,CSR-D PUBLIC DE MASSANDJI,2401,PB,
01548,CSR-D PUBLIC DE N'KOUPE,2401,PB,SSSSSSSSSSSSSSSSSSSSSSSSSSSSSSSS1548
03290,CSR-DM PUBLIC D' AHOUABO,2401,PB,
01523,CSR-DM PUBLIC DE ABIE,2401,PB,SSSSSSSSSSSSSSSSSSSSSSSSSSSSSSSS1523
00369,CSR-DM PUBLIC DE ANANGUIE (S/P ADZOPE),2401,PB,SSSSSSSSSSSSSSSSSSSSSSSSSSSSSSSS0369
00378,CSR-DM PUBLIC DE ANDE (S/P ANDE),2401,PB,SSSSSSSSSSSSSSSSSSSSSSSSSSSSSSSS0378
00382,CSR-DM PUBLIC DE BOUDEPE,2401,PB,SSSSSSSSSSSSSSSSSSSSSSSSSSSSSSSS0382
00129,CSR-DM PUBLIC DE DIAPE,2401,PB,SSSSSSSSSSSSSSSSSSSSSSSSSSSSSSSS0129
00372,CSR-DM PUBLIC DE DIASSON,2401,PB,SSSSSSSSSSSSSSSSSSSSSSSSSSSSSSSS0372
00374,CSR-DM PUBLIC DE DUQUESNE CREMONE,2401,PB,SSSSSSSSSSSSSSSSSSSSSSSSSSSSSSSS0374
00383,CSR-DM PUBLIC DE GRAND-AKOUDZIN,2401,PB,SSSSSSSSSSSSSSSSSSSSSSSSSSSSSSSS0383
00109,CSR-DM PUBLIC DE LOBO-AKOUDZIN,2401,PB,SSSSSSSSSSSSSSSSSSSSSSSSSSSSSSSS0109
02444,CSR-DM PUBLIC DE MIADZIN,2401,PB,SSSSSSSSSSSSSSSSSSSSSSSSSSSSSSSS2444
01366,CSR-DM PUBLIC DE MOAPE,2401,PB,SSSSSSSSSSSSSSSSSSSSSSSSSSSSSSSS1366
03493,CSR-DM PUBLIC DE NYAN,2401,PB,
00385,CSR-DM PUBLIC DE YAKASSE ME,2401,PB,SSSSSSSSSSSSSSSSSSSSSSSSSSSSSSSS0385
00370,CSR-M PUBLIC DE ANNEPE,2401,PB,SSSSSSSSSSSSSSSSSSSSSSSSSSSSSSSS0370
08110,CSR-M PUBLIC DE BECEDI ANON,2401,PB,SSSSSSSSSSSSSSSSSSSSSSSSSSSSSSSS8110
00376,CSU-DM PUBLIC DE AGOU,2401,PB,SSSSSSSSSSSSSSSSSSSSSSSSSSSSSSSS0376
00371,CSU-DM PUBLIC DE ASSIKOI,2401,PB,SSSSSSSSSSSSSSSSSSSSSSSSSSSSSSSS0371
00380,CSU-DM PUBLIC DE BECEDI BRIGNAN,2401,PB,SSSSSSSSSSSSSSSSSSSSSSSSSSSSSSSS0380
01738,CSUS-CAT PUBLIC DE ADZOPE,2401,PB,SSSSSSSSSSSSSSSSSSSSSSSSSSSSSSSS1738
00364,CSUS-LEP PUBLIC INSTITUT RAOUL FOLLEREAU DE ADZOPE,2401,PB,SSSSSSSSSSSSSSSSSSSSSSSSSSSSSSSS0364
01528,CSUS-PMI PUBLIC DE ADZOPE,2401,PB,SSSSSSSSSSSSSSSSSSSSSSSSSSSSSSSS1528
00365,CSUS-SSSU PUBLIC DE ADZOPE,2401,PB,SSSSSSSSSSSSSSSSSSSSSSSSSSSSSSSS0365
00363,HG PUBLIC DE ADZOPE,2401,PB,SSSSSSSSSSSSSSSSSSSSSSSSSSSSSSSS0363
02462,INF-LC PUBLIC LYCÉE MODERNE DE ADZOPE,2401,PB,SSSSSSSSSSSSSSSSSSSSSSSSSSSSSSSS2462
02463,INF-LC PUBLIC LYCÉE MODERNE DE AGOU,2401,PB,SSSSSSSSSSSSSSSSSSSSSSSSSSSSSSSS2463
02354,INF-P DE LA MAISON D'ARRÊT DE ADZOPE,2401,PB,SSSSSSSSSSSSSSSSSSSSSSSSSSSSSSSS2354
00280,INF-PV PRIVE SAINT THOMAS HABITAT EXTENSION DE ADZ,2401,PV,SSSSSSSSSSSSSSSSSSSSSSSSSSSSSSSS0280
03291,NOUVELLE CLINIQUE SAINT JOSEPH,2401,PV,
04170,CSR-D PUBLIC DE AGBAHOU (S/P AKOUPÉ),2402,PB,SSSSSSSSSSSSSSSSSSSSSSSSSSSSSSSS4170
09820,CSR-D PUBLIC DE AHEOUA,2402,PB,SSSSSSSSSSSSSSSSSSSSSSSSSSSSSSSS9820
00388,CSR-D PUBLIC DE ASSEUDJI,2402,PB,SSSSSSSSSSSSSSSSSSSSSSSSSSSSSSSS0388
01563,CSR-D PUBLIC DE ASSIKOUN,2402,PB,SSSSSSSSSSSSSSSSSSSSSSSSSSSSSSSS1563
01717,CSR-D PUBLIC DE BONANHOUIN,2402,PB,SSSSSSSSSSSSSSSSSSSSSSSSSSSSSSSS1717
09756,CSR-D PUBLIC DE SORIBADOUGOU (DIST. AKOUPE),2402,PB,SSSSSSSSSSSSSSSSSSSSSSSSSSSSSSSS9756
00640,CSR-DM PUBLIC DE BACON,2402,PB,SSSSSSSSSSSSSSSSSSSSSSSSSSSSSSSS0640
01564,CSR-DM PUBLIC DE YADIO,2402,PB,SSSSSSSSSSSSSSSSSSSSSSSSSSSSSSSS1564
00415,CSR-M PUBLIC DE ASSANGBADJI,2402,PB,SSSSSSSSSSSSSSSSSSSSSSSSSSSSSSSS0415
00375,CSU-DM PUBLIC DE AFFERY,2402,PB,SSSSSSSSSSSSSSSSSSSSSSSSSSSSSSSS0375
02719,CSU-DM PUBLIC DE BANACOMOE,2402,PB,SSSSSSSSSSSSSSSSSSSSSSSSSSSSSSSS2719
00389,CSU-DM PUBLIC DE BECOUEFIN,2402,PB,SSSSSSSSSSSSSSSSSSSSSSSSSSSSSSSS0389
09757,CSUS-SSSU PUBLIC D' AKOUPE,2402,PB,SSSSSSSSSSSSSSSSSSSSSSSSSSSSSSSS9757
00386,HG PUBLIC DE AKOUPE,2402,PB,SSSSSSSSSSSSSSSSSSSSSSSSSSSSSSSS0386
00008,CMS PUBLIC SAN BONIFACIO DE DOMOLON,2403,PB,SSSSSSSSSSSSSSSSSSSSSSSSSSSSSSSS0008
03454,CSR-D PUBLIC D' ABROTCHY,2403,PB,
03453,CSR-D PUBLIC D' ALLOSSO 1,2403,PB,
02741,CSR-D PUBLIC DE ALLOSSO II,2403,PB,SSSSSSSSSSSSSSSSSSSSSSSSSSSSSSSS2741
00183,CSR-D PUBLIC DE DZEUDJI,2403,PB,SSSSSSSSSSSSSSSSSSSSSSSSSSSSSSSS0183
00175,CSR-D PUBLIC DE KOSSANDJI,2403,PB,SSSSSSSSSSSSSSSSSSSSSSSSSSSSSSSS0175
00169,CSR-D PUBLIC DE MOPODJI,2403,PB,SSSSSSSSSSSSSSSSSSSSSSSSSSSSSSSS0169
03452,CSR-D PUBLIC DE N'ZEREKOU,2403,PB,
06688,CSR-D PUBLIC DE YAKASSE-COMOE,2403,PB,SSSSSSSSSSSSSSSSSSSSSSSSSSSSSSSS6688
00162,CSR-DM PUBLIC DE ABOISSO-COMOE,2403,PB,SSSSSSSSSSSSSSSSSSSSSSSSSSSSSSSS0162
00146,CSR-DM PUBLIC DE AHOUTOUE,2403,PB,SSSSSSSSSSSSSSSSSSSSSSSSSSSSSSSS0146
00164,CSR-DM PUBLIC DE AKOURE,2403,PB,SSSSSSSSSSSSSSSSSSSSSSSSSSSSSSSS0164
00167,CSR-DM PUBLIC DE ANDOU M'BATTO,2403,PB,SSSSSSSSSSSSSSSSSSSSSSSSSSSSSSSS0167
00168,CSR-DM PUBLIC DE DANGUIRA,2403,PB,SSSSSSSSSSSSSSSSSSSSSSSSSSSSSSSS0168
00170,CSR-DM PUBLIC DE GRAND-ALEPE,2403,PB,SSSSSSSSSSSSSSSSSSSSSSSSSSSSSSSS0170
00173,CSR-DM PUBLIC DE KODIOUSSOU,2403,PB,SSSSSSSSSSSSSSSSSSSSSSSSSSSSSSSS0173
03173,CSR-DM PUBLIC DE KOUTOUKRO 2,2403,PB,SSSSSSSSSSSSSSSSSSSSSSSSSSSSSSSS3173
00178,CSR-DM PUBLIC DE MONGA,2403,PB,SSSSSSSSSSSSSSSSSSSSSSSSSSSSSSSS0178
00181,CSR-DM PUBLIC DE MONTEZO,2403,PB,SSSSSSSSSSSSSSSSSSSSSSSSSSSSSSSS0181
02549,CSR-DM PUBLIC DE MOTOBE (DIST. ALEPE),2403,PB,SSSSSSSSSSSSSSSSSSSSSSSSSSSSSSSS2549
01995,CSU-DM CONFESSIONNEL CESDA DE ALEPE,2403,PB,SSSSSSSSSSSSSSSSSSSSSSSSSSSSSSSS1995
00176,CSU-DM PUBLIC DE MEMNI,2403,PB,SSSSSSSSSSSSSSSSSSSSSSSSSSSSSSSS0176
00184,CSU-DM PUBLIC DE OGHLWAPO,2403,PB,SSSSSSSSSSSSSSSSSSSSSSSSSSSSSSSS0184
01759,CSUS-SSSU PUBLIC DE ALEPE,2403,PB,SSSSSSSSSSSSSSSSSSSSSSSSSSSSSSSS1759
00165,HG PUBLIC DE ALEPE,2403,PB,SSSSSSSSSSSSSSSSSSSSSSSSSSSSSSSS0165
03292,CENTRE DE SOINS INFIRMIERS D'ASSIE-ORIE,2404,PV,
03497,CENTRE MEDICAL SAINTE MARIE DE YAKASSE-ATTOBROU,2404,PV,
02988,CSR-D PUBLIC D' ABRADINE 1,2404,PB,SSSSSSSSSSSSSSSSSSSSSSSSSSSSSSSS2988
03182,CSR-D PUBLIC D'ADJAME (DIST. YAKASSE-ATTOBROU),2404,PB,SSSSSSSSSSSSSSSSSSSSSSSSSSSSSSSS3182
02663,CSR-D PUBLIC DE AHUKOI,2404,PB,SSSSSSSSSSSSSSSSSSSSSSSSSSSSSSSS2663
08853,CSR-D PUBLIC DE DIANGOBO,2404,PB,SSSSSSSSSSSSSSSSSSSSSSSSSSSSSSSS8853
02624,CSR-D PUBLIC DE KONG (S/P YAKASSE ATTOBROU),2404,PB,SSSSSSSSSSSSSSSSSSSSSSSSSSSSSSSS2624
09755,CSR-DM PUBLIC DE MEBIFON (DIST. AKOUPE),2404,PB,SSSSSSSSSSSSSSSSSSSSSSSSSSSSSSSS9755
00201,CSU-D PUBLIC DE BIEBY,2404,PB,SSSSSSSSSSSSSSSSSSSSSSSSSSSSSSSS0201
00192,CSU-DM PUBLIC DE ABONGOUA (DIST. YAKASSE ATTOUBROU,2404,PB,SSSSSSSSSSSSSSSSSSSSSSSSSSSSSSSS0192
03154,CSUS-SSSU PUBLIC DE YAKASSE-ATTOBROU,2404,PB,SSSSSSSSSSSSSSSSSSSSSSSSSSSSSSSS3154
00391,HG PUBLIC DE YAKASSE ATTOBROU,2404,PB,SSSSSSSSSSSSSSSSSSSSSSSSSSSSSSSS0391
03248,CLINIQUE N'GOUAN DE KOTOBI,2501,PV,
00510,CSR-D CONFESSIONNEL CHARITÉ DE KOTOBI,2501,PV,SSSSSSSSSSSSSSSSSSSSSSSSSSSSSSSS0510
00690,CSR-D PUBLIC DE BROU-ATTAKRO,2501,PB,SSSSSSSSSSSSSSSSSSSSSSSSSSSSSSSS0690
03247,CSR-D PUBLIC DE DALOSSO,2501,PB,
00694,CSR-D PUBLIC DE ERROBO,2501,PB,SSSSSSSSSSSSSSSSSSSSSSSSSSSSSSSS0694
02300,CSR-D PUBLIC DE KOUADIOKRO (S/P ARRAH),2501,PB,SSSSSSSSSSSSSSSSSSSSSSSSSSSSSSSS2300
03246,CSR-D PUBLIC DE YAFFO AGNI,2501,PB,
01804,CSR-DM PUBLIC DE ASSALE KOUASSIKRO,2501,PB,SSSSSSSSSSSSSSSSSSSSSSSSSSSSSSSS1804
08840,CSR-M PUBLIC DE N'ZAFOUENOU,2501,PB,SSSSSSSSSSSSSSSSSSSSSSSSSSSSSSSS8840
00507,CSU PUBLIC DE ABONGOUA,2501,PB,SSSSSSSSSSSSSSSSSSSSSSSSSSSSSSSS0507
00368,CSU-D CONFESSIONNEL SAINT MICHEL DE ARRAH,2501,PV,SSSSSSSSSSSSSSSSSSSSSSSSSSSSSSSS0368
00511,CSU-DM PUBLIC DE KREGBE,2501,PB,SSSSSSSSSSSSSSSSSSSSSSSSSSSSSSSS0511
00509,HG PUBLIC DE ARRAH,2501,PB,SSSSSSSSSSSSSSSSSSSSSSSSSSSSSSSS0509
02925,CABINET D’OPTICIEN-LUNETIER OPTIQUE PHARMA-CI,2502,PV,SSSSSSSSSSSSSSSSSSSSSSSSSSSSSSSS2925
02303,CMS PRIVE COOPENCO DE BONGOUANOU,2502,PV,SSSSSSSSSSSSSSSSSSSSSSSSSSSSSSSS2303
02213,CSR-D PUBLIC D'ABOUSSOUNOU BRACODI,2502,PB,SSSSSSSSSSSSSSSSSSSSSSSSSSSSSSSS2213
07111,CSR-D PUBLIC DE AGNALIESSOU,2502,PB,SSSSSSSSSSSSSSSSSSSSSSSSSSSSSSSS7111
03369,CSR-D PUBLIC DE AHOROSSO,2502,PB,
01573,CSR-D PUBLIC DE AHOUNIENFOUTOU,2502,PB,SSSSSSSSSSSSSSSSSSSSSSSSSSSSSSSS1573
03131,CSR-D PUBLIC DE ALLANGBAKRO,2502,PB,SSSSSSSSSSSSSSSSSSSSSSSSSSSSSSSS3131
03130,CSR-D PUBLIC DE ASSIE ASSASSO,2502,PB,SSSSSSSSSSSSSSSSSSSSSSSSSSSSSSSS3130
03368,CSR-D PUBLIC DE ASSIE-KOKORE,2502,PB,
03129,CSR-D PUBLIC DE BANABO,2502,PB,SSSSSSSSSSSSSSSSSSSSSSSSSSSSSSSS3129
02302,CSR-D PUBLIC DE BOCASSI (S/P BONGOUANOU),2502,PB,SSSSSSSSSSSSSSSSSSSSSSSSSSSSSSSS2302
00075,CSR-D PUBLIC DE FRONOBO,2502,PB,SSSSSSSSSSSSSSSSSSSSSSSSSSSSSSSS0075
03367,CSR-D PUBLIC DE KINIMOKRO,2502,PB,
03132,CSR-D PUBLIC DE N' DOLIKRO,2502,PB,SSSSSSSSSSSSSSSSSSSSSSSSSSSSSSSS3132
00692,CSR-D PUBLIC DE TANOSSO,2502,PB,SSSSSSSSSSSSSSSSSSSSSSSSSSSSSSSS0692
00086,CSR-DM PUBLIC DE AGBOSSOU,2502,PB,SSSSSSSSSSSSSSSSSSSSSSSSSSSSSSSS0086
00513,CSR-DM PUBLIC DE AGOUA,2502,PB,SSSSSSSSSSSSSSSSSSSSSSSSSSSSSSSS0513
01420,CSR-DM PUBLIC DE AKAKRO,2502,PB,SSSSSSSSSSSSSSSSSSSSSSSSSSSSSSSS1420
01807,CSR-DM PUBLIC DE ASSAOUFOUE,2502,PB,SSSSSSSSSSSSSSSSSSSSSSSSSSSSSSSS1807
00517,CSR-DM PUBLIC DE ASSIE KOUMASSI,2502,PB,SSSSSSSSSSSSSSSSSSSSSSSSSSSSSSSS0517
00128,CSR-DM PUBLIC DE BOUADIKRO,2502,PB,SSSSSSSSSSSSSSSSSSSSSSSSSSSSSSSS0128
00522,CSR-DM PUBLIC DE BROU AKPAOUSSOU,2502,PB,SSSSSSSSSSSSSSSSSSSSSSSSSSSSSSSS0522
00526,CSR-DM PUBLIC DE N'GUINOU,2502,PB,SSSSSSSSSSSSSSSSSSSSSSSSSSSSSSSS0526
02542,CSR-DM PUBLIC DE N'ZUEKOKORE,2502,PB,SSSSSSSSSSSSSSSSSSSSSSSSSSSSSSSS2542
00515,CSU-DM PUBLIC DE ANDE,2502,PB,SSSSSSSSSSSSSSSSSSSSSSSSSSSSSSSS0515
00955,CSU-DM PUBLIC DE KANKANDI,2502,PB,SSSSSSSSSSSSSSSSSSSSSSSSSSSSSSSS0955
00524,CSU-DM PUBLIC DE N'GUESSANKRO,2502,PB,SSSSSSSSSSSSSSSSSSSSSSSSSSSSSSSS0524
03429,CSUS-CAT PUBLIC DE BONGOUANOU,2502,PB,
02688,CSUS-SSSU PUBLIC DE BONGOUANOU,2502,PB,SSSSSSSSSSSSSSSSSSSSSSSSSSSSSSSS2688
00519,HG PUBLIC DE BONGOUANOU,2502,PB,SSSSSSSSSSSSSSSSSSSSSSSSSSSSSSSS0519
02143,INF-LC PRIVEE IEGT DE BONGOUANOU,2502,PV,SSSSSSSSSSSSSSSSSSSSSSSSSSSSSSSS2143
02355,INF-P PUBLIC PRISON CIVIL DE BONGOUANOU,2502,PB,SSSSSSSSSSSSSSSSSSSSSSSSSSSSSSSS2355
03124,CSR-D PUBLIC D' ALLAKRO-APPIAKRO,2503,PB,SSSSSSSSSSSSSSSSSSSSSSSSSSSSSSSS3124
03122,CSR-D PUBLIC DE  DIANGOBO,2503,PB,SSSSSSSSSSSSSSSSSSSSSSSSSSSSSSSS3122
02301,CSR-D PUBLIC DE  KOUADIOTEKRO (S/P TIÉMÉLÉKRO),2503,PB,SSSSSSSSSSSSSSSSSSSSSSSSSSSSSSSS2301
01719,CSR-D PUBLIC DE ADOUAKOUAKRO,2503,PB,SSSSSSSSSSSSSSSSSSSSSSSSSSSSSSSS1719
02601,CSR-D PUBLIC DE ALLONGO,2503,PB,SSSSSSSSSSSSSSSSSSSSSSSSSSSSSSSS2601
01991,CSR-D PUBLIC DE ANGBANOU,2503,PB,SSSSSSSSSSSSSSSSSSSSSSSSSSSSSSSS1991
02603,CSR-D PUBLIC DE DJEKADJOKRO,2503,PB,SSSSSSSSSSSSSSSSSSSSSSSSSSSSSSSS2603
